[I 2026-06-14 18:17:41,978] Trial 41 finished with value: 0.7468805704099821 and parameters: {'C': 1.0410202823648427, 'gamma': 'auto', 'kernel': 'sigmoid'}. Best is trial 14 with value: 0.7650623885918003.
[I 2026-06-14 18:17:41,987] Trial 36 finished with value: 0.6390374331550801 and parameters: {'C': 88.54830485515463, 'gamma': 'auto', 'kernel': 'poly'}. Best is trial 6 with value: 0.6629233511586453.
[I 2026-06-14 18:17:41,990] Trial 35 finished with value: 0.6028520499108734 and parameters: {'C': 8.24297520846653, 'gamma': 'auto', 'kernel': 'rbf'}. Best is trial 28 with value: 0.6028520499108734.
[I 2026-06-14 18:17:41,996] Trial 47 finished with value: 0.6085561497326204 and parameters: {'C': 12.088147580217885, 'gamma': 'scale', 'kernel': 'rbf'}. Best is trial 38 with value: 0.6506238859180036.
[I 2026-06-14 18:17:42,009] Trial 39 finished with value: 0.5910873440285205 and parameters: {'C': 2.9902485100205567, 'gamma': 'scale', 'kernel': 'poly'}. Best is trial 9 with value: 0.6388591800356506.
[I 2026-06-14 18:17:42,011] Trial 42 finished with value: 0.7406417112299465 and parameters: {'C': 2.940790468648448, 'gamma': 'auto', 'kernel': 'sigmoid'}. Best is trial 14 with value: 0.7650623885918003.
[I 2026-06-14 18:17:42,028] Trial 48 finished with value: 0.6322638146167557 and parameters: {'C': 2.8731328127701516, 'gamma': 'scale', 'kernel': 'rbf'}. Best is trial 38 with value: 0.6506238859180036.
[I 2026-06-14 18:17:42,032] Trial 37 finished with value: 0.6390374331550802 and parameters: {'C': 14.583509496323611, 'gamma': 'scale', 'kernel': 'rbf'}. Best is trial 6 with value: 0.6629233511586453.
[I 2026-06-14 18:17:42,040] Trial 36 finished with value: 0.6028520499108734 and parameters: {'C': 10.727246086043928, 'gamma': 'auto', 'kernel': 'rbf'}. Best is trial 28 with value: 0.6028520499108734.
[I 2026-06-14 18:17:42,052] Trial 43 finished with value: 0.7285204991087344 and parameters: {'C': 0.2778940825610565, 'gamma': 'auto', 'kernel': 'sigmoid'}. Best is trial 14 with value: 0.7650623885918003.
[I 2026-06-14 18:17:42,059] Trial 49 finished with value: 0.6506238859180036 and parameters: {'C': 0.9685373492841115, 'gamma': 'scale', 'kernel': 'rbf'}. Best is trial 38 with value: 0.6506238859180036.
[I 2026-06-14 18:17:42,061] Trial 40 finished with value: 0.49411764705882355 and parameters: {'C': 0.004747501155295006, 'gamma': 'auto', 'kernel': 'rbf'}. Best is trial 9 with value: 0.6388591800356506.
[I 2026-06-14 18:17:42,074] Trial 38 finished with value: 0.6021390374331551 and parameters: {'C': 30.216795657639857, 'gamma': 'auto', 'kernel': 'sigmoid'}. Best is trial 6 with value: 0.6629233511586453.
[I 2026-06-14 18:17:42,082] Trial 37 finished with value: 0.5657754010695186 and parameters: {'C': 14.59900807475567, 'gamma': 'scale', 'kernel': 'poly'}. Best is trial 28 with value: 0.6028520499108734.
[I 2026-06-14 18:17:42,086] Trial 44 finished with value: 0.6620320855614972 and parameters: {'C': 5.8287979229962055, 'gamma': 'auto', 'kernel': 'poly'}. Best is trial 14 with value: 0.7650623885918003.
[I 2026-06-14 18:17:42,092] Trial 8 finished with value: 0.5777183600713013 and parameters: {'C': 1.552692274847455, 'gamma': 'auto', 'kernel': 'sigmoid'}. Best is trial 5 with value: 0.6081996434937611.
[I 2026-06-14 18:17:42,097] Trial 50 finished with value: 0.6024955436720143 and parameters: {'C': 16.545468687657646, 'gamma': 'scale', 'kernel': 'rbf'}. Best is trial 38 with value: 0.6506238859180036.
[I 2026-06-14 18:17:42,104] Trial 41 finished with value: 0.6263814616755794 and parameters: {'C': 0.3793956960646158, 'gamma': 'auto', 'kernel': 'poly'}. Best is trial 9 with value: 0.6388591800356506.
[I 2026-06-14 18:17:42,120] Trial 39 finished with value: 0.6265597147950089 and parameters: {'C': 5.5068912558638115, 'gamma': 'scale', 'kernel': 'rbf'}. Best is trial 6 with value: 0.6629233511586453.
[I 2026-06-14 18:17:42,127] Trial 45 finished with value: 0.7468805704099821 and parameters: {'C': 0.6008996916864593, 'gamma': 'auto', 'kernel': 'sigmoid'}. Best is trial 14 with value: 0.7650623885918003.
[I 2026-06-14 18:17:42,130] Trial 51 finished with value: 0.6381461675579322 and parameters: {'C': 0.6639729419856203, 'gamma': 'scale', 'kernel': 'rbf'}. Best is trial 38 with value: 0.6506238859180036.
[I 2026-06-14 18:17:42,132] Trial 38 finished with value: 0.6089126559714795 and parameters: {'C': 2.138673526745169, 'gamma': 'auto', 'kernel': 'rbf'}. Best is trial 38 with value: 0.6089126559714795.
[I 2026-06-14 18:17:42,144] Trial 42 finished with value: 0.5971479500891266 and parameters: {'C': 1.043464764935948, 'gamma': 'auto', 'kernel': 'poly'}. Best is trial 9 with value: 0.6388591800356506.
[I 2026-06-14 18:17:42,161] Trial 2 finished with value: 0.5966131907308377 and parameters: {'C': 4.753782542019698, 'gamma': 'auto', 'kernel': 'poly'}. Best is trial 1 with value: 0.6445632798573975.
[I 2026-06-14 18:17:42,163] Trial 40 finished with value: 0.6329768270944742 and parameters: {'C': 45.492185697374154, 'gamma': 'auto', 'kernel': 'poly'}. Best is trial 6 with value: 0.6629233511586453.
[I 2026-06-14 18:17:42,165] Trial 52 finished with value: 0.6385026737967914 and parameters: {'C': 1.6482495342342993, 'gamma': 'scale', 'kernel': 'rbf'}. Best is trial 38 with value: 0.6506238859180036.
[I 2026-06-14 18:17:42,175] Trial 46 finished with value: 0.710873440285205 and parameters: {'C': 0.07588361508117426, 'gamma': 'auto', 'kernel': 'sigmoid'}. Best is trial 14 with value: 0.7650623885918003.
[I 2026-06-14 18:17:42,180] Trial 43 finished with value: 0.5244206773618538 and parameters: {'C': 0.1289312378150242, 'gamma': 'auto', 'kernel': 'poly'}. Best is trial 9 with value: 0.6388591800356506.
[I 2026-06-14 18:17:42,180] Trial 39 finished with value: 0.5547237076648841 and parameters: {'C': 0.359784955779435, 'gamma': 'scale', 'kernel': 'sigmoid'}. Best is trial 38 with value: 0.6089126559714795.
[I 2026-06-14 18:17:42,198] Trial 53 finished with value: 0.6445632798573975 and parameters: {'C': 1.122065904685607, 'gamma': 'scale', 'kernel': 'rbf'}. Best is trial 38 with value: 0.6506238859180036.
[I 2026-06-14 18:17:42,209] Trial 41 finished with value: 0.6450980392156863 and parameters: {'C': 30.341191537868564, 'gamma': 'scale', 'kernel': 'rbf'}. Best is trial 6 with value: 0.6629233511586453.
[I 2026-06-14 18:17:42,213] Trial 44 finished with value: 0.638324420677362 and parameters: {'C': 0.4102147377639637, 'gamma': 'auto', 'kernel': 'poly'}. Best is trial 9 with value: 0.6388591800356506.
[I 2026-06-14 18:17:42,214] Trial 47 finished with value: 0.7408199643493761 and parameters: {'C': 1.1708102472577226, 'gamma': 'scale', 'kernel': 'sigmoid'}. Best is trial 14 with value: 0.7650623885918003.
[I 2026-06-14 18:17:42,217] Trial 40 finished with value: 0.5483065953654189 and parameters: {'C': 0.2815407427838634, 'gamma': 'auto', 'kernel': 'poly'}. Best is trial 38 with value: 0.6089126559714795.
[I 2026-06-14 18:17:42,228] Trial 54 finished with value: 0.6142602495543672 and parameters: {'C': 0.4277170951992147, 'gamma': 'scale', 'kernel': 'rbf'}. Best is trial 38 with value: 0.6506238859180036.
[I 2026-06-14 18:17:42,254] Trial 48 finished with value: 0.65650623885918 and parameters: {'C': 3.113896363351528, 'gamma': 'auto', 'kernel': 'rbf'}. Best is trial 14 with value: 0.7650623885918003.
[I 2026-06-14 18:17:42,254] Trial 42 finished with value: 0.6390374331550802 and parameters: {'C': 18.17523013765281, 'gamma': 'scale', 'kernel': 'rbf'}. Best is trial 6 with value: 0.6629233511586453.
[I 2026-06-14 18:17:42,257] Trial 45 finished with value: 0.603030303030303 and parameters: {'C': 0.5180569672097658, 'gamma': 'scale', 'kernel': 'sigmoid'}. Best is trial 9 with value: 0.6388591800356506.
[I 2026-06-14 18:17:42,263] Trial 55 finished with value: 0.6322638146167557 and parameters: {'C': 0.7380693126821041, 'gamma': 'scale', 'kernel': 'rbf'}. Best is trial 38 with value: 0.6506238859180036.
[I 2026-06-14 18:17:42,266] Trial 41 finished with value: 0.6028520499108734 and parameters: {'C': 9.735284302452722, 'gamma': 'auto', 'kernel': 'rbf'}. Best is trial 38 with value: 0.6089126559714795.
[I 2026-06-14 18:17:42,278] Trial 9 finished with value: 0.5122994652406417 and parameters: {'C': 0.16963299518555391, 'gamma': 'auto', 'kernel': 'poly'}. Best is trial 5 with value: 0.6081996434937611.
[I 2026-06-14 18:17:42,292] Trial 49 finished with value: 0.6563279857397504 and parameters: {'C': 8.185436097685002, 'gamma': 'auto', 'kernel': 'poly'}. Best is trial 14 with value: 0.7650623885918003.
[I 2026-06-14 18:17:42,295] Trial 56 finished with value: 0.6324420677361854 and parameters: {'C': 2.6589808769017726, 'gamma': 'scale', 'kernel': 'rbf'}. Best is trial 38 with value: 0.6506238859180036.
[I 2026-06-14 18:17:42,298] Trial 46 finished with value: 0.6388591800356506 and parameters: {'C': 0.9945290040505983, 'gamma': 'scale', 'kernel': 'rbf'}. Best is trial 9 with value: 0.6388591800356506.
[I 2026-06-14 18:17:42,298] Trial 43 finished with value: 0.6450980392156863 and parameters: {'C': 57.50406506787044, 'gamma': 'scale', 'kernel': 'rbf'}. Best is trial 6 with value: 0.6629233511586453.
[I 2026-06-14 18:17:42,314] Trial 42 finished with value: 0.566488413547237 and parameters: {'C': 1.5819098843369772, 'gamma': 'auto', 'kernel': 'rbf'}. Best is trial 38 with value: 0.6089126559714795.
[I 2026-06-14 18:17:42,327] Trial 57 finished with value: 0.5907308377896613 and parameters: {'C': 4.633254969387566, 'gamma': 'scale', 'kernel': 'rbf'}. Best is trial 38 with value: 0.6506238859180036.
[I 2026-06-14 18:17:42,335] Trial 50 finished with value: 0.48770053475935826 and parameters: {'C': 0.0013408848596256516, 'gamma': 'auto', 'kernel': 'sigmoid'}. Best is trial 14 with value: 0.7650623885918003.
[I 2026-06-14 18:17:42,339] Trial 47 finished with value: 0.6149732620320856 and parameters: {'C': 1.1208273528932353, 'gamma': 'scale', 'kernel': 'rbf'}. Best is trial 9 with value: 0.6388591800356506.
[I 2026-06-14 18:17:42,343] Trial 44 finished with value: 0.620855614973262 and parameters: {'C': 9.056111669748752, 'gamma': 'scale', 'kernel': 'rbf'}. Best is trial 6 with value: 0.6629233511586453.
[I 2026-06-14 18:17:42,362] Trial 43 finished with value: 0.5846702317290553 and parameters: {'C': 2.7435867204677455, 'gamma': 'auto', 'kernel': 'rbf'}. Best is trial 38 with value: 0.6089126559714795.
[I 2026-06-14 18:17:42,366] Trial 58 finished with value: 0.6445632798573975 and parameters: {'C': 1.1491862116454967, 'gamma': 'scale', 'kernel': 'rbf'}. Best is trial 38 with value: 0.6506238859180036.
[I 2026-06-14 18:17:42,372] Trial 51 finished with value: 0.7408199643493761 and parameters: {'C': 0.5565368849055634, 'gamma': 'auto', 'kernel': 'sigmoid'}. Best is trial 14 with value: 0.7650623885918003.
[I 2026-06-14 18:17:42,382] Trial 48 finished with value: 0.6026737967914438 and parameters: {'C': 7.074440169478927, 'gamma': 'scale', 'kernel': 'rbf'}. Best is trial 9 with value: 0.6388591800356506.
[I 2026-06-14 18:17:42,386] Trial 45 finished with value: 0.6450980392156863 and parameters: {'C': 35.48096701094856, 'gamma': 'scale', 'kernel': 'rbf'}. Best is trial 6 with value: 0.6629233511586453.
[I 2026-06-14 18:17:42,397] Trial 59 finished with value: 0.6144385026737968 and parameters: {'C': 0.5242738943583515, 'gamma': 'scale', 'kernel': 'rbf'}. Best is trial 38 with value: 0.6506238859180036.
[I 2026-06-14 18:17:42,409] Trial 52 finished with value: 0.7590017825311943 and parameters: {'C': 0.7298320166016583, 'gamma': 'auto', 'kernel': 'sigmoid'}. Best is trial 14 with value: 0.7650623885918003.
[I 2026-06-14 18:17:42,411] Trial 44 finished with value: 0.5969696969696969 and parameters: {'C': 18.838935247381595, 'gamma': 'auto', 'kernel': 'rbf'}. Best is trial 38 with value: 0.6089126559714795.
[I 2026-06-14 18:17:42,422] Trial 46 finished with value: 0.6017825311942959 and parameters: {'C': 94.34811794171884, 'gamma': 'scale', 'kernel': 'sigmoid'}. Best is trial 6 with value: 0.6629233511586453.
[I 2026-06-14 18:17:42,424] Trial 49 finished with value: 0.6204991087344028 and parameters: {'C': 2.117170861757984, 'gamma': 'scale', 'kernel': 'rbf'}. Best is trial 9 with value: 0.6388591800356506.
[I 2026-06-14 18:17:42,429] Trial 60 finished with value: 0.6385026737967914 and parameters: {'C': 0.8124036558247727, 'gamma': 'scale', 'kernel': 'rbf'}. Best is trial 38 with value: 0.6506238859180036.
[I 2026-06-14 18:17:42,452] Trial 53 finished with value: 0.7285204991087344 and parameters: {'C': 0.2754370760512088, 'gamma': 'auto', 'kernel': 'sigmoid'}. Best is trial 14 with value: 0.7650623885918003.
[I 2026-06-14 18:17:42,462] Trial 61 finished with value: 0.6443850267379678 and parameters: {'C': 1.2387774665829545, 'gamma': 'scale', 'kernel': 'rbf'}. Best is trial 38 with value: 0.6506238859180036.
[I 2026-06-14 18:17:42,465] Trial 45 finished with value: 0.6028520499108734 and parameters: {'C': 6.876215653697167, 'gamma': 'auto', 'kernel': 'rbf'}. Best is trial 38 with value: 0.6089126559714795.
[I 2026-06-14 18:17:42,465] Trial 50 finished with value: 0.6089126559714795 and parameters: {'C': 0.8368182548583886, 'gamma': 'scale', 'kernel': 'rbf'}. Best is trial 9 with value: 0.6388591800356506.
[I 2026-06-14 18:17:42,465] Trial 47 finished with value: 0.6146167557932264 and parameters: {'C': 1.5795399502159706, 'gamma': 'auto', 'kernel': 'rbf'}. Best is trial 6 with value: 0.6629233511586453.
[I 2026-06-14 18:17:42,490] Trial 54 finished with value: 0.73475935828877 and parameters: {'C': 0.8680165162085772, 'gamma': 'auto', 'kernel': 'sigmoid'}. Best is trial 14 with value: 0.7650623885918003.
[I 2026-06-14 18:17:42,497] Trial 62 finished with value: 0.6506238859180036 and parameters: {'C': 2.31847986624732, 'gamma': 'scale', 'kernel': 'rbf'}. Best is trial 38 with value: 0.6506238859180036.
[I 2026-06-14 18:17:42,503] Trial 46 finished with value: 0.5598930481283422 and parameters: {'C': 0.9897497506695468, 'gamma': 'scale', 'kernel': 'poly'}. Best is trial 38 with value: 0.6089126559714795.
[I 2026-06-14 18:17:42,507] Trial 51 finished with value: 0.5912655971479501 and parameters: {'C': 0.49621929706235285, 'gamma': 'scale', 'kernel': 'rbf'}. Best is trial 9 with value: 0.6388591800356506.
[I 2026-06-14 18:17:42,517] Trial 48 finished with value: 0.48770053475935826 and parameters: {'C': 0.004476930229066456, 'gamma': 'scale', 'kernel': 'sigmoid'}. Best is trial 6 with value: 0.6629233511586453.
[I 2026-06-14 18:17:42,529] Trial 63 finished with value: 0.6506238859180036 and parameters: {'C': 2.505867906209433, 'gamma': 'scale', 'kernel': 'rbf'}. Best is trial 38 with value: 0.6506238859180036.
[I 2026-06-14 18:17:42,529] Trial 55 finished with value: 0.722638146167558 and parameters: {'C': 1.6959432403594294, 'gamma': 'auto', 'kernel': 'sigmoid'}. Best is trial 14 with value: 0.7650623885918003.
[I 2026-06-14 18:17:42,540] Trial 10 finished with value: 0.5837789661319073 and parameters: {'C': 60.92695511824413, 'gamma': 'scale', 'kernel': 'rbf'}. Best is trial 5 with value: 0.6081996434937611.
[I 2026-06-14 18:17:42,547] Trial 52 finished with value: 0.6265597147950089 and parameters: {'C': 1.4980490351079583, 'gamma': 'scale', 'kernel': 'rbf'}. Best is trial 9 with value: 0.6388591800356506.
[I 2026-06-14 18:17:42,549] Trial 47 finished with value: 0.4755793226381462 and parameters: {'C': 0.13810493312062488, 'gamma': 'auto', 'kernel': 'rbf'}. Best is trial 38 with value: 0.6089126559714795.
[I 2026-06-14 18:17:42,562] Trial 64 finished with value: 0.6445632798573975 and parameters: {'C': 2.1684613197426423, 'gamma': 'scale', 'kernel': 'rbf'}. Best is trial 38 with value: 0.6506238859180036.
[I 2026-06-14 18:17:42,569] Trial 49 finished with value: 0.6146167557932264 and parameters: {'C': 3.557734380242521, 'gamma': 'auto', 'kernel': 'rbf'}. Best is trial 6 with value: 0.6629233511586453.
[I 2026-06-14 18:17:42,574] Trial 56 finished with value: 0.7106951871657754 and parameters: {'C': 0.13468469198626712, 'gamma': 'auto', 'kernel': 'sigmoid'}. Best is trial 14 with value: 0.7650623885918003.
[I 2026-06-14 18:17:42,587] Trial 53 finished with value: 0.6085561497326203 and parameters: {'C': 1.4047473922259128, 'gamma': 'scale', 'kernel': 'rbf'}. Best is trial 9 with value: 0.6388591800356506.
[I 2026-06-14 18:17:42,595] Trial 65 finished with value: 0.6206773618538324 and parameters: {'C': 4.030208544617865, 'gamma': 'scale', 'kernel': 'rbf'}. Best is trial 38 with value: 0.6506238859180036.
[I 2026-06-14 18:17:42,602] Trial 48 finished with value: 0.6028520499108734 and parameters: {'C': 10.531271935935514, 'gamma': 'auto', 'kernel': 'rbf'}. Best is trial 38 with value: 0.6089126559714795.
[I 2026-06-14 18:17:42,614] Trial 50 finished with value: 0.6155080213903743 and parameters: {'C': 7.274055460552748, 'gamma': 'scale', 'kernel': 'poly'}. Best is trial 6 with value: 0.6629233511586453.
[I 2026-06-14 18:17:42,617] Trial 57 finished with value: 0.7229946524064171 and parameters: {'C': 2.141874923871825, 'gamma': 'auto', 'kernel': 'sigmoid'}. Best is trial 14 with value: 0.7650623885918003.
[I 2026-06-14 18:17:42,630] Trial 66 finished with value: 0.5536541889483065 and parameters: {'C': 7.6471274558419875, 'gamma': 'scale', 'kernel': 'poly'}. Best is trial 38 with value: 0.6506238859180036.
[I 2026-06-14 18:17:42,635] Trial 54 finished with value: 0.6146167557932263 and parameters: {'C': 26.456192311178075, 'gamma': 'scale', 'kernel': 'rbf'}. Best is trial 9 with value: 0.6388591800356506.
[I 2026-06-14 18:17:42,652] Trial 49 finished with value: 0.57825311942959 and parameters: {'C': 3.1214859425078196, 'gamma': 'auto', 'kernel': 'rbf'}. Best is trial 38 with value: 0.6089126559714795.
[I 2026-06-14 18:17:42,657] Trial 58 finished with value: 0.6746880570409981 and parameters: {'C': 1.3340018251023134, 'gamma': 'auto', 'kernel': 'rbf'}. Best is trial 14 with value: 0.7650623885918003.
[I 2026-06-14 18:17:42,663] Trial 67 finished with value: 0.6081996434937611 and parameters: {'C': 0.3686633876270997, 'gamma': 'scale', 'kernel': 'rbf'}. Best is trial 38 with value: 0.6506238859180036.
[I 2026-06-14 18:17:42,670] Trial 51 finished with value: 0.6450980392156863 and parameters: {'C': 50.23619912356465, 'gamma': 'scale', 'kernel': 'rbf'}. Best is trial 6 with value: 0.6629233511586453.
[I 2026-06-14 18:17:42,679] Trial 55 finished with value: 0.6327985739750446 and parameters: {'C': 3.615299566463558, 'gamma': 'scale', 'kernel': 'rbf'}. Best is trial 9 with value: 0.6388591800356506.
[I 2026-06-14 18:17:42,697] Trial 68 finished with value: 0.6385026737967914 and parameters: {'C': 1.6981065364874093, 'gamma': 'auto', 'kernel': 'rbf'}. Best is trial 38 with value: 0.6506238859180036.
[I 2026-06-14 18:17:42,699] Trial 59 finished with value: 0.7406417112299465 and parameters: {'C': 0.32886219840048925, 'gamma': 'auto', 'kernel': 'sigmoid'}. Best is trial 14 with value: 0.7650623885918003.
[I 2026-06-14 18:17:42,701] Trial 50 finished with value: 0.47593582887700536 and parameters: {'C': 0.011017178236025887, 'gamma': 'scale', 'kernel': 'rbf'}. Best is trial 38 with value: 0.6089126559714795.
[I 2026-06-14 18:17:42,719] Trial 52 finished with value: 0.6450980392156863 and parameters: {'C': 27.07926041258527, 'gamma': 'scale', 'kernel': 'rbf'}. Best is trial 6 with value: 0.6629233511586453.
[I 2026-06-14 18:17:42,726] Trial 56 finished with value: 0.6327985739750446 and parameters: {'C': 3.36128806720291, 'gamma': 'scale', 'kernel': 'rbf'}. Best is trial 9 with value: 0.6388591800356506.
[I 2026-06-14 18:17:42,733] Trial 69 finished with value: 0.6204991087344027 and parameters: {'C': 3.603660309852831, 'gamma': 'scale', 'kernel': 'rbf'}. Best is trial 38 with value: 0.6506238859180036.
[I 2026-06-14 18:17:42,746] Trial 60 finished with value: 0.7590017825311943 and parameters: {'C': 0.6506211529285517, 'gamma': 'scale', 'kernel': 'sigmoid'}. Best is trial 14 with value: 0.7650623885918003.
[I 2026-06-14 18:17:42,759] Trial 51 finished with value: 0.5967914438502674 and parameters: {'C': 7.584593873839492, 'gamma': 'auto', 'kernel': 'rbf'}. Best is trial 38 with value: 0.6089126559714795.
[I 2026-06-14 18:17:42,768] Trial 53 finished with value: 0.6390374331550802 and parameters: {'C': 15.277848687120116, 'gamma': 'scale', 'kernel': 'rbf'}. Best is trial 6 with value: 0.6629233511586453.
[I 2026-06-14 18:17:42,774] Trial 57 finished with value: 0.6388591800356507 and parameters: {'C': 2.769576633533505, 'gamma': 'scale', 'kernel': 'rbf'}. Best is trial 57 with value: 0.6388591800356507.
[I 2026-06-14 18:17:42,789] Trial 61 finished with value: 0.7468805704099821 and parameters: {'C': 0.8137611352948604, 'gamma': 'scale', 'kernel': 'sigmoid'}. Best is trial 14 with value: 0.7650623885918003.
[I 2026-06-14 18:17:42,790] Trial 70 finished with value: 0.5541889483065954 and parameters: {'C': 77.27483445049664, 'gamma': 'scale', 'kernel': 'rbf'}. Best is trial 38 with value: 0.6506238859180036.
[I 2026-06-14 18:17:42,795] Trial 11 finished with value: 0.5777183600713013 and parameters: {'C': 7.836752162546988, 'gamma': 'scale', 'kernel': 'rbf'}. Best is trial 5 with value: 0.6081996434937611.
[I 2026-06-14 18:17:42,810] Trial 52 finished with value: 0.5969696969696969 and parameters: {'C': 13.637961354319051, 'gamma': 'auto', 'kernel': 'rbf'}. Best is trial 38 with value: 0.6089126559714795.
[I 2026-06-14 18:17:42,812] Trial 54 finished with value: 0.6450980392156863 and parameters: {'C': 66.6009553810983, 'gamma': 'scale', 'kernel': 'rbf'}. Best is trial 6 with value: 0.6629233511586453.
[I 2026-06-14 18:17:42,820] Trial 58 finished with value: 0.6327985739750446 and parameters: {'C': 3.2574160730335073, 'gamma': 'scale', 'kernel': 'rbf'}. Best is trial 57 with value: 0.6388591800356507.
