[I 2026-06-14 18:17:50,805] Trial 48 finished with value: 0.6204991087344027 and parameters: {'C': 40.41233319705239, 'gamma': 'scale', 'kernel': 'poly'}. Best is trial 46 with value: 0.6265597147950089.
[I 2026-06-14 18:17:50,910] Trial 18 finished with value: 0.47593582887700536 and parameters: {'C': 0.04681803399023229, 'gamma': 'scale', 'kernel': 'rbf'}. Best is trial 6 with value: 0.6750445632798574.
[I 2026-06-14 18:17:51,016] Trial 49 finished with value: 0.6144385026737967 and parameters: {'C': 62.572119495814036, 'gamma': 'scale', 'kernel': 'poly'}. Best is trial 46 with value: 0.6265597147950089.
[I 2026-06-14 18:17:51,213] Trial 50 finished with value: 0.6204991087344027 and parameters: {'C': 31.66960144651774, 'gamma': 'auto', 'kernel': 'poly'}. Best is trial 46 with value: 0.6265597147950089.
[I 2026-06-14 18:17:51,411] Trial 51 finished with value: 0.6204991087344027 and parameters: {'C': 43.16837718922889, 'gamma': 'scale', 'kernel': 'poly'}. Best is trial 46 with value: 0.6265597147950089.
[I 2026-06-14 18:17:51,556] Trial 19 finished with value: 0.681283422459893 and parameters: {'C': 2.4386847773520497, 'gamma': 'scale', 'kernel': 'rbf'}. Best is trial 19 with value: 0.681283422459893.
[I 2026-06-14 18:17:51,602] Trial 52 finished with value: 0.6144385026737967 and parameters: {'C': 93.29803154873264, 'gamma': 'scale', 'kernel': 'poly'}. Best is trial 46 with value: 0.6265597147950089.
[I 2026-06-14 18:17:51,791] Trial 53 finished with value: 0.6326203208556149 and parameters: {'C': 20.662789600441652, 'gamma': 'scale', 'kernel': 'poly'}. Best is trial 53 with value: 0.6326203208556149.
[I 2026-06-14 18:17:51,980] Trial 54 finished with value: 0.6326203208556149 and parameters: {'C': 21.715293212249744, 'gamma': 'scale', 'kernel': 'poly'}. Best is trial 53 with value: 0.6326203208556149.
[I 2026-06-14 18:17:52,174] Trial 20 finished with value: 0.6750445632798574 and parameters: {'C': 26.30094005500364, 'gamma': 'scale', 'kernel': 'rbf'}. Best is trial 19 with value: 0.681283422459893.
[I 2026-06-14 18:17:52,177] Trial 55 finished with value: 0.6265597147950088 and parameters: {'C': 17.71448139398599, 'gamma': 'scale', 'kernel': 'poly'}. Best is trial 53 with value: 0.6326203208556149.
[I 2026-06-14 18:17:52,371] Trial 56 finished with value: 0.6265597147950088 and parameters: {'C': 17.475123801000716, 'gamma': 'scale', 'kernel': 'poly'}. Best is trial 53 with value: 0.6326203208556149.
[I 2026-06-14 18:17:52,562] Trial 57 finished with value: 0.6385026737967914 and parameters: {'C': 16.449332159786586, 'gamma': 'auto', 'kernel': 'poly'}. Best is trial 57 with value: 0.6385026737967914.
[I 2026-06-14 18:17:52,762] Trial 58 finished with value: 0.6265597147950088 and parameters: {'C': 19.25580129709347, 'gamma': 'auto', 'kernel': 'poly'}. Best is trial 57 with value: 0.6385026737967914.
[I 2026-06-14 18:17:52,804] Trial 21 finished with value: 0.6752228163992869 and parameters: {'C': 2.2688163366999285, 'gamma': 'scale', 'kernel': 'rbf'}. Best is trial 19 with value: 0.681283422459893.
[I 2026-06-14 18:17:52,948] Trial 59 finished with value: 0.5960784313725489 and parameters: {'C': 11.573521071932904, 'gamma': 'auto', 'kernel': 'poly'}. Best is trial 57 with value: 0.6385026737967914.
[I 2026-06-14 18:17:53,137] Trial 60 finished with value: 0.6144385026737967 and parameters: {'C': 67.04148679890827, 'gamma': 'auto', 'kernel': 'poly'}. Best is trial 57 with value: 0.6385026737967914.
[I 2026-06-14 18:17:53,332] Trial 61 finished with value: 0.6265597147950088 and parameters: {'C': 17.76344631857185, 'gamma': 'auto', 'kernel': 'poly'}. Best is trial 57 with value: 0.6385026737967914.
[I 2026-06-14 18:17:53,413] Trial 22 finished with value: 0.6629233511586452 and parameters: {'C': 1.8722772758518489, 'gamma': 'scale', 'kernel': 'rbf'}. Best is trial 19 with value: 0.681283422459893.
[I 2026-06-14 18:17:53,530] Trial 62 finished with value: 0.6326203208556149 and parameters: {'C': 23.02570259039571, 'gamma': 'auto', 'kernel': 'poly'}. Best is trial 57 with value: 0.6385026737967914.
[I 2026-06-14 18:17:53,727] Trial 63 finished with value: 0.6265597147950088 and parameters: {'C': 23.811570585790374, 'gamma': 'auto', 'kernel': 'poly'}. Best is trial 57 with value: 0.6385026737967914.
[I 2026-06-14 18:17:53,918] Trial 64 finished with value: 0.5960784313725489 and parameters: {'C': 11.063753609176565, 'gamma': 'auto', 'kernel': 'poly'}. Best is trial 57 with value: 0.6385026737967914.
[I 2026-06-14 18:17:54,047] Trial 65 finished with value: 0.5479500891265597 and parameters: {'C': 99.19327453483453, 'gamma': 'auto', 'kernel': 'sigmoid'}. Best is trial 57 with value: 0.6385026737967914.
[I 2026-06-14 18:17:54,049] Trial 23 finished with value: 0.5841354723707665 and parameters: {'C': 0.3033126563866135, 'gamma': 'scale', 'kernel': 'rbf'}. Best is trial 19 with value: 0.681283422459893.
[I 2026-06-14 18:17:54,244] Trial 66 finished with value: 0.6204991087344027 and parameters: {'C': 47.82072918522501, 'gamma': 'auto', 'kernel': 'poly'}. Best is trial 57 with value: 0.6385026737967914.
[I 2026-06-14 18:17:54,442] Trial 67 finished with value: 0.6204991087344027 and parameters: {'C': 29.936776789731155, 'gamma': 'auto', 'kernel': 'poly'}. Best is trial 57 with value: 0.6385026737967914.
[I 2026-06-14 18:17:54,629] Trial 68 finished with value: 0.49376114081996436 and parameters: {'C': 0.007592303779568687, 'gamma': 'auto', 'kernel': 'poly'}. Best is trial 57 with value: 0.6385026737967914.
[I 2026-06-14 18:17:54,667] Trial 24 finished with value: 0.6750445632798574 and parameters: {'C': 14.39312561042616, 'gamma': 'scale', 'kernel': 'rbf'}. Best is trial 19 with value: 0.681283422459893.
[I 2026-06-14 18:17:54,827] Trial 69 finished with value: 0.6203208556149732 and parameters: {'C': 13.673435118964608, 'gamma': 'auto', 'kernel': 'poly'}. Best is trial 57 with value: 0.6385026737967914.
[I 2026-06-14 18:17:55,025] Trial 70 finished with value: 0.6144385026737967 and parameters: {'C': 59.866568188575286, 'gamma': 'auto', 'kernel': 'poly'}. Best is trial 57 with value: 0.6385026737967914.
[I 2026-06-14 18:17:55,219] Trial 71 finished with value: 0.6265597147950088 and parameters: {'C': 17.152357259075966, 'gamma': 'scale', 'kernel': 'poly'}. Best is trial 57 with value: 0.6385026737967914.
[I 2026-06-14 18:17:55,288] Trial 25 finished with value: 0.6750445632798574 and parameters: {'C': 3.2238586257566655, 'gamma': 'scale', 'kernel': 'rbf'}. Best is trial 19 with value: 0.681283422459893.
[I 2026-06-14 18:17:55,419] Trial 72 finished with value: 0.6204991087344027 and parameters: {'C': 26.62535233938535, 'gamma': 'scale', 'kernel': 'poly'}. Best is trial 57 with value: 0.6385026737967914.
[I 2026-06-14 18:17:55,617] Trial 73 finished with value: 0.6326203208556149 and parameters: {'C': 20.235644136823392, 'gamma': 'scale', 'kernel': 'poly'}. Best is trial 57 with value: 0.6385026737967914.
[I 2026-06-14 18:17:55,752] Trial 74 finished with value: 0.5303030303030303 and parameters: {'C': 39.52713709126138, 'gamma': 'scale', 'kernel': 'sigmoid'}. Best is trial 57 with value: 0.6385026737967914.
[I 2026-06-14 18:17:55,793] Trial 26 finished with value: 0.6142602495543672 and parameters: {'C': 95.18623011559525, 'gamma': 'auto', 'kernel': 'poly'}. Best is trial 19 with value: 0.681283422459893.
[I 2026-06-14 18:17:55,938] Trial 75 finished with value: 0.602139037433155 and parameters: {'C': 10.159828205307836, 'gamma': 'scale', 'kernel': 'poly'}. Best is trial 57 with value: 0.6385026737967914.
[I 2026-06-14 18:17:56,139] Trial 76 finished with value: 0.6326203208556149 and parameters: {'C': 22.02749188035282, 'gamma': 'scale', 'kernel': 'poly'}. Best is trial 57 with value: 0.6385026737967914.
[I 2026-06-14 18:17:56,338] Trial 77 finished with value: 0.6265597147950088 and parameters: {'C': 23.703359252972895, 'gamma': 'scale', 'kernel': 'poly'}. Best is trial 57 with value: 0.6385026737967914.
[I 2026-06-14 18:17:56,396] Trial 27 finished with value: 0.620855614973262 and parameters: {'C': 1.041102964420761, 'gamma': 'scale', 'kernel': 'rbf'}. Best is trial 19 with value: 0.681283422459893.
[I 2026-06-14 18:17:56,529] Trial 78 finished with value: 0.6144385026737967 and parameters: {'C': 59.00281347097531, 'gamma': 'scale', 'kernel': 'poly'}. Best is trial 57 with value: 0.6385026737967914.
[I 2026-06-14 18:17:56,729] Trial 79 finished with value: 0.6265597147950089 and parameters: {'C': 33.29125145667691, 'gamma': 'scale', 'kernel': 'poly'}. Best is trial 57 with value: 0.6385026737967914.
[I 2026-06-14 18:17:56,867] Trial 80 finished with value: 0.5121212121212121 and parameters: {'C': 13.431853639612436, 'gamma': 'scale', 'kernel': 'sigmoid'}. Best is trial 57 with value: 0.6385026737967914.
[I 2026-06-14 18:17:57,003] Trial 28 finished with value: 0.5541889483065954 and parameters: {'C': 0.21502168898032645, 'gamma': 'scale', 'kernel': 'rbf'}. Best is trial 19 with value: 0.681283422459893.
[I 2026-06-14 18:17:57,075] Trial 81 finished with value: 0.6204991087344027 and parameters: {'C': 31.996795437282444, 'gamma': 'scale', 'kernel': 'poly'}. Best is trial 57 with value: 0.6385026737967914.
[I 2026-06-14 18:17:57,276] Trial 82 finished with value: 0.6144385026737967 and parameters: {'C': 75.6109911133996, 'gamma': 'scale', 'kernel': 'poly'}. Best is trial 57 with value: 0.6385026737967914.
[I 2026-06-14 18:17:57,470] Trial 83 finished with value: 0.6326203208556149 and parameters: {'C': 22.651616808641624, 'gamma': 'scale', 'kernel': 'poly'}. Best is trial 57 with value: 0.6385026737967914.
[I 2026-06-14 18:17:57,614] Trial 29 finished with value: 0.48770053475935826 and parameters: {'C': 0.05635229320932141, 'gamma': 'scale', 'kernel': 'rbf'}. Best is trial 19 with value: 0.681283422459893.
[I 2026-06-14 18:17:57,667] Trial 84 finished with value: 0.6326203208556149 and parameters: {'C': 21.920963598595765, 'gamma': 'scale', 'kernel': 'poly'}. Best is trial 57 with value: 0.6385026737967914.
[I 2026-06-14 18:17:57,861] Trial 85 finished with value: 0.6326203208556149 and parameters: {'C': 22.8174282753541, 'gamma': 'scale', 'kernel': 'poly'}. Best is trial 57 with value: 0.6385026737967914.
[I 2026-06-14 18:17:58,057] Trial 86 finished with value: 0.6142602495543671 and parameters: {'C': 9.457186667440254, 'gamma': 'scale', 'kernel': 'poly'}. Best is trial 57 with value: 0.6385026737967914.
[I 2026-06-14 18:17:58,222] Trial 30 finished with value: 0.6750445632798574 and parameters: {'C': 13.500901786011825, 'gamma': 'scale', 'kernel': 'rbf'}. Best is trial 19 with value: 0.681283422459893.
[I 2026-06-14 18:17:58,264] Trial 87 finished with value: 0.6326203208556149 and parameters: {'C': 22.036769057656137, 'gamma': 'scale', 'kernel': 'poly'}. Best is trial 57 with value: 0.6385026737967914.
[I 2026-06-14 18:17:58,454] Trial 88 finished with value: 0.6263814616755792 and parameters: {'C': 6.811720854604732, 'gamma': 'scale', 'kernel': 'poly'}. Best is trial 57 with value: 0.6385026737967914.
[I 2026-06-14 18:17:58,647] Trial 89 finished with value: 0.6081996434937611 and parameters: {'C': 4.524979779554935, 'gamma': 'scale', 'kernel': 'poly'}. Best is trial 57 with value: 0.6385026737967914.
[I 2026-06-14 18:17:58,824] Trial 31 finished with value: 0.6750445632798574 and parameters: {'C': 3.3546949136058126, 'gamma': 'scale', 'kernel': 'rbf'}. Best is trial 19 with value: 0.681283422459893.
[I 2026-06-14 18:17:58,836] Trial 90 finished with value: 0.6324420677361853 and parameters: {'C': 15.014572668151411, 'gamma': 'auto', 'kernel': 'poly'}. Best is trial 57 with value: 0.6385026737967914.
[I 2026-06-14 18:17:59,023] Trial 91 finished with value: 0.6265597147950088 and parameters: {'C': 19.610279295735875, 'gamma': 'scale', 'kernel': 'poly'}. Best is trial 57 with value: 0.6385026737967914.
[I 2026-06-14 18:17:59,228] Trial 92 finished with value: 0.6265597147950088 and parameters: {'C': 23.301289629858303, 'gamma': 'scale', 'kernel': 'poly'}. Best is trial 57 with value: 0.6385026737967914.
[I 2026-06-14 18:17:59,424] Trial 93 finished with value: 0.6204991087344027 and parameters: {'C': 51.783893885277664, 'gamma': 'scale', 'kernel': 'poly'}. Best is trial 57 with value: 0.6385026737967914.
[I 2026-06-14 18:17:59,437] Trial 32 finished with value: 0.6631016042780749 and parameters: {'C': 2.1423030400931657, 'gamma': 'scale', 'kernel': 'rbf'}. Best is trial 19 with value: 0.681283422459893.
[I 2026-06-14 18:17:59,619] Trial 94 finished with value: 0.6326203208556149 and parameters: {'C': 22.139197018596917, 'gamma': 'scale', 'kernel': 'poly'}. Best is trial 57 with value: 0.6385026737967914.
[I 2026-06-14 18:17:59,815] Trial 95 finished with value: 0.6324420677361854 and parameters: {'C': 6.157915335477865, 'gamma': 'scale', 'kernel': 'poly'}. Best is trial 57 with value: 0.6385026737967914.
[I 2026-06-14 18:18:00,015] Trial 96 finished with value: 0.6142602495543671 and parameters: {'C': 13.055034833487353, 'gamma': 'scale', 'kernel': 'poly'}. Best is trial 57 with value: 0.6385026737967914.
[I 2026-06-14 18:18:00,036] Trial 33 finished with value: 0.5900178253119429 and parameters: {'C': 0.4368684233519609, 'gamma': 'scale', 'kernel': 'rbf'}. Best is trial 19 with value: 0.681283422459893.
[I 2026-06-14 18:18:00,223] Trial 97 finished with value: 0.6142602495543671 and parameters: {'C': 9.323643744421656, 'gamma': 'scale', 'kernel': 'poly'}. Best is trial 57 with value: 0.6385026737967914.
[I 2026-06-14 18:18:00,422] Trial 98 finished with value: 0.6204991087344027 and parameters: {'C': 26.03672620607904, 'gamma': 'scale', 'kernel': 'poly'}. Best is trial 57 with value: 0.6385026737967914.
[I 2026-06-14 18:18:00,619] Trial 99 finished with value: 0.5900178253119429 and parameters: {'C': 11.684711099478744, 'gamma': 'scale', 'kernel': 'poly'}. Best is trial 57 with value: 0.6385026737967914.
[I 2026-06-14 18:18:00,657] Trial 34 finished with value: 0.6750445632798574 and parameters: {'C': 3.323521690260716, 'gamma': 'scale', 'kernel': 'rbf'}. Best is trial 19 with value: 0.681283422459893.
[I 2026-06-14 18:18:00,753] Trial 100 finished with value: 0.5060606060606061 and parameters: {'C': 14.98075965424972, 'gamma': 'auto', 'kernel': 'sigmoid'}. Best is trial 57 with value: 0.6385026737967914.
[I 2026-06-14 18:18:00,954] Trial 101 finished with value: 0.6265597147950088 and parameters: {'C': 19.468894031831944, 'gamma': 'scale', 'kernel': 'poly'}. Best is trial 57 with value: 0.6385026737967914.
[I 2026-06-14 18:18:01,154] Trial 102 finished with value: 0.6204991087344027 and parameters: {'C': 24.06183345388278, 'gamma': 'scale', 'kernel': 'poly'}. Best is trial 57 with value: 0.6385026737967914.
[I 2026-06-14 18:18:01,163] Trial 35 finished with value: 0.6147950089126559 and parameters: {'C': 6.4114221880142015, 'gamma': 'auto', 'kernel': 'poly'}. Best is trial 19 with value: 0.681283422459893.
[I 2026-06-14 18:18:01,356] Trial 103 finished with value: 0.6265597147950089 and parameters: {'C': 36.51084383340018, 'gamma': 'scale', 'kernel': 'poly'}. Best is trial 57 with value: 0.6385026737967914.
[I 2026-06-14 18:18:01,555] Trial 104 finished with value: 0.6144385026737967 and parameters: {'C': 75.85224586433887, 'gamma': 'scale', 'kernel': 'poly'}. Best is trial 57 with value: 0.6385026737967914.
[I 2026-06-14 18:18:01,754] Trial 105 finished with value: 0.6204991087344027 and parameters: {'C': 45.72509499000342, 'gamma': 'scale', 'kernel': 'poly'}. Best is trial 57 with value: 0.6385026737967914.
[I 2026-06-14 18:18:01,772] Trial 36 finished with value: 0.6750445632798574 and parameters: {'C': 18.161813910880493, 'gamma': 'scale', 'kernel': 'rbf'}. Best is trial 19 with value: 0.681283422459893.
[I 2026-06-14 18:18:01,947] Trial 106 finished with value: 0.49411764705882355 and parameters: {'C': 0.0010839843027299757, 'gamma': 'scale', 'kernel': 'poly'}. Best is trial 57 with value: 0.6385026737967914.
[I 2026-06-14 18:18:02,145] Trial 107 finished with value: 0.6265597147950088 and parameters: {'C': 19.432987269014006, 'gamma': 'scale', 'kernel': 'poly'}. Best is trial 57 with value: 0.6385026737967914.
[I 2026-06-14 18:18:02,349] Trial 108 finished with value: 0.6324420677361853 and parameters: {'C': 15.900341218719248, 'gamma': 'auto', 'kernel': 'poly'}. Best is trial 57 with value: 0.6385026737967914.
[I 2026-06-14 18:18:02,371] Trial 37 finished with value: 0.6750445632798574 and parameters: {'C': 46.39682418349336, 'gamma': 'auto', 'kernel': 'rbf'}. Best is trial 19 with value: 0.681283422459893.
[I 2026-06-14 18:18:02,545] Trial 109 finished with value: 0.6204991087344027 and parameters: {'C': 28.08794448022973, 'gamma': 'scale', 'kernel': 'poly'}. Best is trial 57 with value: 0.6385026737967914.
[I 2026-06-14 18:18:02,746] Trial 110 finished with value: 0.6203208556149732 and parameters: {'C': 8.143495986254976, 'gamma': 'scale', 'kernel': 'poly'}. Best is trial 57 with value: 0.6385026737967914.
[I 2026-06-14 18:18:02,941] Trial 111 finished with value: 0.6203208556149733 and parameters: {'C': 5.881149123602233, 'gamma': 'scale', 'kernel': 'poly'}. Best is trial 57 with value: 0.6385026737967914.
[I 2026-06-14 18:18:02,964] Trial 38 finished with value: 0.5900178253119429 and parameters: {'C': 0.5942909913104736, 'gamma': 'scale', 'kernel': 'rbf'}. Best is trial 19 with value: 0.681283422459893.
[I 2026-06-14 18:18:03,139] Trial 112 finished with value: 0.6139037433155081 and parameters: {'C': 2.1290864383801953, 'gamma': 'scale', 'kernel': 'poly'}. Best is trial 57 with value: 0.6385026737967914.
[I 2026-06-14 18:18:03,335] Trial 113 finished with value: 0.49411764705882355 and parameters: {'C': 0.06072526437891906, 'gamma': 'scale', 'kernel': 'poly'}. Best is trial 57 with value: 0.6385026737967914.
[I 2026-06-14 18:18:03,465] Trial 39 finished with value: 0.4998217468805704 and parameters: {'C': 0.017493800811184287, 'gamma': 'auto', 'kernel': 'poly'}. Best is trial 19 with value: 0.681283422459893.
[I 2026-06-14 18:18:03,524] Trial 114 finished with value: 0.5960784313725489 and parameters: {'C': 10.90241236642574, 'gamma': 'scale', 'kernel': 'poly'}. Best is trial 57 with value: 0.6385026737967914.
[I 2026-06-14 18:18:03,716] Trial 115 finished with value: 0.6019607843137256 and parameters: {'C': 3.727508077051702, 'gamma': 'scale', 'kernel': 'poly'}. Best is trial 57 with value: 0.6385026737967914.
[I 2026-06-14 18:18:03,908] Trial 116 finished with value: 0.6326203208556149 and parameters: {'C': 20.699247876918612, 'gamma': 'auto', 'kernel': 'poly'}. Best is trial 57 with value: 0.6385026737967914.
[I 2026-06-14 18:18:04,080] Trial 40 finished with value: 0.6750445632798574 and parameters: {'C': 4.7995507160120985, 'gamma': 'scale', 'kernel': 'rbf'}. Best is trial 19 with value: 0.681283422459893.
[I 2026-06-14 18:18:04,099] Trial 117 finished with value: 0.6326203208556149 and parameters: {'C': 22.700863420819918, 'gamma': 'auto', 'kernel': 'poly'}. Best is trial 57 with value: 0.6385026737967914.
[I 2026-06-14 18:18:04,292] Trial 118 finished with value: 0.6265597147950089 and parameters: {'C': 35.6740638596582, 'gamma': 'auto', 'kernel': 'poly'}. Best is trial 57 with value: 0.6385026737967914.
[I 2026-06-14 18:18:04,430] Trial 119 finished with value: 0.5242424242424242 and parameters: {'C': 19.948658727507684, 'gamma': 'auto', 'kernel': 'sigmoid'}. Best is trial 57 with value: 0.6385026737967914.
[I 2026-06-14 18:18:04,629] Trial 120 finished with value: 0.6324420677361853 and parameters: {'C': 15.093873342511698, 'gamma': 'auto', 'kernel': 'poly'}. Best is trial 57 with value: 0.6385026737967914.
[I 2026-06-14 18:18:04,712] Trial 41 finished with value: 0.6750445632798574 and parameters: {'C': 22.7001474055457, 'gamma': 'scale', 'kernel': 'rbf'}. Best is trial 19 with value: 0.681283422459893.
[I 2026-06-14 18:18:04,821] Trial 121 finished with value: 0.6204991087344027 and parameters: {'C': 24.382412485758316, 'gamma': 'auto', 'kernel': 'poly'}. Best is trial 57 with value: 0.6385026737967914.
[I 2026-06-14 18:18:05,009] Trial 122 finished with value: 0.6204991087344027 and parameters: {'C': 51.412385537938164, 'gamma': 'auto', 'kernel': 'poly'}. Best is trial 57 with value: 0.6385026737967914.
[I 2026-06-14 18:18:05,196] Trial 123 finished with value: 0.6204991087344027 and parameters: {'C': 31.07432711378943, 'gamma': 'auto', 'kernel': 'poly'}. Best is trial 57 with value: 0.6385026737967914.
[I 2026-06-14 18:18:05,333] Trial 42 finished with value: 0.6750445632798574 and parameters: {'C': 43.07817207189845, 'gamma': 'scale', 'kernel': 'rbf'}. Best is trial 19 with value: 0.681283422459893.
[I 2026-06-14 18:18:05,382] Trial 124 finished with value: 0.6326203208556149 and parameters: {'C': 22.39306757772223, 'gamma': 'auto', 'kernel': 'poly'}. Best is trial 57 with value: 0.6385026737967914.
[I 2026-06-14 18:18:05,578] Trial 125 finished with value: 0.6081996434937611 and parameters: {'C': 12.827586457721264, 'gamma': 'auto', 'kernel': 'poly'}. Best is trial 57 with value: 0.6385026737967914.
[I 2026-06-14 18:18:05,774] Trial 126 finished with value: 0.6204991087344027 and parameters: {'C': 27.52234943938367, 'gamma': 'auto', 'kernel': 'poly'}. Best is trial 57 with value: 0.6385026737967914.
[I 2026-06-14 18:18:05,970] Trial 43 finished with value: 0.6750445632798574 and parameters: {'C': 10.757109691285923, 'gamma': 'scale', 'kernel': 'rbf'}. Best is trial 19 with value: 0.681283422459893.
[I 2026-06-14 18:18:05,970] Trial 127 finished with value: 0.6265597147950088 and parameters: {'C': 16.76801500968168, 'gamma': 'auto', 'kernel': 'poly'}. Best is trial 57 with value: 0.6385026737967914.
[I 2026-06-14 18:18:06,161] Trial 128 finished with value: 0.6204991087344027 and parameters: {'C': 43.83538796940802, 'gamma': 'auto', 'kernel': 'poly'}. Best is trial 57 with value: 0.6385026737967914.
