[I 2026-06-14 18:17:45,455] Trial 128 finished with value: 0.6684491978609625 and parameters: {'C': 0.7170085591623017, 'gamma': 'scale', 'kernel': 'poly'}. Best is trial 14 with value: 0.7650623885918003.
[I 2026-06-14 18:17:45,469] Trial 106 finished with value: 0.5846702317290553 and parameters: {'C': 2.8611150072326335, 'gamma': 'auto', 'kernel': 'rbf'}. Best is trial 38 with value: 0.6089126559714795.
[I 2026-06-14 18:17:45,485] Trial 117 finished with value: 0.6028520499108734 and parameters: {'C': 1.2246382150278248, 'gamma': 'scale', 'kernel': 'rbf'}. Best is trial 91 with value: 0.6447415329768271.
[I 2026-06-14 18:17:45,487] Trial 23 finished with value: 0.6201426024955436 and parameters: {'C': 2.586495333787192, 'gamma': 'scale', 'kernel': 'rbf'}. Best is trial 23 with value: 0.6201426024955436.
[I 2026-06-14 18:17:45,488] Trial 118 finished with value: 0.644741532976827 and parameters: {'C': 8.18016925574115, 'gamma': 'auto', 'kernel': 'sigmoid'}. Best is trial 85 with value: 0.6688057040998218.
[I 2026-06-14 18:17:45,494] Trial 129 finished with value: 0.7468805704099821 and parameters: {'C': 1.1382462795597819, 'gamma': 'scale', 'kernel': 'sigmoid'}. Best is trial 14 with value: 0.7650623885918003.
[I 2026-06-14 18:17:45,509] Trial 107 finished with value: 0.5837789661319074 and parameters: {'C': 8.229667424830202, 'gamma': 'auto', 'kernel': 'poly'}. Best is trial 38 with value: 0.6089126559714795.
[I 2026-06-14 18:17:45,528] Trial 119 finished with value: 0.6265597147950088 and parameters: {'C': 11.553247999648605, 'gamma': 'auto', 'kernel': 'sigmoid'}. Best is trial 85 with value: 0.6688057040998218.
[I 2026-06-14 18:17:45,535] Trial 118 finished with value: 0.6267379679144385 and parameters: {'C': 4.590984405802624, 'gamma': 'scale', 'kernel': 'rbf'}. Best is trial 91 with value: 0.6447415329768271.
[I 2026-06-14 18:17:45,536] Trial 130 finished with value: 0.7406417112299465 and parameters: {'C': 0.3111342997924218, 'gamma': 'scale', 'kernel': 'sigmoid'}. Best is trial 14 with value: 0.7650623885918003.
[I 2026-06-14 18:17:45,558] Trial 108 finished with value: 0.5967914438502674 and parameters: {'C': 2.2388391829092957, 'gamma': 'auto', 'kernel': 'rbf'}. Best is trial 38 with value: 0.6089126559714795.
[I 2026-06-14 18:17:45,569] Trial 120 finished with value: 0.6447415329768271 and parameters: {'C': 5.386803929895761, 'gamma': 'auto', 'kernel': 'sigmoid'}. Best is trial 85 with value: 0.6688057040998218.
[I 2026-06-14 18:17:45,578] Trial 119 finished with value: 0.6265597147950089 and parameters: {'C': 1.5816630906190863, 'gamma': 'scale', 'kernel': 'rbf'}. Best is trial 91 with value: 0.6447415329768271.
[I 2026-06-14 18:17:45,580] Trial 131 finished with value: 0.7529411764705882 and parameters: {'C': 0.6203046195548758, 'gamma': 'scale', 'kernel': 'sigmoid'}. Best is trial 14 with value: 0.7650623885918003.
[I 2026-06-14 18:17:45,616] Trial 121 finished with value: 0.644741532976827 and parameters: {'C': 4.039796263471897, 'gamma': 'auto', 'kernel': 'sigmoid'}. Best is trial 85 with value: 0.6688057040998218.
[I 2026-06-14 18:17:45,619] Trial 109 finished with value: 0.5969696969696969 and parameters: {'C': 24.503391788991713, 'gamma': 'scale', 'kernel': 'rbf'}. Best is trial 38 with value: 0.6089126559714795.
[I 2026-06-14 18:17:45,620] Trial 120 finished with value: 0.5122994652406417 and parameters: {'C': 7.978063125638105, 'gamma': 'scale', 'kernel': 'sigmoid'}. Best is trial 91 with value: 0.6447415329768271.
[I 2026-06-14 18:17:45,627] Trial 132 finished with value: 0.7288770053475936 and parameters: {'C': 0.48110390800153174, 'gamma': 'scale', 'kernel': 'sigmoid'}. Best is trial 14 with value: 0.7650623885918003.
[I 2026-06-14 18:17:45,662] Trial 122 finished with value: 0.6506238859180036 and parameters: {'C': 2.238097516224646, 'gamma': 'auto', 'kernel': 'sigmoid'}. Best is trial 85 with value: 0.6688057040998218.
[I 2026-06-14 18:17:45,667] Trial 121 finished with value: 0.638680926916221 and parameters: {'C': 2.5699652169814957, 'gamma': 'scale', 'kernel': 'rbf'}. Best is trial 91 with value: 0.6447415329768271.
[I 2026-06-14 18:17:45,667] Trial 8 finished with value: 0.5549019607843138 and parameters: {'C': 0.7319371522423584, 'gamma': 'auto', 'kernel': 'poly'}. Best is trial 6 with value: 0.6750445632798574.
[I 2026-06-14 18:17:45,673] Trial 133 finished with value: 0.7468805704099821 and parameters: {'C': 0.7979635633309564, 'gamma': 'scale', 'kernel': 'sigmoid'}. Best is trial 14 with value: 0.7650623885918003.
[I 2026-06-14 18:17:45,675] Trial 110 finished with value: 0.5969696969696969 and parameters: {'C': 65.80576276896574, 'gamma': 'auto', 'kernel': 'rbf'}. Best is trial 38 with value: 0.6089126559714795.
[I 2026-06-14 18:17:45,703] Trial 123 finished with value: 0.6026737967914438 and parameters: {'C': 7.380279933679845, 'gamma': 'auto', 'kernel': 'sigmoid'}. Best is trial 85 with value: 0.6688057040998218.
[I 2026-06-14 18:17:45,711] Trial 122 finished with value: 0.6267379679144385 and parameters: {'C': 3.0721195955024965, 'gamma': 'scale', 'kernel': 'rbf'}. Best is trial 91 with value: 0.6447415329768271.
[I 2026-06-14 18:17:45,715] Trial 134 finished with value: 0.7351158645276292 and parameters: {'C': 1.3221609981148692, 'gamma': 'scale', 'kernel': 'sigmoid'}. Best is trial 14 with value: 0.7650623885918003.
[I 2026-06-14 18:17:45,725] Trial 111 finished with value: 0.6026737967914438 and parameters: {'C': 5.721626494439082, 'gamma': 'auto', 'kernel': 'rbf'}. Best is trial 38 with value: 0.6089126559714795.
    [OK] Feature Lexical_Full finalized!
[I 2026-06-14 18:17:45,729] Trial 24 finished with value: 0.5720142602495544 and parameters: {'C': 1.5890550931864844, 'gamma': 'scale', 'kernel': 'rbf'}. Best is trial 23 with value: 0.6201426024955436.
[I 2026-06-14 18:17:45,742] Trial 124 finished with value: 0.6443850267379679 and parameters: {'C': 13.772499582633092, 'gamma': 'auto', 'kernel': 'sigmoid'}. Best is trial 85 with value: 0.6688057040998218.
[I 2026-06-14 18:17:45,752] Trial 123 finished with value: 0.6204991087344028 and parameters: {'C': 2.1629615697130764, 'gamma': 'scale', 'kernel': 'rbf'}. Best is trial 91 with value: 0.6447415329768271.
[I 2026-06-14 18:17:45,776] Trial 112 finished with value: 0.6028520499108734 and parameters: {'C': 6.845417930790316, 'gamma': 'auto', 'kernel': 'rbf'}. Best is trial 38 with value: 0.6089126559714795.
[I 2026-06-14 18:17:45,786] Trial 125 finished with value: 0.49411764705882355 and parameters: {'C': 0.017895514286269867, 'gamma': 'auto', 'kernel': 'sigmoid'}. Best is trial 85 with value: 0.6688057040998218.
[I 2026-06-14 18:17:45,796] Trial 124 finished with value: 0.6269162210338681 and parameters: {'C': 3.8284104431925337, 'gamma': 'scale', 'kernel': 'rbf'}. Best is trial 91 with value: 0.6447415329768271.
[I 2026-06-14 18:17:45,824] Trial 126 finished with value: 0.6092691622103387 and parameters: {'C': 9.5803500152542, 'gamma': 'auto', 'kernel': 'poly'}. Best is trial 85 with value: 0.6688057040998218.
[I 2026-06-14 18:17:45,829] Trial 113 finished with value: 0.5969696969696969 and parameters: {'C': 15.913435443087202, 'gamma': 'auto', 'kernel': 'rbf'}. Best is trial 38 with value: 0.6089126559714795.
[I 2026-06-14 18:17:45,836] Trial 125 finished with value: 0.6388591800356506 and parameters: {'C': 1.021930169098054, 'gamma': 'scale', 'kernel': 'rbf'}. Best is trial 91 with value: 0.6447415329768271.
[I 2026-06-14 18:17:45,863] Trial 127 finished with value: 0.6447415329768271 and parameters: {'C': 5.298925820413762, 'gamma': 'auto', 'kernel': 'sigmoid'}. Best is trial 85 with value: 0.6688057040998218.
[I 2026-06-14 18:17:45,876] Trial 114 finished with value: 0.6028520499108734 and parameters: {'C': 9.599792842304067, 'gamma': 'auto', 'kernel': 'rbf'}. Best is trial 38 with value: 0.6089126559714795.
[I 2026-06-14 18:17:45,876] Trial 126 finished with value: 0.6089126559714795 and parameters: {'C': 1.1867087552685391, 'gamma': 'scale', 'kernel': 'rbf'}. Best is trial 91 with value: 0.6447415329768271.
[I 2026-06-14 18:17:45,904] Trial 128 finished with value: 0.65650623885918 and parameters: {'C': 3.094387973329493, 'gamma': 'auto', 'kernel': 'sigmoid'}. Best is trial 85 with value: 0.6688057040998218.
[I 2026-06-14 18:17:45,911] Trial 127 finished with value: 0.6329768270944741 and parameters: {'C': 0.988402093925319, 'gamma': 'scale', 'kernel': 'rbf'}. Best is trial 91 with value: 0.6447415329768271.
[I 2026-06-14 18:17:45,923] Trial 115 finished with value: 0.590017825311943 and parameters: {'C': 3.777995956766798, 'gamma': 'auto', 'kernel': 'rbf'}. Best is trial 38 with value: 0.6089126559714795.
[I 2026-06-14 18:17:45,943] Trial 129 finished with value: 0.6021390374331551 and parameters: {'C': 23.638258098711084, 'gamma': 'auto', 'kernel': 'sigmoid'}. Best is trial 85 with value: 0.6688057040998218.
[I 2026-06-14 18:17:45,955] Trial 128 finished with value: 0.6326203208556149 and parameters: {'C': 1.7311110253964441, 'gamma': 'scale', 'kernel': 'rbf'}. Best is trial 91 with value: 0.6447415329768271.
[I 2026-06-14 18:17:45,976] Trial 25 finished with value: 0.6262032085561497 and parameters: {'C': 3.6250770475395404, 'gamma': 'scale', 'kernel': 'rbf'}. Best is trial 25 with value: 0.6262032085561497.
[I 2026-06-14 18:17:45,983] Trial 116 finished with value: 0.5969696969696969 and parameters: {'C': 12.651587922453349, 'gamma': 'auto', 'kernel': 'rbf'}. Best is trial 38 with value: 0.6089126559714795.
[I 2026-06-14 18:17:45,990] Trial 130 finished with value: 0.5844919786096257 and parameters: {'C': 12.904732270493968, 'gamma': 'auto', 'kernel': 'sigmoid'}. Best is trial 85 with value: 0.6688057040998218.
[I 2026-06-14 18:17:46,003] Trial 129 finished with value: 0.5967914438502674 and parameters: {'C': 0.5797897912202784, 'gamma': 'scale', 'kernel': 'rbf'}. Best is trial 91 with value: 0.6447415329768271.
[I 2026-06-14 18:17:46,030] Trial 131 finished with value: 0.650445632798574 and parameters: {'C': 3.173893357933057, 'gamma': 'auto', 'kernel': 'sigmoid'}. Best is trial 85 with value: 0.6688057040998218.
[I 2026-06-14 18:17:46,034] Trial 117 finished with value: 0.5967914438502674 and parameters: {'C': 7.127989994784014, 'gamma': 'auto', 'kernel': 'rbf'}. Best is trial 38 with value: 0.6089126559714795.
[I 2026-06-14 18:17:46,043] Trial 130 finished with value: 0.6089126559714795 and parameters: {'C': 0.7577173265587652, 'gamma': 'scale', 'kernel': 'rbf'}. Best is trial 91 with value: 0.6447415329768271.
[I 2026-06-14 18:17:46,070] Trial 132 finished with value: 0.6083778966131906 and parameters: {'C': 1.368034006451982, 'gamma': 'auto', 'kernel': 'sigmoid'}. Best is trial 85 with value: 0.6688057040998218.
[I 2026-06-14 18:17:46,078] Trial 118 finished with value: 0.5545454545454545 and parameters: {'C': 4.567589095441792, 'gamma': 'auto', 'kernel': 'sigmoid'}. Best is trial 38 with value: 0.6089126559714795.
[I 2026-06-14 18:17:46,082] Trial 131 finished with value: 0.6388591800356507 and parameters: {'C': 2.665864659783007, 'gamma': 'scale', 'kernel': 'rbf'}. Best is trial 91 with value: 0.6447415329768271.
[I 2026-06-14 18:17:46,110] Trial 133 finished with value: 0.6265597147950089 and parameters: {'C': 4.5390205853414045, 'gamma': 'auto', 'kernel': 'sigmoid'}. Best is trial 85 with value: 0.6688057040998218.
[I 2026-06-14 18:17:46,120] Trial 132 finished with value: 0.6265597147950089 and parameters: {'C': 1.4604605061715459, 'gamma': 'scale', 'kernel': 'rbf'}. Best is trial 91 with value: 0.6447415329768271.
[I 2026-06-14 18:17:46,128] Trial 119 finished with value: 0.5969696969696969 and parameters: {'C': 19.059996391741933, 'gamma': 'auto', 'kernel': 'rbf'}. Best is trial 38 with value: 0.6089126559714795.
[I 2026-06-14 18:17:46,150] Trial 134 finished with value: 0.6385026737967915 and parameters: {'C': 2.463164612829846, 'gamma': 'auto', 'kernel': 'sigmoid'}. Best is trial 85 with value: 0.6688057040998218.
[I 2026-06-14 18:17:46,162] Trial 133 finished with value: 0.6267379679144385 and parameters: {'C': 4.947126192474864, 'gamma': 'scale', 'kernel': 'rbf'}. Best is trial 91 with value: 0.6447415329768271.
    [OK] Feature eGeMAPSv02_88 finalized!
[I 2026-06-14 18:17:46,177] Trial 120 finished with value: 0.6028520499108734 and parameters: {'C': 9.694376529782502, 'gamma': 'auto', 'kernel': 'rbf'}. Best is trial 38 with value: 0.6089126559714795.
[I 2026-06-14 18:17:46,197] Trial 9 finished with value: 0.6142602495543672 and parameters: {'C': 96.83571831235258, 'gamma': 'scale', 'kernel': 'poly'}. Best is trial 6 with value: 0.6750445632798574.
[I 2026-06-14 18:17:46,204] Trial 134 finished with value: 0.638680926916221 and parameters: {'C': 2.4900373234291044, 'gamma': 'scale', 'kernel': 'rbf'}. Best is trial 91 with value: 0.6447415329768271.
[I 2026-06-14 18:17:46,218] Trial 26 finished with value: 0.5837789661319073 and parameters: {'C': 22.575223656312627, 'gamma': 'auto', 'kernel': 'rbf'}. Best is trial 25 with value: 0.6262032085561497.
    [OK] Feature vggish finalized!
[I 2026-06-14 18:17:46,227] Trial 121 finished with value: 0.6028520499108734 and parameters: {'C': 10.519703525648234, 'gamma': 'auto', 'kernel': 'rbf'}. Best is trial 38 with value: 0.6089126559714795.
[I 2026-06-14 18:17:46,275] Trial 122 finished with value: 0.5966131907308377 and parameters: {'C': 5.119508424043416, 'gamma': 'auto', 'kernel': 'rbf'}. Best is trial 38 with value: 0.6089126559714795.
[I 2026-06-14 18:17:46,320] Trial 123 finished with value: 0.5969696969696969 and parameters: {'C': 15.272367067098575, 'gamma': 'auto', 'kernel': 'rbf'}. Best is trial 38 with value: 0.6089126559714795.
[I 2026-06-14 18:17:46,369] Trial 124 finished with value: 0.6028520499108734 and parameters: {'C': 6.864765570936046, 'gamma': 'auto', 'kernel': 'rbf'}. Best is trial 38 with value: 0.6089126559714795.
[I 2026-06-14 18:17:46,414] Trial 125 finished with value: 0.6028520499108734 and parameters: {'C': 8.880202717424668, 'gamma': 'auto', 'kernel': 'rbf'}. Best is trial 38 with value: 0.6089126559714795.
[I 2026-06-14 18:17:46,449] Trial 27 finished with value: 0.6201426024955438 and parameters: {'C': 4.530912672877319, 'gamma': 'scale', 'kernel': 'rbf'}. Best is trial 25 with value: 0.6262032085561497.
[I 2026-06-14 18:17:46,460] Trial 126 finished with value: 0.5967914438502674 and parameters: {'C': 1.9162072000180375, 'gamma': 'auto', 'kernel': 'rbf'}. Best is trial 38 with value: 0.6089126559714795.
[I 2026-06-14 18:17:46,506] Trial 127 finished with value: 0.5969696969696969 and parameters: {'C': 12.268600295267055, 'gamma': 'auto', 'kernel': 'rbf'}. Best is trial 38 with value: 0.6089126559714795.
[I 2026-06-14 18:17:46,541] Trial 128 finished with value: 0.6019607843137255 and parameters: {'C': 3.3783726483784293, 'gamma': 'scale', 'kernel': 'poly'}. Best is trial 38 with value: 0.6089126559714795.
[I 2026-06-14 18:17:46,588] Trial 129 finished with value: 0.6026737967914438 and parameters: {'C': 5.693333232590583, 'gamma': 'auto', 'kernel': 'rbf'}. Best is trial 38 with value: 0.6089126559714795.
[I 2026-06-14 18:17:46,633] Trial 130 finished with value: 0.5969696969696969 and parameters: {'C': 22.79166291919611, 'gamma': 'auto', 'kernel': 'rbf'}. Best is trial 38 with value: 0.6089126559714795.
[I 2026-06-14 18:17:46,676] Trial 131 finished with value: 0.6028520499108734 and parameters: {'C': 10.37865900322442, 'gamma': 'auto', 'kernel': 'rbf'}. Best is trial 38 with value: 0.6089126559714795.
[I 2026-06-14 18:17:46,676] Trial 28 finished with value: 0.5959001782531195 and parameters: {'C': 5.327864178911624, 'gamma': 'scale', 'kernel': 'rbf'}. Best is trial 25 with value: 0.6262032085561497.
[I 2026-06-14 18:17:46,720] Trial 132 finished with value: 0.5967914438502674 and parameters: {'C': 7.838531661863446, 'gamma': 'auto', 'kernel': 'rbf'}. Best is trial 38 with value: 0.6089126559714795.
[I 2026-06-14 18:17:46,763] Trial 133 finished with value: 0.5969696969696969 and parameters: {'C': 13.386859228698723, 'gamma': 'auto', 'kernel': 'rbf'}. Best is trial 38 with value: 0.6089126559714795.
[I 2026-06-14 18:17:46,798] Trial 10 finished with value: 0.48770053475935826 and parameters: {'C': 0.06806420768808297, 'gamma': 'scale', 'kernel': 'rbf'}. Best is trial 6 with value: 0.6750445632798574.
[I 2026-06-14 18:17:46,806] Trial 134 finished with value: 0.6028520499108734 and parameters: {'C': 10.178483985104078, 'gamma': 'auto', 'kernel': 'rbf'}. Best is trial 38 with value: 0.6089126559714795.
    [OK] Feature pAA finalized!
[I 2026-06-14 18:17:46,894] Trial 29 finished with value: 0.5837789661319073 and parameters: {'C': 14.7322164950694, 'gamma': 'scale', 'kernel': 'rbf'}. Best is trial 25 with value: 0.6262032085561497.
[I 2026-06-14 18:17:47,118] Trial 30 finished with value: 0.5661319073083779 and parameters: {'C': 0.5008037951419281, 'gamma': 'scale', 'kernel': 'rbf'}. Best is trial 25 with value: 0.6262032085561497.
[I 2026-06-14 18:17:47,150] Trial 11 finished with value: 0.6267379679144385 and parameters: {'C': 42.509143195741906, 'gamma': 'scale', 'kernel': 'sigmoid'}. Best is trial 6 with value: 0.6750445632798574.
[I 2026-06-14 18:17:47,359] Trial 31 finished with value: 0.6140819964349375 and parameters: {'C': 2.2501894482760947, 'gamma': 'scale', 'kernel': 'rbf'}. Best is trial 25 with value: 0.6262032085561497.
[I 2026-06-14 18:17:47,584] Trial 32 finished with value: 0.6140819964349375 and parameters: {'C': 2.8734880728459986, 'gamma': 'scale', 'kernel': 'rbf'}. Best is trial 25 with value: 0.6262032085561497.
[I 2026-06-14 18:17:47,595] Trial 12 finished with value: 0.6449197860962567 and parameters: {'C': 8.811991143766482, 'gamma': 'scale', 'kernel': 'sigmoid'}. Best is trial 6 with value: 0.6750445632798574.
[I 2026-06-14 18:17:47,818] Trial 33 finished with value: 0.6080213903743316 and parameters: {'C': 4.910674208753827, 'gamma': 'scale', 'kernel': 'rbf'}. Best is trial 25 with value: 0.6262032085561497.
[I 2026-06-14 18:17:48,047] Trial 13 finished with value: 0.6631016042780749 and parameters: {'C': 7.889736088793965, 'gamma': 'scale', 'kernel': 'sigmoid'}. Best is trial 6 with value: 0.6750445632798574.
[I 2026-06-14 18:17:48,049] Trial 34 finished with value: 0.5837789661319073 and parameters: {'C': 29.963201190069064, 'gamma': 'scale', 'kernel': 'rbf'}. Best is trial 25 with value: 0.6262032085561497.
[I 2026-06-14 18:17:48,247] Trial 35 finished with value: 0.6203208556149732 and parameters: {'C': 7.796550639360356, 'gamma': 'scale', 'kernel': 'poly'}. Best is trial 25 with value: 0.6262032085561497.
[I 2026-06-14 18:17:48,450] Trial 36 finished with value: 0.6142602495543671 and parameters: {'C': 13.038365959152284, 'gamma': 'scale', 'kernel': 'poly'}. Best is trial 25 with value: 0.6262032085561497.
[I 2026-06-14 18:17:48,642] Trial 37 finished with value: 0.6203208556149732 and parameters: {'C': 6.887281011438773, 'gamma': 'scale', 'kernel': 'poly'}. Best is trial 25 with value: 0.6262032085561497.
[I 2026-06-14 18:17:48,664] Trial 14 finished with value: 0.6326203208556149 and parameters: {'C': 1.3664072516662549, 'gamma': 'scale', 'kernel': 'rbf'}. Best is trial 6 with value: 0.6750445632798574.
[I 2026-06-14 18:17:48,836] Trial 38 finished with value: 0.6142602495543671 and parameters: {'C': 8.451268636994245, 'gamma': 'scale', 'kernel': 'poly'}. Best is trial 25 with value: 0.6262032085561497.
[I 2026-06-14 18:17:49,034] Trial 39 finished with value: 0.5477718360071301 and parameters: {'C': 1.1463167071349671, 'gamma': 'scale', 'kernel': 'poly'}. Best is trial 25 with value: 0.6262032085561497.
[I 2026-06-14 18:17:49,036] Trial 15 finished with value: 0.6085561497326203 and parameters: {'C': 28.619253812657057, 'gamma': 'scale', 'kernel': 'sigmoid'}. Best is trial 6 with value: 0.6750445632798574.
[I 2026-06-14 18:17:49,222] Trial 40 finished with value: 0.6081996434937611 and parameters: {'C': 5.627310426909759, 'gamma': 'scale', 'kernel': 'poly'}. Best is trial 25 with value: 0.6262032085561497.
[I 2026-06-14 18:17:49,412] Trial 41 finished with value: 0.6019607843137255 and parameters: {'C': 2.7460872636558213, 'gamma': 'scale', 'kernel': 'poly'}. Best is trial 25 with value: 0.6262032085561497.
[I 2026-06-14 18:17:49,610] Trial 42 finished with value: 0.6203208556149732 and parameters: {'C': 7.341981270502342, 'gamma': 'scale', 'kernel': 'poly'}. Best is trial 25 with value: 0.6262032085561497.
[I 2026-06-14 18:17:49,645] Trial 16 finished with value: 0.5238859180035651 and parameters: {'C': 0.1947880719953715, 'gamma': 'scale', 'kernel': 'rbf'}. Best is trial 6 with value: 0.6750445632798574.
[I 2026-06-14 18:17:49,812] Trial 43 finished with value: 0.6142602495543671 and parameters: {'C': 8.348787578702941, 'gamma': 'scale', 'kernel': 'poly'}. Best is trial 25 with value: 0.6262032085561497.
[I 2026-06-14 18:17:50,013] Trial 44 finished with value: 0.6204991087344027 and parameters: {'C': 28.817208054267432, 'gamma': 'scale', 'kernel': 'poly'}. Best is trial 25 with value: 0.6262032085561497.
[I 2026-06-14 18:17:50,210] Trial 45 finished with value: 0.6204991087344027 and parameters: {'C': 46.09726848191626, 'gamma': 'scale', 'kernel': 'poly'}. Best is trial 25 with value: 0.6262032085561497.
[I 2026-06-14 18:17:50,282] Trial 17 finished with value: 0.6750445632798574 and parameters: {'C': 2.913555244804324, 'gamma': 'scale', 'kernel': 'rbf'}. Best is trial 6 with value: 0.6750445632798574.
[I 2026-06-14 18:17:50,405] Trial 46 finished with value: 0.6265597147950089 and parameters: {'C': 35.30077048052947, 'gamma': 'scale', 'kernel': 'poly'}. Best is trial 46 with value: 0.6265597147950089.
[I 2026-06-14 18:17:50,600] Trial 47 finished with value: 0.6265597147950089 and parameters: {'C': 37.67804189395209, 'gamma': 'scale', 'kernel': 'poly'}. Best is trial 46 with value: 0.6265597147950089.
