======================================================================
STARTING ENSEMBLE PIPELINE (PARALLEL + SOFT VOTING + OPTUNA 135 TRIALS)
======================================================================
[INFO] Distributing tasks to CPU cores for 7 features...
[>] Processing feature: SpeechGraph_Full
[>] Processing feature: pAA
[>] Processing feature: trill
[>] Processing feature: vggish
[>] Processing feature: Lexical_Full
[I 2026-06-14 18:17:40,381] A new study created in memory with name: no-name-787591d9-f9fd-4402-bdcb-5fb3d67fa385
[I 2026-06-14 18:17:40,381] A new study created in memory with name: no-name-65fa5feb-0027-4bcb-98ca-eb5b5753ab07
[>] Processing feature: eGeMAPSv02_88
[>] Processing feature: ComParE_2016_6k
[I 2026-06-14 18:17:40,390] A new study created in memory with name: no-name-6d292d09-3b72-4c6e-a856-8c3c842fbac6
[I 2026-06-14 18:17:40,396] A new study created in memory with name: no-name-d3e9f48f-3c57-4840-9994-d079cd12ae63
[I 2026-06-14 18:17:40,397] A new study created in memory with name: no-name-7a6dffb1-26fa-4d71-93c8-f80e13b021e1
[I 2026-06-14 18:17:40,404] A new study created in memory with name: no-name-44cd3363-02cc-461f-8628-3361c7fc0a1b
[I 2026-06-14 18:17:40,410] Trial 0 finished with value: 0.48770053475935826 and parameters: {'C': 0.004849040327541821, 'gamma': 'auto', 'kernel': 'rbf'}. Best is trial 0 with value: 0.48770053475935826.
[I 2026-06-14 18:17:40,425] Trial 0 finished with value: 0.5910873440285205 and parameters: {'C': 3.1733500707801072, 'gamma': 'scale', 'kernel': 'poly'}. Best is trial 0 with value: 0.5910873440285205.
[I 2026-06-14 18:17:40,426] Trial 0 finished with value: 0.5969696969696969 and parameters: {'C': 49.45774385413225, 'gamma': 'auto', 'kernel': 'rbf'}. Best is trial 0 with value: 0.5969696969696969.
[I 2026-06-14 18:17:40,426] A new study created in memory with name: no-name-eba4164f-490e-448e-93dc-71630183fffe
[I 2026-06-14 18:17:40,430] Trial 0 finished with value: 0.6928698752228165 and parameters: {'C': 72.83959609096338, 'gamma': 'scale', 'kernel': 'sigmoid'}. Best is trial 0 with value: 0.6928698752228165.
[I 2026-06-14 18:17:40,439] Trial 1 finished with value: 0.542602495543672 and parameters: {'C': 0.010640972282468665, 'gamma': 'scale', 'kernel': 'rbf'}. Best is trial 1 with value: 0.542602495543672.
[I 2026-06-14 18:17:40,447] Trial 0 finished with value: 0.47593582887700536 and parameters: {'C': 0.03365234198776342, 'gamma': 'auto', 'kernel': 'sigmoid'}. Best is trial 0 with value: 0.47593582887700536.
[I 2026-06-14 18:17:40,460] Trial 1 finished with value: 0.5777183600713013 and parameters: {'C': 1.3400124247778658, 'gamma': 'auto', 'kernel': 'poly'}. Best is trial 0 with value: 0.5969696969696969.
[I 2026-06-14 18:17:40,464] Trial 1 finished with value: 0.5001782531194296 and parameters: {'C': 0.1094340109317473, 'gamma': 'auto', 'kernel': 'rbf'}. Best is trial 0 with value: 0.5910873440285205.
[I 2026-06-14 18:17:40,468] Trial 2 finished with value: 0.5240641711229946 and parameters: {'C': 3.41492006066079, 'gamma': 'scale', 'kernel': 'sigmoid'}. Best is trial 1 with value: 0.542602495543672.
[I 2026-06-14 18:17:40,471] Trial 1 finished with value: 0.47593582887700536 and parameters: {'C': 0.004864705906059895, 'gamma': 'scale', 'kernel': 'sigmoid'}. Best is trial 0 with value: 0.6928698752228165.
[I 2026-06-14 18:17:40,479] Trial 1 finished with value: 0.48770053475935826 and parameters: {'C': 0.0011017077775100632, 'gamma': 'auto', 'kernel': 'poly'}. Best is trial 1 with value: 0.48770053475935826.
[I 2026-06-14 18:17:40,492] Trial 3 finished with value: 0.5064171122994653 and parameters: {'C': 0.5775286256142838, 'gamma': 'scale', 'kernel': 'poly'}. Best is trial 1 with value: 0.542602495543672.
[I 2026-06-14 18:17:40,502] Trial 2 finished with value: 0.48770053475935826 and parameters: {'C': 0.007604220157637971, 'gamma': 'scale', 'kernel': 'rbf'}. Best is trial 0 with value: 0.5910873440285205.
[I 2026-06-14 18:17:40,503] Trial 2 finished with value: 0.5119429590017825 and parameters: {'C': 10.273590583293409, 'gamma': 'auto', 'kernel': 'sigmoid'}. Best is trial 0 with value: 0.5969696969696969.
[I 2026-06-14 18:17:40,510] Trial 2 finished with value: 0.5058823529411764 and parameters: {'C': 0.019939228037177795, 'gamma': 'auto', 'kernel': 'sigmoid'}. Best is trial 0 with value: 0.6928698752228165.
[I 2026-06-14 18:17:40,519] Trial 2 finished with value: 0.47593582887700536 and parameters: {'C': 0.0011450290623805314, 'gamma': 'scale', 'kernel': 'sigmoid'}. Best is trial 1 with value: 0.48770053475935826.
[I 2026-06-14 18:17:40,522] Trial 4 finished with value: 0.5846702317290553 and parameters: {'C': 6.897712790952065, 'gamma': 'scale', 'kernel': 'rbf'}. Best is trial 4 with value: 0.5846702317290553.
[I 2026-06-14 18:17:40,535] Trial 3 finished with value: 0.4700534759358289 and parameters: {'C': 0.026176379091878997, 'gamma': 'auto', 'kernel': 'poly'}. Best is trial 0 with value: 0.5910873440285205.
[I 2026-06-14 18:17:40,540] Trial 3 finished with value: 0.5001782531194296 and parameters: {'C': 0.007583120715163564, 'gamma': 'scale', 'kernel': 'poly'}. Best is trial 0 with value: 0.5969696969696969.
[I 2026-06-14 18:17:40,540] Trial 3 finished with value: 0.6499108734402851 and parameters: {'C': 0.2769333848344675, 'gamma': 'scale', 'kernel': 'poly'}. Best is trial 0 with value: 0.6928698752228165.
[I 2026-06-14 18:17:40,556] Trial 5 finished with value: 0.6265597147950089 and parameters: {'C': 0.2598196105139087, 'gamma': 'scale', 'kernel': 'sigmoid'}. Best is trial 5 with value: 0.6265597147950089.
[I 2026-06-14 18:17:40,559] Trial 3 finished with value: 0.47593582887700536 and parameters: {'C': 0.00477102466054193, 'gamma': 'auto', 'kernel': 'sigmoid'}. Best is trial 1 with value: 0.48770053475935826.
[I 2026-06-14 18:17:40,578] Trial 4 finished with value: 0.5718360071301247 and parameters: {'C': 15.203558509743022, 'gamma': 'auto', 'kernel': 'poly'}. Best is trial 0 with value: 0.5969696969696969.
[I 2026-06-14 18:17:40,581] Trial 4 finished with value: 0.6807486631016042 and parameters: {'C': 3.9859577633807324, 'gamma': 'scale', 'kernel': 'rbf'}. Best is trial 0 with value: 0.6928698752228165.
[I 2026-06-14 18:17:40,583] Trial 4 finished with value: 0.6146167557932263 and parameters: {'C': 21.064571108402536, 'gamma': 'scale', 'kernel': 'rbf'}. Best is trial 4 with value: 0.6146167557932263.
[I 2026-06-14 18:17:40,586] Trial 0 finished with value: 0.5903743315508021 and parameters: {'C': 0.9866033620606771, 'gamma': 'scale', 'kernel': 'sigmoid'}. Best is trial 0 with value: 0.5903743315508021.
[I 2026-06-14 18:17:40,588] Trial 6 finished with value: 0.6017825311942959 and parameters: {'C': 0.18382372793504267, 'gamma': 'auto', 'kernel': 'rbf'}. Best is trial 5 with value: 0.6265597147950089.
[I 2026-06-14 18:17:40,601] Trial 4 finished with value: 0.6450980392156863 and parameters: {'C': 32.27567134591733, 'gamma': 'scale', 'kernel': 'rbf'}. Best is trial 4 with value: 0.6450980392156863.
[I 2026-06-14 18:17:40,614] Trial 5 finished with value: 0.5850267379679145 and parameters: {'C': 4.1433806839415315, 'gamma': 'scale', 'kernel': 'poly'}. Best is trial 4 with value: 0.6146167557932263.
[I 2026-06-14 18:17:40,619] Trial 5 finished with value: 0.6689839572192513 and parameters: {'C': 8.745763677590253, 'gamma': 'auto', 'kernel': 'rbf'}. Best is trial 0 with value: 0.6928698752228165.
[I 2026-06-14 18:17:40,620] Trial 5 finished with value: 0.47593582887700536 and parameters: {'C': 0.0012706912564377176, 'gamma': 'scale', 'kernel': 'rbf'}. Best is trial 0 with value: 0.5969696969696969.
[I 2026-06-14 18:17:40,624] Trial 7 finished with value: 0.49393939393939396 and parameters: {'C': 0.033534619835956805, 'gamma': 'scale', 'kernel': 'sigmoid'}. Best is trial 5 with value: 0.6265597147950089.
[I 2026-06-14 18:17:40,641] Trial 5 finished with value: 0.47593582887700536 and parameters: {'C': 0.0013984914633892434, 'gamma': 'scale', 'kernel': 'sigmoid'}. Best is trial 4 with value: 0.6450980392156863.
[I 2026-06-14 18:17:40,647] Trial 6 finished with value: 0.6133689839572193 and parameters: {'C': 0.20947153370023938, 'gamma': 'scale', 'kernel': 'poly'}. Best is trial 0 with value: 0.6928698752228165.
[I 2026-06-14 18:17:40,652] Trial 6 finished with value: 0.5361853832442067 and parameters: {'C': 0.22286403774971503, 'gamma': 'auto', 'kernel': 'poly'}. Best is trial 0 with value: 0.5969696969696969.
[I 2026-06-14 18:17:40,656] Trial 6 finished with value: 0.5484848484848485 and parameters: {'C': 0.09096902350741098, 'gamma': 'scale', 'kernel': 'sigmoid'}. Best is trial 4 with value: 0.6146167557932263.
[I 2026-06-14 18:17:40,659] Trial 8 finished with value: 0.6024955436720142 and parameters: {'C': 19.791108381370034, 'gamma': 'auto', 'kernel': 'rbf'}. Best is trial 5 with value: 0.6265597147950089.
[I 2026-06-14 18:17:40,677] Trial 7 finished with value: 0.5001782531194296 and parameters: {'C': 0.013923319325372299, 'gamma': 'auto', 'kernel': 'poly'}. Best is trial 0 with value: 0.6928698752228165.
[I 2026-06-14 18:17:40,680] Trial 6 finished with value: 0.6629233511586453 and parameters: {'C': 5.586093212851364, 'gamma': 'auto', 'kernel': 'sigmoid'}. Best is trial 6 with value: 0.6629233511586453.
[I 2026-06-14 18:17:40,684] Trial 9 finished with value: 0.5060606060606061 and parameters: {'C': 0.016150943823589347, 'gamma': 'auto', 'kernel': 'poly'}. Best is trial 5 with value: 0.6265597147950089.
[I 2026-06-14 18:17:40,685] Trial 7 finished with value: 0.5240641711229946 and parameters: {'C': 0.03508896724221411, 'gamma': 'scale', 'kernel': 'poly'}. Best is trial 0 with value: 0.5969696969696969.
[I 2026-06-14 18:17:40,700] Trial 7 finished with value: 0.6146167557932263 and parameters: {'C': 15.41227228200156, 'gamma': 'auto', 'kernel': 'rbf'}. Best is trial 4 with value: 0.6146167557932263.
[I 2026-06-14 18:17:40,711] Trial 7 finished with value: 0.5367201426024956 and parameters: {'C': 0.7778110106303455, 'gamma': 'auto', 'kernel': 'poly'}. Best is trial 6 with value: 0.6629233511586453.
[I 2026-06-14 18:17:40,714] Trial 8 finished with value: 0.7468805704099821 and parameters: {'C': 1.0521768741521402, 'gamma': 'auto', 'kernel': 'sigmoid'}. Best is trial 8 with value: 0.7468805704099821.
[I 2026-06-14 18:17:40,720] Trial 10 finished with value: 0.47593582887700536 and parameters: {'C': 0.001678697931299092, 'gamma': 'scale', 'kernel': 'sigmoid'}. Best is trial 5 with value: 0.6265597147950089.
[I 2026-06-14 18:17:40,725] Trial 8 finished with value: 0.560427807486631 and parameters: {'C': 0.03890717605674483, 'gamma': 'scale', 'kernel': 'poly'}. Best is trial 0 with value: 0.5969696969696969.
[I 2026-06-14 18:17:40,743] Trial 8 finished with value: 0.5848484848484848 and parameters: {'C': 1.0646431282084174, 'gamma': 'auto', 'kernel': 'sigmoid'}. Best is trial 4 with value: 0.6146167557932263.
[I 2026-06-14 18:17:40,747] Trial 9 finished with value: 0.5294117647058824 and parameters: {'C': 0.04187984097041214, 'gamma': 'scale', 'kernel': 'poly'}. Best is trial 8 with value: 0.7468805704099821.
[I 2026-06-14 18:17:40,750] Trial 11 finished with value: 0.5237076648841354 and parameters: {'C': 51.7122457224681, 'gamma': 'auto', 'kernel': 'sigmoid'}. Best is trial 5 with value: 0.6265597147950089.
[I 2026-06-14 18:17:40,755] Trial 8 finished with value: 0.47593582887700536 and parameters: {'C': 0.01595882716272646, 'gamma': 'auto', 'kernel': 'rbf'}. Best is trial 6 with value: 0.6629233511586453.
[I 2026-06-14 18:17:40,768] Trial 9 finished with value: 0.48770053475935826 and parameters: {'C': 0.0343362729398123, 'gamma': 'scale', 'kernel': 'rbf'}. Best is trial 0 with value: 0.5969696969696969.
[I 2026-06-14 18:17:40,776] Trial 1 finished with value: 0.5058823529411764 and parameters: {'C': 0.019545588882305693, 'gamma': 'auto', 'kernel': 'poly'}. Best is trial 0 with value: 0.5903743315508021.
[I 2026-06-14 18:17:40,781] Trial 9 finished with value: 0.6388591800356506 and parameters: {'C': 1.0005718715689669, 'gamma': 'scale', 'kernel': 'rbf'}. Best is trial 9 with value: 0.6388591800356506.
[I 2026-06-14 18:17:40,791] Trial 10 finished with value: 0.49411764705882355 and parameters: {'C': 0.0017197824250820158, 'gamma': 'auto', 'kernel': 'sigmoid'}. Best is trial 8 with value: 0.7468805704099821.
[I 2026-06-14 18:17:40,792] Trial 12 finished with value: 0.5841354723707665 and parameters: {'C': 44.27592474343406, 'gamma': 'auto', 'kernel': 'rbf'}. Best is trial 5 with value: 0.6265597147950089.
[I 2026-06-14 18:17:40,794] Trial 9 finished with value: 0.6149732620320856 and parameters: {'C': 27.27014827000831, 'gamma': 'auto', 'kernel': 'poly'}. Best is trial 6 with value: 0.6629233511586453.
[I 2026-06-14 18:17:40,817] Trial 10 finished with value: 0.5969696969696969 and parameters: {'C': 67.9170045062727, 'gamma': 'auto', 'kernel': 'rbf'}. Best is trial 0 with value: 0.5969696969696969.
[I 2026-06-14 18:17:40,822] Trial 11 finished with value: 0.7049910873440286 and parameters: {'C': 81.4797007507681, 'gamma': 'auto', 'kernel': 'sigmoid'}. Best is trial 8 with value: 0.7468805704099821.
[I 2026-06-14 18:17:40,823] Trial 10 finished with value: 0.48770053475935826 and parameters: {'C': 0.0013375054899526456, 'gamma': 'scale', 'kernel': 'rbf'}. Best is trial 9 with value: 0.6388591800356506.
[I 2026-06-14 18:17:40,828] Trial 13 finished with value: 0.6204991087344028 and parameters: {'C': 0.3447645720184988, 'gamma': 'auto', 'kernel': 'sigmoid'}. Best is trial 5 with value: 0.6265597147950089.
[I 2026-06-14 18:17:40,836] Trial 10 finished with value: 0.6327985739750445 and parameters: {'C': 0.761840446309988, 'gamma': 'scale', 'kernel': 'sigmoid'}. Best is trial 6 with value: 0.6629233511586453.
[I 2026-06-14 18:17:40,856] Trial 12 finished with value: 0.6989304812834225 and parameters: {'C': 78.41344431307625, 'gamma': 'auto', 'kernel': 'sigmoid'}. Best is trial 8 with value: 0.7468805704099821.
[I 2026-06-14 18:17:40,866] Trial 14 finished with value: 0.6204991087344028 and parameters: {'C': 0.23798949787248844, 'gamma': 'scale', 'kernel': 'sigmoid'}. Best is trial 5 with value: 0.6265597147950089.
[I 2026-06-14 18:17:40,869] Trial 11 finished with value: 0.5969696969696969 and parameters: {'C': 78.90287325166594, 'gamma': 'auto', 'kernel': 'rbf'}. Best is trial 0 with value: 0.5969696969696969.
[I 2026-06-14 18:17:40,872] Trial 11 finished with value: 0.6146167557932263 and parameters: {'C': 61.935445011106665, 'gamma': 'scale', 'kernel': 'rbf'}. Best is trial 9 with value: 0.6388591800356506.
[I 2026-06-14 18:17:40,882] Trial 11 finished with value: 0.6450980392156863 and parameters: {'C': 80.33158769384968, 'gamma': 'scale', 'kernel': 'rbf'}. Best is trial 6 with value: 0.6629233511586453.
[I 2026-06-14 18:17:40,892] Trial 13 finished with value: 0.704812834224599 and parameters: {'C': 4.371527018874084, 'gamma': 'auto', 'kernel': 'sigmoid'}. Best is trial 8 with value: 0.7468805704099821.
[I 2026-06-14 18:17:40,900] Trial 15 finished with value: 0.5725490196078431 and parameters: {'C': 1.0745526294943528, 'gamma': 'auto', 'kernel': 'sigmoid'}. Best is trial 5 with value: 0.6265597147950089.
[I 2026-06-14 18:17:40,901] Trial 2 finished with value: 0.5418894830659536 and parameters: {'C': 67.89069752955238, 'gamma': 'auto', 'kernel': 'sigmoid'}. Best is trial 0 with value: 0.5903743315508021.
[I 2026-06-14 18:17:40,917] Trial 12 finished with value: 0.5969696969696969 and parameters: {'C': 83.35863594000969, 'gamma': 'auto', 'kernel': 'rbf'}. Best is trial 0 with value: 0.5969696969696969.
[I 2026-06-14 18:17:40,918] Trial 12 finished with value: 0.6089126559714795 and parameters: {'C': 0.6634867753981518, 'gamma': 'scale', 'kernel': 'rbf'}. Best is trial 9 with value: 0.6388591800356506.
[I 2026-06-14 18:17:40,927] Trial 12 finished with value: 0.6204991087344028 and parameters: {'C': 5.704643724798954, 'gamma': 'scale', 'kernel': 'rbf'}. Best is trial 6 with value: 0.6629233511586453.
[I 2026-06-14 18:17:40,937] Trial 14 finished with value: 0.7650623885918003 and parameters: {'C': 0.7149198668640165, 'gamma': 'auto', 'kernel': 'sigmoid'}. Best is trial 14 with value: 0.7650623885918003.
[I 2026-06-14 18:17:40,938] Trial 16 finished with value: 0.6087344028520498 and parameters: {'C': 0.060194647340645696, 'gamma': 'scale', 'kernel': 'sigmoid'}. Best is trial 5 with value: 0.6265597147950089.
[I 2026-06-14 18:17:40,966] Trial 13 finished with value: 0.5967914438502674 and parameters: {'C': 7.861792185120283, 'gamma': 'auto', 'kernel': 'rbf'}. Best is trial 0 with value: 0.5969696969696969.
[I 2026-06-14 18:17:40,973] Trial 17 finished with value: 0.5602495543672015 and parameters: {'C': 1.7527414039025047, 'gamma': 'auto', 'kernel': 'sigmoid'}. Best is trial 5 with value: 0.6265597147950089.
[I 2026-06-14 18:17:40,973] Trial 13 finished with value: 0.6146167557932263 and parameters: {'C': 54.10089539205271, 'gamma': 'scale', 'kernel': 'rbf'}. Best is trial 9 with value: 0.6388591800356506.
[I 2026-06-14 18:17:40,975] Trial 15 finished with value: 0.7468805704099821 and parameters: {'C': 0.6105770072286966, 'gamma': 'auto', 'kernel': 'sigmoid'}. Best is trial 14 with value: 0.7650623885918003.
[I 2026-06-14 18:17:40,976] Trial 13 finished with value: 0.6146167557932264 and parameters: {'C': 3.420433798338424, 'gamma': 'scale', 'kernel': 'rbf'}. Best is trial 6 with value: 0.6629233511586453.
[I 2026-06-14 18:17:41,000] Trial 18 finished with value: 0.5301247771836006 and parameters: {'C': 0.19245975592580636, 'gamma': 'auto', 'kernel': 'poly'}. Best is trial 5 with value: 0.6265597147950089.
[I 2026-06-14 18:17:41,009] Trial 14 finished with value: 0.5606060606060606 and parameters: {'C': 2.2530201429200494, 'gamma': 'auto', 'kernel': 'sigmoid'}. Best is trial 0 with value: 0.5969696969696969.
[I 2026-06-14 18:17:41,011] Trial 16 finished with value: 0.6807486631016042 and parameters: {'C': 0.7899539058816254, 'gamma': 'auto', 'kernel': 'rbf'}. Best is trial 14 with value: 0.7650623885918003.
[I 2026-06-14 18:17:41,021] Trial 14 finished with value: 0.6390374331550802 and parameters: {'C': 11.814240437002303, 'gamma': 'auto', 'kernel': 'rbf'}. Best is trial 6 with value: 0.6629233511586453.
[I 2026-06-14 18:17:41,024] Trial 14 finished with value: 0.6087344028520498 and parameters: {'C': 11.952870546218278, 'gamma': 'scale', 'kernel': 'rbf'}. Best is trial 9 with value: 0.6388591800356506.
[I 2026-06-14 18:17:41,037] Trial 19 finished with value: 0.5966131907308377 and parameters: {'C': 0.08342958249252456, 'gamma': 'scale', 'kernel': 'sigmoid'}. Best is trial 5 with value: 0.6265597147950089.
[I 2026-06-14 18:17:41,050] Trial 17 finished with value: 0.73475935828877 and parameters: {'C': 0.07461184041654266, 'gamma': 'auto', 'kernel': 'sigmoid'}. Best is trial 14 with value: 0.7650623885918003.
[I 2026-06-14 18:17:41,055] Trial 15 finished with value: 0.5969696969696969 and parameters: {'C': 29.846651386456717, 'gamma': 'auto', 'kernel': 'rbf'}. Best is trial 0 with value: 0.5969696969696969.
[I 2026-06-14 18:17:41,060] Trial 15 finished with value: 0.6263814616755794 and parameters: {'C': 0.9199351638436634, 'gamma': 'scale', 'kernel': 'sigmoid'}. Best is trial 6 with value: 0.6629233511586453.
[I 2026-06-14 18:17:41,066] Trial 15 finished with value: 0.5909090909090909 and parameters: {'C': 0.5570278916810769, 'gamma': 'scale', 'kernel': 'sigmoid'}. Best is trial 9 with value: 0.6388591800356506.
[I 2026-06-14 18:17:41,069] Trial 20 finished with value: 0.6024955436720143 and parameters: {'C': 0.45424033360527794, 'gamma': 'auto', 'kernel': 'sigmoid'}. Best is trial 5 with value: 0.6265597147950089.
[I 2026-06-14 18:17:41,089] Trial 18 finished with value: 0.7229946524064171 and parameters: {'C': 1.5583651202315896, 'gamma': 'auto', 'kernel': 'sigmoid'}. Best is trial 14 with value: 0.7650623885918003.
[I 2026-06-14 18:17:41,099] Trial 16 finished with value: 0.5967914438502674 and parameters: {'C': 1.953068616517202, 'gamma': 'auto', 'kernel': 'rbf'}. Best is trial 0 with value: 0.5969696969696969.
[I 2026-06-14 18:17:41,103] Trial 0 finished with value: 0.47593582887700536 and parameters: {'C': 0.006787938752232405, 'gamma': 'scale', 'kernel': 'rbf'}. Best is trial 0 with value: 0.47593582887700536.
[I 2026-06-14 18:17:41,106] Trial 16 finished with value: 0.6450980392156863 and parameters: {'C': 87.2020031404671, 'gamma': 'scale', 'kernel': 'rbf'}. Best is trial 6 with value: 0.6629233511586453.
[I 2026-06-14 18:17:41,112] Trial 16 finished with value: 0.5966131907308377 and parameters: {'C': 10.105951352537334, 'gamma': 'scale', 'kernel': 'rbf'}. Best is trial 9 with value: 0.6388591800356506.
[I 2026-06-14 18:17:41,113] Trial 21 finished with value: 0.6204991087344028 and parameters: {'C': 0.2024861398378063, 'gamma': 'scale', 'kernel': 'sigmoid'}. Best is trial 5 with value: 0.6265597147950089.
[I 2026-06-14 18:17:41,133] Trial 19 finished with value: 0.6688057040998217 and parameters: {'C': 10.78296780050951, 'gamma': 'auto', 'kernel': 'rbf'}. Best is trial 14 with value: 0.7650623885918003.
[I 2026-06-14 18:17:41,136] Trial 3 finished with value: 0.47593582887700536 and parameters: {'C': 0.0034848711080698726, 'gamma': 'auto', 'kernel': 'rbf'}. Best is trial 0 with value: 0.5903743315508021.
[I 2026-06-14 18:17:41,149] Trial 22 finished with value: 0.584313725490196 and parameters: {'C': 0.5116092697273594, 'gamma': 'scale', 'kernel': 'sigmoid'}. Best is trial 5 with value: 0.6265597147950089.
[I 2026-06-14 18:17:41,149] Trial 17 finished with value: 0.6089126559714795 and parameters: {'C': 0.24293245517099496, 'gamma': 'auto', 'kernel': 'sigmoid'}. Best is trial 6 with value: 0.6629233511586453.
[I 2026-06-14 18:17:41,150] Trial 17 finished with value: 0.5969696969696969 and parameters: {'C': 30.40863353254774, 'gamma': 'auto', 'kernel': 'rbf'}. Best is trial 0 with value: 0.5969696969696969.
