[I 2026-06-14 18:17:43,657] Trial 83 finished with value: 0.7590017825311943 and parameters: {'C': 0.6893178294050551, 'gamma': 'scale', 'kernel': 'sigmoid'}. Best is trial 14 with value: 0.7650623885918003.
[I 2026-06-14 18:17:43,662] Trial 74 finished with value: 0.6450980392156863 and parameters: {'C': 22.35369695103499, 'gamma': 'scale', 'kernel': 'rbf'}. Best is trial 6 with value: 0.6629233511586453.
[I 2026-06-14 18:17:43,670] Trial 97 finished with value: 0.6506238859180036 and parameters: {'C': 0.9309356715665944, 'gamma': 'scale', 'kernel': 'rbf'}. Best is trial 73 with value: 0.65650623885918.
[I 2026-06-14 18:17:43,683] Trial 70 finished with value: 0.5481283422459893 and parameters: {'C': 0.7964883426124362, 'gamma': 'auto', 'kernel': 'rbf'}. Best is trial 38 with value: 0.6089126559714795.
[I 2026-06-14 18:17:43,684] Trial 77 finished with value: 0.6265597147950089 and parameters: {'C': 1.810574015278941, 'gamma': 'scale', 'kernel': 'rbf'}. Best is trial 57 with value: 0.6388591800356507.
[I 2026-06-14 18:17:43,701] Trial 84 finished with value: 0.7404634581105171 and parameters: {'C': 0.3414010127333945, 'gamma': 'scale', 'kernel': 'sigmoid'}. Best is trial 14 with value: 0.7650623885918003.
[I 2026-06-14 18:17:43,706] Trial 98 finished with value: 0.48770053475935826 and parameters: {'C': 0.0026067106582104986, 'gamma': 'scale', 'kernel': 'rbf'}. Best is trial 73 with value: 0.65650623885918.
[I 2026-06-14 18:17:43,708] Trial 75 finished with value: 0.6450980392156863 and parameters: {'C': 32.75548648873563, 'gamma': 'scale', 'kernel': 'rbf'}. Best is trial 6 with value: 0.6629233511586453.
[I 2026-06-14 18:17:43,728] Trial 78 finished with value: 0.6326203208556149 and parameters: {'C': 2.4029927624912744, 'gamma': 'scale', 'kernel': 'rbf'}. Best is trial 57 with value: 0.6388591800356507.
[I 2026-06-14 18:17:43,733] Trial 71 finished with value: 0.6028520499108734 and parameters: {'C': 10.55812394694407, 'gamma': 'auto', 'kernel': 'rbf'}. Best is trial 38 with value: 0.6089126559714795.
[I 2026-06-14 18:17:43,738] Trial 85 finished with value: 0.7290552584670232 and parameters: {'C': 1.4881939425311763, 'gamma': 'scale', 'kernel': 'sigmoid'}. Best is trial 14 with value: 0.7650623885918003.
[I 2026-06-14 18:17:43,739] Trial 99 finished with value: 0.5297682709447415 and parameters: {'C': 2.136556674029784, 'gamma': 'scale', 'kernel': 'poly'}. Best is trial 73 with value: 0.65650623885918.
[I 2026-06-14 18:17:43,756] Trial 76 finished with value: 0.6450980392156863 and parameters: {'C': 49.75723855623824, 'gamma': 'auto', 'kernel': 'rbf'}. Best is trial 6 with value: 0.6629233511586453.
[I 2026-06-14 18:17:43,776] Trial 79 finished with value: 0.5240641711229947 and parameters: {'C': 0.17008950466306164, 'gamma': 'scale', 'kernel': 'rbf'}. Best is trial 57 with value: 0.6388591800356507.
[I 2026-06-14 18:17:43,777] Trial 86 finished with value: 0.7590017825311943 and parameters: {'C': 0.7643848983966213, 'gamma': 'scale', 'kernel': 'sigmoid'}. Best is trial 14 with value: 0.7650623885918003.
[I 2026-06-14 18:17:43,778] Trial 100 finished with value: 0.6083778966131907 and parameters: {'C': 0.4723194043308086, 'gamma': 'scale', 'kernel': 'rbf'}. Best is trial 73 with value: 0.65650623885918.
[I 2026-06-14 18:17:43,785] Trial 72 finished with value: 0.5969696969696969 and parameters: {'C': 15.79961117252251, 'gamma': 'auto', 'kernel': 'rbf'}. Best is trial 38 with value: 0.6089126559714795.
[I 2026-06-14 18:17:43,797] Trial 77 finished with value: 0.6686274509803922 and parameters: {'C': 11.20781629880476, 'gamma': 'scale', 'kernel': 'sigmoid'}. Best is trial 77 with value: 0.6686274509803922.
[I 2026-06-14 18:17:43,811] Trial 87 finished with value: 0.686452762923351 and parameters: {'C': 0.9732650234578648, 'gamma': 'scale', 'kernel': 'poly'}. Best is trial 14 with value: 0.7650623885918003.
[I 2026-06-14 18:17:43,819] Trial 101 finished with value: 0.6320855614973262 and parameters: {'C': 0.7204764258243777, 'gamma': 'scale', 'kernel': 'rbf'}. Best is trial 73 with value: 0.65650623885918.
[I 2026-06-14 18:17:43,826] Trial 80 finished with value: 0.5725490196078431 and parameters: {'C': 0.2184887125686105, 'gamma': 'scale', 'kernel': 'sigmoid'}. Best is trial 57 with value: 0.6388591800356507.
[I 2026-06-14 18:17:43,838] Trial 73 finished with value: 0.5966131907308377 and parameters: {'C': 5.133345250272309, 'gamma': 'auto', 'kernel': 'rbf'}. Best is trial 38 with value: 0.6089126559714795.
[I 2026-06-14 18:17:43,838] Trial 78 finished with value: 0.6385026737967915 and parameters: {'C': 2.821493875229934, 'gamma': 'scale', 'kernel': 'sigmoid'}. Best is trial 77 with value: 0.6686274509803922.
[I 2026-06-14 18:17:43,851] Trial 88 finished with value: 0.7349376114081997 and parameters: {'C': 3.432392020984275, 'gamma': 'scale', 'kernel': 'sigmoid'}. Best is trial 14 with value: 0.7650623885918003.
[I 2026-06-14 18:17:43,859] Trial 102 finished with value: 0.6445632798573975 and parameters: {'C': 1.0543411164079668, 'gamma': 'scale', 'kernel': 'rbf'}. Best is trial 73 with value: 0.65650623885918.
[I 2026-06-14 18:17:43,868] Trial 81 finished with value: 0.5912655971479501 and parameters: {'C': 0.3805934466770934, 'gamma': 'scale', 'kernel': 'rbf'}. Best is trial 57 with value: 0.6388591800356507.
[I 2026-06-14 18:17:43,871] Trial 16 finished with value: 0.48770053475935826 and parameters: {'C': 0.001245790141718246, 'gamma': 'scale', 'kernel': 'rbf'}. Best is trial 5 with value: 0.6081996434937611.
[I 2026-06-14 18:17:43,874] Trial 79 finished with value: 0.6447415329768271 and parameters: {'C': 5.273030076989525, 'gamma': 'scale', 'kernel': 'sigmoid'}. Best is trial 77 with value: 0.6686274509803922.
[I 2026-06-14 18:17:43,885] Trial 74 finished with value: 0.6028520499108734 and parameters: {'C': 8.043070314773367, 'gamma': 'auto', 'kernel': 'rbf'}. Best is trial 38 with value: 0.6089126559714795.
[I 2026-06-14 18:17:43,888] Trial 89 finished with value: 0.7288770053475936 and parameters: {'C': 2.2116369813462256, 'gamma': 'scale', 'kernel': 'sigmoid'}. Best is trial 14 with value: 0.7650623885918003.
[I 2026-06-14 18:17:43,892] Trial 103 finished with value: 0.6385026737967914 and parameters: {'C': 1.5799883981268414, 'gamma': 'scale', 'kernel': 'rbf'}. Best is trial 73 with value: 0.65650623885918.
[I 2026-06-14 18:17:43,913] Trial 80 finished with value: 0.6506238859180036 and parameters: {'C': 8.72656236281557, 'gamma': 'scale', 'kernel': 'sigmoid'}. Best is trial 77 with value: 0.6686274509803922.
[I 2026-06-14 18:17:43,914] Trial 82 finished with value: 0.6327985739750446 and parameters: {'C': 4.3776465590472915, 'gamma': 'scale', 'kernel': 'rbf'}. Best is trial 57 with value: 0.6388591800356507.
[I 2026-06-14 18:17:43,925] Trial 104 finished with value: 0.6142602495543672 and parameters: {'C': 0.3811536839556227, 'gamma': 'scale', 'kernel': 'rbf'}. Best is trial 73 with value: 0.65650623885918.
[I 2026-06-14 18:17:43,930] Trial 90 finished with value: 0.7406417112299465 and parameters: {'C': 0.4477019485854316, 'gamma': 'scale', 'kernel': 'sigmoid'}. Best is trial 14 with value: 0.7650623885918003.
[I 2026-06-14 18:17:43,938] Trial 75 finished with value: 0.5969696969696969 and parameters: {'C': 13.618994435484822, 'gamma': 'auto', 'kernel': 'rbf'}. Best is trial 38 with value: 0.6089126559714795.
[I 2026-06-14 18:17:43,951] Trial 81 finished with value: 0.6265597147950088 and parameters: {'C': 11.763166108291127, 'gamma': 'scale', 'kernel': 'sigmoid'}. Best is trial 77 with value: 0.6686274509803922.
[I 2026-06-14 18:17:43,958] Trial 105 finished with value: 0.6445632798573975 and parameters: {'C': 1.1250747778439998, 'gamma': 'scale', 'kernel': 'rbf'}. Best is trial 73 with value: 0.65650623885918.
[I 2026-06-14 18:17:43,959] Trial 83 finished with value: 0.6329768270944741 and parameters: {'C': 1.071934447611555, 'gamma': 'scale', 'kernel': 'rbf'}. Best is trial 57 with value: 0.6388591800356507.
[I 2026-06-14 18:17:43,968] Trial 91 finished with value: 0.7590017825311943 and parameters: {'C': 0.746243886555451, 'gamma': 'scale', 'kernel': 'sigmoid'}. Best is trial 14 with value: 0.7650623885918003.
[I 2026-06-14 18:17:43,975] Trial 76 finished with value: 0.5959001782531195 and parameters: {'C': 3.7534150372445167, 'gamma': 'auto', 'kernel': 'poly'}. Best is trial 38 with value: 0.6089126559714795.
[I 2026-06-14 18:17:43,988] Trial 82 finished with value: 0.626916221033868 and parameters: {'C': 7.6752050380532255, 'gamma': 'scale', 'kernel': 'sigmoid'}. Best is trial 77 with value: 0.6686274509803922.
[I 2026-06-14 18:17:43,991] Trial 106 finished with value: 0.6385026737967914 and parameters: {'C': 1.8834188523480189, 'gamma': 'scale', 'kernel': 'rbf'}. Best is trial 73 with value: 0.65650623885918.
[I 2026-06-14 18:17:43,995] Trial 5 finished with value: 0.48770053475935826 and parameters: {'C': 0.006089572067440431, 'gamma': 'auto', 'kernel': 'sigmoid'}. Best is trial 1 with value: 0.6445632798573975.
[I 2026-06-14 18:17:44,001] Trial 84 finished with value: 0.6089126559714795 and parameters: {'C': 0.6666342225733486, 'gamma': 'scale', 'kernel': 'rbf'}. Best is trial 57 with value: 0.6388591800356507.
[I 2026-06-14 18:17:44,007] Trial 92 finished with value: 0.7529411764705882 and parameters: {'C': 0.7434627347812379, 'gamma': 'scale', 'kernel': 'sigmoid'}. Best is trial 14 with value: 0.7650623885918003.
[I 2026-06-14 18:17:44,023] Trial 77 finished with value: 0.6028520499108734 and parameters: {'C': 8.847872138359493, 'gamma': 'auto', 'kernel': 'rbf'}. Best is trial 38 with value: 0.6089126559714795.
[I 2026-06-14 18:17:44,024] Trial 107 finished with value: 0.6081996434937611 and parameters: {'C': 0.2943684705220057, 'gamma': 'auto', 'kernel': 'rbf'}. Best is trial 73 with value: 0.65650623885918.
[I 2026-06-14 18:17:44,026] Trial 83 finished with value: 0.6568627450980391 and parameters: {'C': 10.11472165454752, 'gamma': 'scale', 'kernel': 'sigmoid'}. Best is trial 77 with value: 0.6686274509803922.
[I 2026-06-14 18:17:44,044] Trial 85 finished with value: 0.6265597147950089 and parameters: {'C': 1.4408540817266773, 'gamma': 'scale', 'kernel': 'rbf'}. Best is trial 57 with value: 0.6388591800356507.
[I 2026-06-14 18:17:44,046] Trial 93 finished with value: 0.7349376114081997 and parameters: {'C': 1.1771504844872314, 'gamma': 'scale', 'kernel': 'sigmoid'}. Best is trial 14 with value: 0.7650623885918003.
[I 2026-06-14 18:17:44,056] Trial 108 finished with value: 0.6383244206773618 and parameters: {'C': 3.042959847802028, 'gamma': 'scale', 'kernel': 'rbf'}. Best is trial 73 with value: 0.65650623885918.
[I 2026-06-14 18:17:44,063] Trial 84 finished with value: 0.6080213903743317 and parameters: {'C': 13.169977900802326, 'gamma': 'scale', 'kernel': 'sigmoid'}. Best is trial 77 with value: 0.6686274509803922.
[I 2026-06-14 18:17:44,070] Trial 78 finished with value: 0.5969696969696969 and parameters: {'C': 29.084557300913534, 'gamma': 'auto', 'kernel': 'rbf'}. Best is trial 38 with value: 0.6089126559714795.
[I 2026-06-14 18:17:44,086] Trial 86 finished with value: 0.6388591800356506 and parameters: {'C': 1.045624194618317, 'gamma': 'scale', 'kernel': 'rbf'}. Best is trial 57 with value: 0.6388591800356507.
[I 2026-06-14 18:17:44,086] Trial 94 finished with value: 0.7344028520499111 and parameters: {'C': 0.27194773527370236, 'gamma': 'scale', 'kernel': 'sigmoid'}. Best is trial 14 with value: 0.7650623885918003.
[I 2026-06-14 18:17:44,089] Trial 109 finished with value: 0.6506238859180036 and parameters: {'C': 0.9640901389747267, 'gamma': 'scale', 'kernel': 'rbf'}. Best is trial 73 with value: 0.65650623885918.
[I 2026-06-14 18:17:44,102] Trial 85 finished with value: 0.6688057040998218 and parameters: {'C': 9.188481870942791, 'gamma': 'scale', 'kernel': 'sigmoid'}. Best is trial 85 with value: 0.6688057040998218.
[I 2026-06-14 18:17:44,115] Trial 79 finished with value: 0.5541889483065954 and parameters: {'C': 0.46652486434273027, 'gamma': 'scale', 'kernel': 'rbf'}. Best is trial 38 with value: 0.6089126559714795.
[I 2026-06-14 18:17:44,120] Trial 17 finished with value: 0.5837789661319073 and parameters: {'C': 19.2954727341993, 'gamma': 'auto', 'kernel': 'rbf'}. Best is trial 5 with value: 0.6081996434937611.
[I 2026-06-14 18:17:44,122] Trial 110 finished with value: 0.6443850267379678 and parameters: {'C': 1.3876462956567066, 'gamma': 'scale', 'kernel': 'rbf'}. Best is trial 73 with value: 0.65650623885918.
[I 2026-06-14 18:17:44,124] Trial 95 finished with value: 0.7285204991087344 and parameters: {'C': 1.664157922778727, 'gamma': 'scale', 'kernel': 'sigmoid'}. Best is trial 14 with value: 0.7650623885918003.
[I 2026-06-14 18:17:44,135] Trial 87 finished with value: 0.638680926916221 and parameters: {'C': 2.5860022378362437, 'gamma': 'scale', 'kernel': 'rbf'}. Best is trial 57 with value: 0.6388591800356507.
[I 2026-06-14 18:17:44,146] Trial 86 finished with value: 0.6326203208556149 and parameters: {'C': 1.5383225719703162, 'gamma': 'scale', 'kernel': 'sigmoid'}. Best is trial 85 with value: 0.6688057040998218.
[I 2026-06-14 18:17:44,158] Trial 111 finished with value: 0.6506238859180036 and parameters: {'C': 0.8515296745291521, 'gamma': 'scale', 'kernel': 'rbf'}. Best is trial 73 with value: 0.65650623885918.
[I 2026-06-14 18:17:44,158] Trial 80 finished with value: 0.5606060606060606 and parameters: {'C': 2.3347565348263832, 'gamma': 'auto', 'kernel': 'sigmoid'}. Best is trial 38 with value: 0.6089126559714795.
[I 2026-06-14 18:17:44,162] Trial 96 finished with value: 0.5971479500891265 and parameters: {'C': 0.0033546447387987595, 'gamma': 'scale', 'kernel': 'rbf'}. Best is trial 14 with value: 0.7650623885918003.
[I 2026-06-14 18:17:44,178] Trial 88 finished with value: 0.638680926916221 and parameters: {'C': 2.5918252451217865, 'gamma': 'scale', 'kernel': 'rbf'}. Best is trial 57 with value: 0.6388591800356507.
[I 2026-06-14 18:17:44,186] Trial 87 finished with value: 0.6388591800356506 and parameters: {'C': 4.440957995387423, 'gamma': 'auto', 'kernel': 'sigmoid'}. Best is trial 85 with value: 0.6688057040998218.
[I 2026-06-14 18:17:44,193] Trial 112 finished with value: 0.6204991087344028 and parameters: {'C': 0.5673766552155248, 'gamma': 'scale', 'kernel': 'rbf'}. Best is trial 73 with value: 0.65650623885918.
[I 2026-06-14 18:17:44,201] Trial 97 finished with value: 0.7288770053475936 and parameters: {'C': 0.4856803241750236, 'gamma': 'scale', 'kernel': 'sigmoid'}. Best is trial 14 with value: 0.7650623885918003.
[I 2026-06-14 18:17:44,207] Trial 81 finished with value: 0.5969696969696969 and parameters: {'C': 11.148355256940095, 'gamma': 'auto', 'kernel': 'rbf'}. Best is trial 38 with value: 0.6089126559714795.
[I 2026-06-14 18:17:44,223] Trial 89 finished with value: 0.5966131907308377 and parameters: {'C': 9.779298438092093, 'gamma': 'scale', 'kernel': 'rbf'}. Best is trial 57 with value: 0.6388591800356507.
[I 2026-06-14 18:17:44,225] Trial 113 finished with value: 0.6381461675579322 and parameters: {'C': 0.7293237465377429, 'gamma': 'scale', 'kernel': 'rbf'}. Best is trial 73 with value: 0.65650623885918.
[I 2026-06-14 18:17:44,226] Trial 88 finished with value: 0.65650623885918 and parameters: {'C': 3.0985351518829094, 'gamma': 'scale', 'kernel': 'sigmoid'}. Best is trial 85 with value: 0.6688057040998218.
[I 2026-06-14 18:17:44,241] Trial 98 finished with value: 0.7408199643493761 and parameters: {'C': 0.9891096753762818, 'gamma': 'scale', 'kernel': 'sigmoid'}. Best is trial 14 with value: 0.7650623885918003.
[I 2026-06-14 18:17:44,259] Trial 114 finished with value: 0.6506238859180036 and parameters: {'C': 0.9962153843117059, 'gamma': 'scale', 'kernel': 'rbf'}. Best is trial 73 with value: 0.65650623885918.
[I 2026-06-14 18:17:44,264] Trial 82 finished with value: 0.5969696969696969 and parameters: {'C': 16.158905248644675, 'gamma': 'auto', 'kernel': 'rbf'}. Best is trial 38 with value: 0.6089126559714795.
[I 2026-06-14 18:17:44,269] Trial 90 finished with value: 0.6388591800356507 and parameters: {'C': 2.6988706069391735, 'gamma': 'scale', 'kernel': 'rbf'}. Best is trial 57 with value: 0.6388591800356507.
[I 2026-06-14 18:17:44,270] Trial 89 finished with value: 0.6263814616755793 and parameters: {'C': 2.410724663719757, 'gamma': 'scale', 'kernel': 'sigmoid'}. Best is trial 85 with value: 0.6688057040998218.
[I 2026-06-14 18:17:44,281] Trial 99 finished with value: 0.7529411764705882 and parameters: {'C': 0.7421874502748376, 'gamma': 'scale', 'kernel': 'sigmoid'}. Best is trial 14 with value: 0.7650623885918003.
[I 2026-06-14 18:17:44,294] Trial 115 finished with value: 0.6506238859180036 and parameters: {'C': 2.501178983374124, 'gamma': 'scale', 'kernel': 'rbf'}. Best is trial 73 with value: 0.65650623885918.
[I 2026-06-14 18:17:44,297] Trial 18 finished with value: 0.5301247771836006 and parameters: {'C': 3.21151437431762, 'gamma': 'scale', 'kernel': 'sigmoid'}. Best is trial 5 with value: 0.6081996434937611.
[I 2026-06-14 18:17:44,316] Trial 90 finished with value: 0.6142602495543671 and parameters: {'C': 1.1636473167449657, 'gamma': 'scale', 'kernel': 'sigmoid'}. Best is trial 85 with value: 0.6688057040998218.
[I 2026-06-14 18:17:44,318] Trial 83 finished with value: 0.6026737967914438 and parameters: {'C': 5.810958204611734, 'gamma': 'auto', 'kernel': 'rbf'}. Best is trial 38 with value: 0.6089126559714795.
[I 2026-06-14 18:17:44,323] Trial 91 finished with value: 0.6447415329768271 and parameters: {'C': 2.6424497689551494, 'gamma': 'scale', 'kernel': 'rbf'}. Best is trial 91 with value: 0.6447415329768271.
[I 2026-06-14 18:17:44,324] Trial 100 finished with value: 0.7465240641711232 and parameters: {'C': 0.37112742261677534, 'gamma': 'scale', 'kernel': 'sigmoid'}. Best is trial 14 with value: 0.7650623885918003.
[I 2026-06-14 18:17:44,329] Trial 116 finished with value: 0.6443850267379678 and parameters: {'C': 1.2641174122822818, 'gamma': 'scale', 'kernel': 'rbf'}. Best is trial 73 with value: 0.65650623885918.
[I 2026-06-14 18:17:44,360] Trial 91 finished with value: 0.6506238859180036 and parameters: {'C': 10.481896472685477, 'gamma': 'scale', 'kernel': 'sigmoid'}. Best is trial 85 with value: 0.6688057040998218.
[I 2026-06-14 18:17:44,365] Trial 101 finished with value: 0.7529411764705882 and parameters: {'C': 0.6169316470057945, 'gamma': 'scale', 'kernel': 'sigmoid'}. Best is trial 14 with value: 0.7650623885918003.
[I 2026-06-14 18:17:44,366] Trial 117 finished with value: 0.6087344028520498 and parameters: {'C': 4.162537601258666, 'gamma': 'scale', 'kernel': 'rbf'}. Best is trial 73 with value: 0.65650623885918.
[I 2026-06-14 18:17:44,369] Trial 92 finished with value: 0.6388591800356507 and parameters: {'C': 2.7082904264568115, 'gamma': 'scale', 'kernel': 'rbf'}. Best is trial 91 with value: 0.6447415329768271.
[I 2026-06-14 18:17:44,373] Trial 84 finished with value: 0.5969696969696969 and parameters: {'C': 19.79341580411228, 'gamma': 'auto', 'kernel': 'rbf'}. Best is trial 38 with value: 0.6089126559714795.
[I 2026-06-14 18:17:44,402] Trial 92 finished with value: 0.6146167557932263 and parameters: {'C': 6.106636108448704, 'gamma': 'scale', 'kernel': 'sigmoid'}. Best is trial 85 with value: 0.6688057040998218.
[I 2026-06-14 18:17:44,402] Trial 118 finished with value: 0.6385026737967914 and parameters: {'C': 1.8872838578568156, 'gamma': 'scale', 'kernel': 'rbf'}. Best is trial 73 with value: 0.65650623885918.
[I 2026-06-14 18:17:44,404] Trial 102 finished with value: 0.73475935828877 and parameters: {'C': 0.5152849687158277, 'gamma': 'scale', 'kernel': 'sigmoid'}. Best is trial 14 with value: 0.7650623885918003.
[I 2026-06-14 18:17:44,417] Trial 93 finished with value: 0.6267379679144385 and parameters: {'C': 4.554607398746806, 'gamma': 'scale', 'kernel': 'rbf'}. Best is trial 91 with value: 0.6447415329768271.
[I 2026-06-14 18:17:44,422] Trial 85 finished with value: 0.57825311942959 and parameters: {'C': 3.122230131765385, 'gamma': 'auto', 'kernel': 'rbf'}. Best is trial 38 with value: 0.6089126559714795.
[I 2026-06-14 18:17:44,433] Trial 119 finished with value: 0.5365418894830659 and parameters: {'C': 0.4298628770180454, 'gamma': 'scale', 'kernel': 'poly'}. Best is trial 73 with value: 0.65650623885918.
[I 2026-06-14 18:17:44,443] Trial 93 finished with value: 0.6629233511586453 and parameters: {'C': 10.249766513855448, 'gamma': 'scale', 'kernel': 'sigmoid'}. Best is trial 85 with value: 0.6688057040998218.
[I 2026-06-14 18:17:44,448] Trial 103 finished with value: 0.7529411764705882 and parameters: {'C': 0.7338131928932535, 'gamma': 'scale', 'kernel': 'sigmoid'}. Best is trial 14 with value: 0.7650623885918003.
[I 2026-06-14 18:17:44,465] Trial 94 finished with value: 0.6087344028520499 and parameters: {'C': 6.452516147338821, 'gamma': 'scale', 'kernel': 'rbf'}. Best is trial 91 with value: 0.6447415329768271.
[I 2026-06-14 18:17:44,468] Trial 120 finished with value: 0.6320855614973262 and parameters: {'C': 0.7035434289742443, 'gamma': 'scale', 'kernel': 'rbf'}. Best is trial 73 with value: 0.65650623885918.
[I 2026-06-14 18:17:44,475] Trial 86 finished with value: 0.5969696969696969 and parameters: {'C': 11.07448457744625, 'gamma': 'auto', 'kernel': 'rbf'}. Best is trial 38 with value: 0.6089126559714795.
[I 2026-06-14 18:17:44,484] Trial 94 finished with value: 0.6385026737967915 and parameters: {'C': 2.820337400047645, 'gamma': 'scale', 'kernel': 'sigmoid'}. Best is trial 85 with value: 0.6688057040998218.
[I 2026-06-14 18:17:44,486] Trial 104 finished with value: 0.7290552584670232 and parameters: {'C': 1.334809953324717, 'gamma': 'scale', 'kernel': 'sigmoid'}. Best is trial 14 with value: 0.7650623885918003.
[I 2026-06-14 18:17:44,502] Trial 121 finished with value: 0.6506238859180036 and parameters: {'C': 0.866936218678879, 'gamma': 'scale', 'kernel': 'rbf'}. Best is trial 73 with value: 0.65650623885918.
