[I 2026-06-14 18:17:44,507] Trial 95 finished with value: 0.6265597147950089 and parameters: {'C': 1.836199013988489, 'gamma': 'scale', 'kernel': 'rbf'}. Best is trial 91 with value: 0.6447415329768271.
[I 2026-06-14 18:17:44,521] Trial 19 finished with value: 0.5541889483065954 and parameters: {'C': 0.3830128437295911, 'gamma': 'auto', 'kernel': 'poly'}. Best is trial 5 with value: 0.6081996434937611.
[I 2026-06-14 18:17:44,524] Trial 87 finished with value: 0.566488413547237 and parameters: {'C': 1.5286704771482205, 'gamma': 'auto', 'kernel': 'rbf'}. Best is trial 38 with value: 0.6089126559714795.
[I 2026-06-14 18:17:44,524] Trial 95 finished with value: 0.6568627450980391 and parameters: {'C': 9.417559492674346, 'gamma': 'scale', 'kernel': 'sigmoid'}. Best is trial 85 with value: 0.6688057040998218.
[I 2026-06-14 18:17:44,535] Trial 105 finished with value: 0.7404634581105171 and parameters: {'C': 0.29981309226432884, 'gamma': 'scale', 'kernel': 'sigmoid'}. Best is trial 14 with value: 0.7650623885918003.
[I 2026-06-14 18:17:44,535] Trial 122 finished with value: 0.6506238859180036 and parameters: {'C': 0.9577216736378115, 'gamma': 'scale', 'kernel': 'rbf'}. Best is trial 73 with value: 0.65650623885918.
[I 2026-06-14 18:17:44,556] Trial 96 finished with value: 0.6388591800356507 and parameters: {'C': 2.723583299898175, 'gamma': 'scale', 'kernel': 'rbf'}. Best is trial 91 with value: 0.6447415329768271.
[I 2026-06-14 18:17:44,562] Trial 88 finished with value: 0.5716577540106953 and parameters: {'C': 7.617922125255317, 'gamma': 'auto', 'kernel': 'poly'}. Best is trial 38 with value: 0.6089126559714795.
[I 2026-06-14 18:17:44,566] Trial 96 finished with value: 0.6570409982174688 and parameters: {'C': 9.961963049511285, 'gamma': 'scale', 'kernel': 'sigmoid'}. Best is trial 85 with value: 0.6688057040998218.
[I 2026-06-14 18:17:44,568] Trial 106 finished with value: 0.6866310160427807 and parameters: {'C': 1.9653890965706238, 'gamma': 'scale', 'kernel': 'poly'}. Best is trial 14 with value: 0.7650623885918003.
[I 2026-06-14 18:17:44,569] Trial 123 finished with value: 0.6443850267379678 and parameters: {'C': 1.505509290900281, 'gamma': 'scale', 'kernel': 'rbf'}. Best is trial 73 with value: 0.65650623885918.
[I 2026-06-14 18:17:44,597] Trial 97 finished with value: 0.6265597147950089 and parameters: {'C': 1.4428184187599025, 'gamma': 'scale', 'kernel': 'rbf'}. Best is trial 91 with value: 0.6447415329768271.
[I 2026-06-14 18:17:44,603] Trial 124 finished with value: 0.6204991087344028 and parameters: {'C': 0.5635464139830932, 'gamma': 'scale', 'kernel': 'rbf'}. Best is trial 73 with value: 0.65650623885918.
[I 2026-06-14 18:17:44,608] Trial 107 finished with value: 0.7167557932263815 and parameters: {'C': 0.1388470462457062, 'gamma': 'scale', 'kernel': 'sigmoid'}. Best is trial 14 with value: 0.7650623885918003.
[I 2026-06-14 18:17:44,611] Trial 97 finished with value: 0.6449197860962566 and parameters: {'C': 9.671081674764938, 'gamma': 'scale', 'kernel': 'sigmoid'}. Best is trial 85 with value: 0.6688057040998218.
[I 2026-06-14 18:17:44,611] Trial 89 finished with value: 0.6023172905525846 and parameters: {'C': 4.540719113129843, 'gamma': 'auto', 'kernel': 'rbf'}. Best is trial 38 with value: 0.6089126559714795.
[I 2026-06-14 18:17:44,635] Trial 125 finished with value: 0.6445632798573975 and parameters: {'C': 1.126813268043837, 'gamma': 'scale', 'kernel': 'rbf'}. Best is trial 73 with value: 0.65650623885918.
[I 2026-06-14 18:17:44,641] Trial 98 finished with value: 0.620855614973262 and parameters: {'C': 4.20014016344486, 'gamma': 'scale', 'kernel': 'rbf'}. Best is trial 91 with value: 0.6447415329768271.
[I 2026-06-14 18:17:44,647] Trial 108 finished with value: 0.7165775401069518 and parameters: {'C': 0.20331405526679847, 'gamma': 'scale', 'kernel': 'sigmoid'}. Best is trial 14 with value: 0.7650623885918003.
[I 2026-06-14 18:17:44,654] Trial 98 finished with value: 0.644741532976827 and parameters: {'C': 7.7563529872486425, 'gamma': 'scale', 'kernel': 'sigmoid'}. Best is trial 85 with value: 0.6688057040998218.
[I 2026-06-14 18:17:44,661] Trial 90 finished with value: 0.5969696969696969 and parameters: {'C': 40.91920624308488, 'gamma': 'auto', 'kernel': 'rbf'}. Best is trial 38 with value: 0.6089126559714795.
[I 2026-06-14 18:17:44,670] Trial 126 finished with value: 0.6506238859180036 and parameters: {'C': 2.2997315695328036, 'gamma': 'scale', 'kernel': 'rbf'}. Best is trial 73 with value: 0.65650623885918.
[I 2026-06-14 18:17:44,672] Trial 6 finished with value: 0.6750445632798574 and parameters: {'C': 19.52256049477999, 'gamma': 'scale', 'kernel': 'rbf'}. Best is trial 6 with value: 0.6750445632798574.
[I 2026-06-14 18:17:44,687] Trial 99 finished with value: 0.6388591800356507 and parameters: {'C': 2.7944435799962726, 'gamma': 'scale', 'kernel': 'rbf'}. Best is trial 91 with value: 0.6447415329768271.
[I 2026-06-14 18:17:44,689] Trial 109 finished with value: 0.7527629233511588 and parameters: {'C': 1.0149897246953605, 'gamma': 'scale', 'kernel': 'sigmoid'}. Best is trial 14 with value: 0.7650623885918003.
[I 2026-06-14 18:17:44,695] Trial 99 finished with value: 0.6506238859180036 and parameters: {'C': 3.812137758981571, 'gamma': 'scale', 'kernel': 'sigmoid'}. Best is trial 85 with value: 0.6688057040998218.
[I 2026-06-14 18:17:44,705] Trial 127 finished with value: 0.6385026737967914 and parameters: {'C': 1.6926361367653373, 'gamma': 'auto', 'kernel': 'rbf'}. Best is trial 73 with value: 0.65650623885918.
[I 2026-06-14 18:17:44,713] Trial 91 finished with value: 0.5969696969696969 and parameters: {'C': 11.284387348869592, 'gamma': 'auto', 'kernel': 'rbf'}. Best is trial 38 with value: 0.6089126559714795.
[I 2026-06-14 18:17:44,736] Trial 20 finished with value: 0.49411764705882355 and parameters: {'C': 0.035911468439627954, 'gamma': 'scale', 'kernel': 'sigmoid'}. Best is trial 5 with value: 0.6081996434937611.
[I 2026-06-14 18:17:44,738] Trial 100 finished with value: 0.6087344028520499 and parameters: {'C': 5.432412586303698, 'gamma': 'scale', 'kernel': 'rbf'}. Best is trial 91 with value: 0.6447415329768271.
[I 2026-06-14 18:17:44,740] Trial 128 finished with value: 0.6265597147950089 and parameters: {'C': 3.3771674144531434, 'gamma': 'scale', 'kernel': 'rbf'}. Best is trial 73 with value: 0.65650623885918.
[I 2026-06-14 18:17:44,741] Trial 110 finished with value: 0.7465240641711232 and parameters: {'C': 0.3957514932009486, 'gamma': 'scale', 'kernel': 'sigmoid'}. Best is trial 14 with value: 0.7650623885918003.
[I 2026-06-14 18:17:44,742] Trial 100 finished with value: 0.6629233511586453 and parameters: {'C': 10.357271383589124, 'gamma': 'auto', 'kernel': 'sigmoid'}. Best is trial 85 with value: 0.6688057040998218.
[I 2026-06-14 18:17:44,766] Trial 92 finished with value: 0.6028520499108734 and parameters: {'C': 6.482880045263448, 'gamma': 'auto', 'kernel': 'rbf'}. Best is trial 38 with value: 0.6089126559714795.
[I 2026-06-14 18:17:44,773] Trial 129 finished with value: 0.6506238859180036 and parameters: {'C': 0.9445689583645993, 'gamma': 'scale', 'kernel': 'rbf'}. Best is trial 73 with value: 0.65650623885918.
[I 2026-06-14 18:17:44,787] Trial 101 finished with value: 0.6388591800356507 and parameters: {'C': 2.7031245549032756, 'gamma': 'scale', 'kernel': 'rbf'}. Best is trial 91 with value: 0.6447415329768271.
[I 2026-06-14 18:17:44,792] Trial 111 finished with value: 0.7590017825311943 and parameters: {'C': 0.6674980069282519, 'gamma': 'scale', 'kernel': 'sigmoid'}. Best is trial 14 with value: 0.7650623885918003.
[I 2026-06-14 18:17:44,793] Trial 101 finished with value: 0.6566844919786097 and parameters: {'C': 10.609947527123339, 'gamma': 'auto', 'kernel': 'sigmoid'}. Best is trial 85 with value: 0.6688057040998218.
[I 2026-06-14 18:17:44,810] Trial 130 finished with value: 0.6381461675579322 and parameters: {'C': 0.6732308859467152, 'gamma': 'scale', 'kernel': 'rbf'}. Best is trial 73 with value: 0.65650623885918.
[I 2026-06-14 18:17:44,819] Trial 93 finished with value: 0.6028520499108734 and parameters: {'C': 9.116690002652437, 'gamma': 'auto', 'kernel': 'rbf'}. Best is trial 38 with value: 0.6089126559714795.
[I 2026-06-14 18:17:44,834] Trial 102 finished with value: 0.6204991087344028 and parameters: {'C': 1.8819935648017754, 'gamma': 'scale', 'kernel': 'rbf'}. Best is trial 91 with value: 0.6447415329768271.
[I 2026-06-14 18:17:44,835] Trial 112 finished with value: 0.7468805704099821 and parameters: {'C': 0.5396911415273666, 'gamma': 'scale', 'kernel': 'sigmoid'}. Best is trial 14 with value: 0.7650623885918003.
[I 2026-06-14 18:17:44,838] Trial 102 finished with value: 0.6265597147950088 and parameters: {'C': 5.085235356129945, 'gamma': 'auto', 'kernel': 'sigmoid'}. Best is trial 85 with value: 0.6688057040998218.
[I 2026-06-14 18:17:44,844] Trial 131 finished with value: 0.6506238859180036 and parameters: {'C': 0.8616752726499045, 'gamma': 'scale', 'kernel': 'rbf'}. Best is trial 73 with value: 0.65650623885918.
[I 2026-06-14 18:17:44,873] Trial 94 finished with value: 0.5969696969696969 and parameters: {'C': 25.908332305492653, 'gamma': 'auto', 'kernel': 'rbf'}. Best is trial 38 with value: 0.6089126559714795.
[I 2026-06-14 18:17:44,876] Trial 113 finished with value: 0.7529411764705882 and parameters: {'C': 0.7332058121309376, 'gamma': 'scale', 'kernel': 'sigmoid'}. Best is trial 14 with value: 0.7650623885918003.
[I 2026-06-14 18:17:44,876] Trial 103 finished with value: 0.6206773618538325 and parameters: {'C': 3.0785774429157517, 'gamma': 'scale', 'kernel': 'rbf'}. Best is trial 91 with value: 0.6447415329768271.
[I 2026-06-14 18:17:44,877] Trial 132 finished with value: 0.6443850267379678 and parameters: {'C': 1.2098537083763248, 'gamma': 'scale', 'kernel': 'rbf'}. Best is trial 73 with value: 0.65650623885918.
[I 2026-06-14 18:17:44,878] Trial 103 finished with value: 0.6327985739750445 and parameters: {'C': 6.668254711667003, 'gamma': 'auto', 'kernel': 'sigmoid'}. Best is trial 85 with value: 0.6688057040998218.
[I 2026-06-14 18:17:44,910] Trial 133 finished with value: 0.6083778966131907 and parameters: {'C': 0.47870091682125326, 'gamma': 'scale', 'kernel': 'rbf'}. Best is trial 73 with value: 0.65650623885918.
[I 2026-06-14 18:17:44,915] Trial 114 finished with value: 0.7468805704099821 and parameters: {'C': 0.8876740518447617, 'gamma': 'scale', 'kernel': 'sigmoid'}. Best is trial 14 with value: 0.7650623885918003.
[I 2026-06-14 18:17:44,917] Trial 104 finished with value: 0.6204991087344027 and parameters: {'C': 1.6215738905841874, 'gamma': 'scale', 'kernel': 'rbf'}. Best is trial 91 with value: 0.6447415329768271.
[I 2026-06-14 18:17:44,920] Trial 104 finished with value: 0.6203208556149733 and parameters: {'C': 15.470737206560475, 'gamma': 'auto', 'kernel': 'sigmoid'}. Best is trial 85 with value: 0.6688057040998218.
[I 2026-06-14 18:17:44,925] Trial 95 finished with value: 0.5969696969696969 and parameters: {'C': 16.75204766035721, 'gamma': 'auto', 'kernel': 'rbf'}. Best is trial 38 with value: 0.6089126559714795.
[I 2026-06-14 18:17:44,946] Trial 134 finished with value: 0.6445632798573975 and parameters: {'C': 1.0673833482324306, 'gamma': 'scale', 'kernel': 'rbf'}. Best is trial 73 with value: 0.65650623885918.
[I 2026-06-14 18:17:44,952] Trial 115 finished with value: 0.7290552584670232 and parameters: {'C': 1.3961446577304935, 'gamma': 'scale', 'kernel': 'sigmoid'}. Best is trial 14 with value: 0.7650623885918003.
[I 2026-06-14 18:17:44,959] Trial 105 finished with value: 0.6203208556149733 and parameters: {'C': 18.547540288587495, 'gamma': 'auto', 'kernel': 'sigmoid'}. Best is trial 85 with value: 0.6688057040998218.
[I 2026-06-14 18:17:44,961] Trial 105 finished with value: 0.6087344028520498 and parameters: {'C': 8.453485365718809, 'gamma': 'scale', 'kernel': 'rbf'}. Best is trial 91 with value: 0.6447415329768271.
    [OK] Feature SpeechGraph_Full finalized!
[I 2026-06-14 18:17:44,978] Trial 96 finished with value: 0.5969696969696969 and parameters: {'C': 13.09574385718126, 'gamma': 'scale', 'kernel': 'rbf'}. Best is trial 38 with value: 0.6089126559714795.
[I 2026-06-14 18:17:44,992] Trial 116 finished with value: 0.7590017825311943 and parameters: {'C': 0.6526165164432137, 'gamma': 'scale', 'kernel': 'sigmoid'}. Best is trial 14 with value: 0.7650623885918003.
[I 2026-06-14 18:17:44,997] Trial 21 finished with value: 0.5837789661319073 and parameters: {'C': 90.0504173099434, 'gamma': 'scale', 'kernel': 'rbf'}. Best is trial 5 with value: 0.6081996434937611.
[I 2026-06-14 18:17:45,000] Trial 106 finished with value: 0.6570409982174688 and parameters: {'C': 9.123522423081212, 'gamma': 'auto', 'kernel': 'sigmoid'}. Best is trial 85 with value: 0.6688057040998218.
[I 2026-06-14 18:17:45,004] Trial 106 finished with value: 0.5606060606060606 and parameters: {'C': 2.1501697791560725, 'gamma': 'scale', 'kernel': 'sigmoid'}. Best is trial 91 with value: 0.6447415329768271.
[I 2026-06-14 18:17:45,027] Trial 97 finished with value: 0.5964349376114082 and parameters: {'C': 4.667081061797149, 'gamma': 'auto', 'kernel': 'rbf'}. Best is trial 38 with value: 0.6089126559714795.
[I 2026-06-14 18:17:45,029] Trial 117 finished with value: 0.6686274509803921 and parameters: {'C': 1.1568349286815949, 'gamma': 'scale', 'kernel': 'rbf'}. Best is trial 14 with value: 0.7650623885918003.
[I 2026-06-14 18:17:45,042] Trial 107 finished with value: 0.6388591800356506 and parameters: {'C': 4.439727474070631, 'gamma': 'auto', 'kernel': 'sigmoid'}. Best is trial 85 with value: 0.6688057040998218.
[I 2026-06-14 18:17:45,048] Trial 107 finished with value: 0.6329768270944742 and parameters: {'C': 3.925884615897461, 'gamma': 'scale', 'kernel': 'rbf'}. Best is trial 91 with value: 0.6447415329768271.
[I 2026-06-14 18:17:45,066] Trial 118 finished with value: 0.7288770053475936 and parameters: {'C': 0.49084909015498246, 'gamma': 'scale', 'kernel': 'sigmoid'}. Best is trial 14 with value: 0.7650623885918003.
[I 2026-06-14 18:17:45,073] Trial 98 finished with value: 0.5058823529411764 and parameters: {'C': 0.13968160316930073, 'gamma': 'auto', 'kernel': 'rbf'}. Best is trial 38 with value: 0.6089126559714795.
[I 2026-06-14 18:17:45,080] Trial 108 finished with value: 0.626916221033868 and parameters: {'C': 12.497914875219704, 'gamma': 'auto', 'kernel': 'sigmoid'}. Best is trial 85 with value: 0.6688057040998218.
[I 2026-06-14 18:17:45,088] Trial 108 finished with value: 0.6028520499108734 and parameters: {'C': 1.2180509026832482, 'gamma': 'scale', 'kernel': 'rbf'}. Best is trial 91 with value: 0.6447415329768271.
[I 2026-06-14 18:17:45,104] Trial 119 finished with value: 0.7285204991087344 and parameters: {'C': 0.24247985968204497, 'gamma': 'scale', 'kernel': 'sigmoid'}. Best is trial 14 with value: 0.7650623885918003.
[I 2026-06-14 18:17:45,116] Trial 99 finished with value: 0.5725490196078431 and parameters: {'C': 3.7121496688381517, 'gamma': 'auto', 'kernel': 'sigmoid'}. Best is trial 38 with value: 0.6089126559714795.
[I 2026-06-14 18:17:45,120] Trial 109 finished with value: 0.65650623885918 and parameters: {'C': 3.090952938950406, 'gamma': 'auto', 'kernel': 'sigmoid'}. Best is trial 85 with value: 0.6688057040998218.
[I 2026-06-14 18:17:45,133] Trial 109 finished with value: 0.6087344028520499 and parameters: {'C': 6.096060377913179, 'gamma': 'scale', 'kernel': 'rbf'}. Best is trial 91 with value: 0.6447415329768271.
[I 2026-06-14 18:17:45,143] Trial 120 finished with value: 0.7404634581105171 and parameters: {'C': 0.36638062980191066, 'gamma': 'scale', 'kernel': 'sigmoid'}. Best is trial 14 with value: 0.7650623885918003.
[I 2026-06-14 18:17:45,155] Trial 7 finished with value: 0.6570409982174688 and parameters: {'C': 8.216441221798934, 'gamma': 'scale', 'kernel': 'sigmoid'}. Best is trial 6 with value: 0.6750445632798574.
[I 2026-06-14 18:17:45,160] Trial 110 finished with value: 0.6327985739750445 and parameters: {'C': 6.695139875748358, 'gamma': 'auto', 'kernel': 'sigmoid'}. Best is trial 85 with value: 0.6688057040998218.
[I 2026-06-14 18:17:45,164] Trial 100 finished with value: 0.5969696969696969 and parameters: {'C': 33.783482159697705, 'gamma': 'auto', 'kernel': 'rbf'}. Best is trial 38 with value: 0.6089126559714795.
[I 2026-06-14 18:17:45,172] Trial 110 finished with value: 0.47593582887700536 and parameters: {'C': 0.0020117013710279257, 'gamma': 'scale', 'kernel': 'rbf'}. Best is trial 91 with value: 0.6447415329768271.
[I 2026-06-14 18:17:45,183] Trial 121 finished with value: 0.7590017825311943 and parameters: {'C': 0.6469443939296765, 'gamma': 'scale', 'kernel': 'sigmoid'}. Best is trial 14 with value: 0.7650623885918003.
[I 2026-06-14 18:17:45,201] Trial 111 finished with value: 0.6265597147950088 and parameters: {'C': 3.465319528274441, 'gamma': 'auto', 'kernel': 'sigmoid'}. Best is trial 85 with value: 0.6688057040998218.
[I 2026-06-14 18:17:45,214] Trial 101 finished with value: 0.6028520499108734 and parameters: {'C': 6.613840053194963, 'gamma': 'auto', 'kernel': 'rbf'}. Best is trial 38 with value: 0.6089126559714795.
[I 2026-06-14 18:17:45,216] Trial 111 finished with value: 0.6388591800356507 and parameters: {'C': 2.70674468483984, 'gamma': 'scale', 'kernel': 'rbf'}. Best is trial 91 with value: 0.6447415329768271.
[I 2026-06-14 18:17:45,222] Trial 122 finished with value: 0.7468805704099821 and parameters: {'C': 0.8757068181852559, 'gamma': 'scale', 'kernel': 'sigmoid'}. Best is trial 14 with value: 0.7650623885918003.
[I 2026-06-14 18:17:45,244] Trial 22 finished with value: 0.5837789661319073 and parameters: {'C': 43.531400205728616, 'gamma': 'scale', 'kernel': 'rbf'}. Best is trial 5 with value: 0.6081996434937611.
[I 2026-06-14 18:17:45,244] Trial 112 finished with value: 0.6023172905525846 and parameters: {'C': 1.7927863795962646, 'gamma': 'auto', 'kernel': 'sigmoid'}. Best is trial 85 with value: 0.6688057040998218.
[I 2026-06-14 18:17:45,259] Trial 112 finished with value: 0.6327985739750446 and parameters: {'C': 2.8129890804975513, 'gamma': 'scale', 'kernel': 'rbf'}. Best is trial 91 with value: 0.6447415329768271.
[I 2026-06-14 18:17:45,264] Trial 102 finished with value: 0.6028520499108734 and parameters: {'C': 8.721084732418804, 'gamma': 'auto', 'kernel': 'rbf'}. Best is trial 38 with value: 0.6089126559714795.
[I 2026-06-14 18:17:45,266] Trial 123 finished with value: 0.7529411764705882 and parameters: {'C': 0.63853619317067, 'gamma': 'scale', 'kernel': 'sigmoid'}. Best is trial 14 with value: 0.7650623885918003.
[I 2026-06-14 18:17:45,287] Trial 113 finished with value: 0.6385026737967915 and parameters: {'C': 2.831591459976637, 'gamma': 'auto', 'kernel': 'sigmoid'}. Best is trial 85 with value: 0.6688057040998218.
[I 2026-06-14 18:17:45,307] Trial 124 finished with value: 0.7406417112299465 and parameters: {'C': 0.43190016971195894, 'gamma': 'scale', 'kernel': 'sigmoid'}. Best is trial 14 with value: 0.7650623885918003.
[I 2026-06-14 18:17:45,308] Trial 113 finished with value: 0.6327985739750446 and parameters: {'C': 3.5585068754069327, 'gamma': 'scale', 'kernel': 'rbf'}. Best is trial 91 with value: 0.6447415329768271.
[I 2026-06-14 18:17:45,313] Trial 103 finished with value: 0.6026737967914438 and parameters: {'C': 5.813588294100645, 'gamma': 'auto', 'kernel': 'rbf'}. Best is trial 38 with value: 0.6089126559714795.
[I 2026-06-14 18:17:45,325] Trial 114 finished with value: 0.6267379679144385 and parameters: {'C': 9.909944717472937, 'gamma': 'auto', 'kernel': 'sigmoid'}. Best is trial 85 with value: 0.6688057040998218.
[I 2026-06-14 18:17:45,346] Trial 125 finished with value: 0.7468805704099821 and parameters: {'C': 0.5711904758004966, 'gamma': 'scale', 'kernel': 'sigmoid'}. Best is trial 14 with value: 0.7650623885918003.
[I 2026-06-14 18:17:45,354] Trial 114 finished with value: 0.6089126559714795 and parameters: {'C': 0.8231127476027308, 'gamma': 'scale', 'kernel': 'rbf'}. Best is trial 91 with value: 0.6447415329768271.
[I 2026-06-14 18:17:45,365] Trial 104 finished with value: 0.5969696969696969 and parameters: {'C': 19.738945496154056, 'gamma': 'auto', 'kernel': 'rbf'}. Best is trial 38 with value: 0.6089126559714795.
[I 2026-06-14 18:17:45,366] Trial 115 finished with value: 0.6688057040998218 and parameters: {'C': 5.766883629565395, 'gamma': 'auto', 'kernel': 'sigmoid'}. Best is trial 85 with value: 0.6688057040998218.
[I 2026-06-14 18:17:45,384] Trial 126 finished with value: 0.7468805704099821 and parameters: {'C': 0.9223342210387511, 'gamma': 'scale', 'kernel': 'sigmoid'}. Best is trial 14 with value: 0.7650623885918003.
[I 2026-06-14 18:17:45,398] Trial 115 finished with value: 0.6204991087344028 and parameters: {'C': 2.081741978425681, 'gamma': 'scale', 'kernel': 'rbf'}. Best is trial 91 with value: 0.6447415329768271.
[I 2026-06-14 18:17:45,408] Trial 116 finished with value: 0.6204991087344027 and parameters: {'C': 6.166027913555397, 'gamma': 'auto', 'kernel': 'sigmoid'}. Best is trial 85 with value: 0.6688057040998218.
[I 2026-06-14 18:17:45,419] Trial 105 finished with value: 0.5969696969696969 and parameters: {'C': 12.26212185495735, 'gamma': 'auto', 'kernel': 'rbf'}. Best is trial 38 with value: 0.6089126559714795.
[I 2026-06-14 18:17:45,420] Trial 127 finished with value: 0.7285204991087344 and parameters: {'C': 1.6503623691512772, 'gamma': 'scale', 'kernel': 'sigmoid'}. Best is trial 14 with value: 0.7650623885918003.
[I 2026-06-14 18:17:45,443] Trial 116 finished with value: 0.6089126559714795 and parameters: {'C': 0.6685393382177588, 'gamma': 'scale', 'kernel': 'rbf'}. Best is trial 91 with value: 0.6447415329768271.
[I 2026-06-14 18:17:45,447] Trial 117 finished with value: 0.6322638146167558 and parameters: {'C': 16.879946950538297, 'gamma': 'auto', 'kernel': 'sigmoid'}. Best is trial 85 with value: 0.6688057040998218.
