[I 2026-06-14 18:17:42,823] Trial 71 finished with value: 0.6204991087344028 and parameters: {'C': 0.5744700838192278, 'gamma': 'scale', 'kernel': 'rbf'}. Best is trial 38 with value: 0.6506238859180036.
[I 2026-06-14 18:17:42,825] Trial 3 finished with value: 0.49411764705882355 and parameters: {'C': 0.004147275739263746, 'gamma': 'auto', 'kernel': 'rbf'}. Best is trial 1 with value: 0.6445632798573975.
[I 2026-06-14 18:17:42,830] Trial 62 finished with value: 0.73475935828877 and parameters: {'C': 0.5022493149738037, 'gamma': 'scale', 'kernel': 'sigmoid'}. Best is trial 14 with value: 0.7650623885918003.
[I 2026-06-14 18:17:42,854] Trial 55 finished with value: 0.6450980392156863 and parameters: {'C': 43.23917817708047, 'gamma': 'scale', 'kernel': 'rbf'}. Best is trial 6 with value: 0.6629233511586453.
[I 2026-06-14 18:17:42,855] Trial 72 finished with value: 0.6443850267379678 and parameters: {'C': 1.3999236479882742, 'gamma': 'scale', 'kernel': 'rbf'}. Best is trial 38 with value: 0.6506238859180036.
[I 2026-06-14 18:17:42,860] Trial 53 finished with value: 0.5969696969696969 and parameters: {'C': 22.250744952080577, 'gamma': 'auto', 'kernel': 'rbf'}. Best is trial 38 with value: 0.6089126559714795.
[I 2026-06-14 18:17:42,871] Trial 59 finished with value: 0.6146167557932263 and parameters: {'C': 8.253186812388888, 'gamma': 'scale', 'kernel': 'rbf'}. Best is trial 57 with value: 0.6388591800356507.
[I 2026-06-14 18:17:42,871] Trial 63 finished with value: 0.7046345811051694 and parameters: {'C': 0.19852717055323107, 'gamma': 'scale', 'kernel': 'sigmoid'}. Best is trial 14 with value: 0.7650623885918003.
[I 2026-06-14 18:17:42,886] Trial 73 finished with value: 0.65650623885918 and parameters: {'C': 2.4504489036748476, 'gamma': 'scale', 'kernel': 'rbf'}. Best is trial 73 with value: 0.65650623885918.
[I 2026-06-14 18:17:42,898] Trial 56 finished with value: 0.6450980392156863 and parameters: {'C': 22.13795931771092, 'gamma': 'scale', 'kernel': 'rbf'}. Best is trial 6 with value: 0.6629233511586453.
[I 2026-06-14 18:17:42,905] Trial 64 finished with value: 0.7467023172905526 and parameters: {'C': 4.164532972454744, 'gamma': 'scale', 'kernel': 'sigmoid'}. Best is trial 14 with value: 0.7650623885918003.
[I 2026-06-14 18:17:42,910] Trial 54 finished with value: 0.5967914438502674 and parameters: {'C': 2.3475896672940273, 'gamma': 'auto', 'kernel': 'rbf'}. Best is trial 38 with value: 0.6089126559714795.
[I 2026-06-14 18:17:42,913] Trial 60 finished with value: 0.6327985739750446 and parameters: {'C': 3.6571724808867123, 'gamma': 'scale', 'kernel': 'rbf'}. Best is trial 57 with value: 0.6388591800356507.
[I 2026-06-14 18:17:42,915] Trial 74 finished with value: 0.5418894830659536 and parameters: {'C': 2.0798091627173827, 'gamma': 'scale', 'kernel': 'poly'}. Best is trial 73 with value: 0.65650623885918.
[I 2026-06-14 18:17:42,934] Trial 57 finished with value: 0.6021390374331551 and parameters: {'C': 12.151578430100727, 'gamma': 'auto', 'kernel': 'sigmoid'}. Best is trial 6 with value: 0.6629233511586453.
[I 2026-06-14 18:17:42,945] Trial 65 finished with value: 0.7529411764705882 and parameters: {'C': 0.6429263428931279, 'gamma': 'scale', 'kernel': 'sigmoid'}. Best is trial 14 with value: 0.7650623885918003.
[I 2026-06-14 18:17:42,949] Trial 75 finished with value: 0.5907308377896613 and parameters: {'C': 6.03509312427869, 'gamma': 'scale', 'kernel': 'rbf'}. Best is trial 73 with value: 0.65650623885918.
[I 2026-06-14 18:17:42,959] Trial 61 finished with value: 0.6146167557932263 and parameters: {'C': 15.485877195343425, 'gamma': 'scale', 'kernel': 'rbf'}. Best is trial 57 with value: 0.6388591800356507.
[I 2026-06-14 18:17:42,962] Trial 55 finished with value: 0.6028520499108734 and parameters: {'C': 10.23461358718818, 'gamma': 'auto', 'kernel': 'rbf'}. Best is trial 38 with value: 0.6089126559714795.
[I 2026-06-14 18:17:42,973] Trial 58 finished with value: 0.48770053475935826 and parameters: {'C': 0.09688300811919813, 'gamma': 'scale', 'kernel': 'rbf'}. Best is trial 6 with value: 0.6629233511586453.
[I 2026-06-14 18:17:42,982] Trial 76 finished with value: 0.6385026737967914 and parameters: {'C': 2.559561933577108, 'gamma': 'scale', 'kernel': 'rbf'}. Best is trial 73 with value: 0.65650623885918.
[I 2026-06-14 18:17:42,987] Trial 66 finished with value: 0.7529411764705882 and parameters: {'C': 0.6412160045932727, 'gamma': 'scale', 'kernel': 'sigmoid'}. Best is trial 14 with value: 0.7650623885918003.
[I 2026-06-14 18:17:43,003] Trial 56 finished with value: 0.5898395721925135 and parameters: {'C': 5.6243371440765, 'gamma': 'auto', 'kernel': 'poly'}. Best is trial 38 with value: 0.6089126559714795.
[I 2026-06-14 18:17:43,011] Trial 62 finished with value: 0.6206773618538325 and parameters: {'C': 3.1278391287874947, 'gamma': 'scale', 'kernel': 'rbf'}. Best is trial 57 with value: 0.6388591800356507.
[I 2026-06-14 18:17:43,011] Trial 59 finished with value: 0.614795008912656 and parameters: {'C': 0.6242091581275048, 'gamma': 'scale', 'kernel': 'rbf'}. Best is trial 6 with value: 0.6629233511586453.
[I 2026-06-14 18:17:43,021] Trial 77 finished with value: 0.5843137254901961 and parameters: {'C': 29.542965374063222, 'gamma': 'auto', 'kernel': 'rbf'}. Best is trial 73 with value: 0.65650623885918.
[I 2026-06-14 18:17:43,025] Trial 67 finished with value: 0.7590017825311943 and parameters: {'C': 0.6876786951226885, 'gamma': 'scale', 'kernel': 'sigmoid'}. Best is trial 14 with value: 0.7650623885918003.
[I 2026-06-14 18:17:43,032] Trial 12 finished with value: 0.5062388591800356 and parameters: {'C': 0.11215547817219475, 'gamma': 'scale', 'kernel': 'rbf'}. Best is trial 5 with value: 0.6081996434937611.
[I 2026-06-14 18:17:43,049] Trial 60 finished with value: 0.6386809269162209 and parameters: {'C': 4.492971068754172, 'gamma': 'auto', 'kernel': 'sigmoid'}. Best is trial 6 with value: 0.6629233511586453.
[I 2026-06-14 18:17:43,050] Trial 78 finished with value: 0.6506238859180036 and parameters: {'C': 0.9953276786336399, 'gamma': 'scale', 'kernel': 'rbf'}. Best is trial 73 with value: 0.65650623885918.
[I 2026-06-14 18:17:43,051] Trial 57 finished with value: 0.6028520499108734 and parameters: {'C': 10.407778206038238, 'gamma': 'auto', 'kernel': 'rbf'}. Best is trial 38 with value: 0.6089126559714795.
[I 2026-06-14 18:17:43,055] Trial 63 finished with value: 0.6206773618538325 and parameters: {'C': 5.245492611010052, 'gamma': 'scale', 'kernel': 'rbf'}. Best is trial 57 with value: 0.6388591800356507.
[I 2026-06-14 18:17:43,065] Trial 68 finished with value: 0.7404634581105171 and parameters: {'C': 0.34391903074711255, 'gamma': 'scale', 'kernel': 'sigmoid'}. Best is trial 14 with value: 0.7650623885918003.
[I 2026-06-14 18:17:43,085] Trial 79 finished with value: 0.6024955436720143 and parameters: {'C': 10.81288974515856, 'gamma': 'scale', 'kernel': 'rbf'}. Best is trial 73 with value: 0.65650623885918.
[I 2026-06-14 18:17:43,093] Trial 61 finished with value: 0.6450980392156863 and parameters: {'C': 62.58445184141192, 'gamma': 'scale', 'kernel': 'rbf'}. Best is trial 6 with value: 0.6629233511586453.
[I 2026-06-14 18:17:43,097] Trial 58 finished with value: 0.5725490196078431 and parameters: {'C': 1.8122351406001551, 'gamma': 'auto', 'kernel': 'sigmoid'}. Best is trial 38 with value: 0.6089126559714795.
[I 2026-06-14 18:17:43,101] Trial 69 finished with value: 0.5415329768270944 and parameters: {'C': 0.09648904212342939, 'gamma': 'scale', 'kernel': 'poly'}. Best is trial 14 with value: 0.7650623885918003.
[I 2026-06-14 18:17:43,108] Trial 64 finished with value: 0.6146167557932263 and parameters: {'C': 25.99198787854314, 'gamma': 'scale', 'kernel': 'rbf'}. Best is trial 57 with value: 0.6388591800356507.
[I 2026-06-14 18:17:43,118] Trial 80 finished with value: 0.6203208556149733 and parameters: {'C': 0.3419679662390296, 'gamma': 'scale', 'kernel': 'rbf'}. Best is trial 73 with value: 0.65650623885918.
[I 2026-06-14 18:17:43,138] Trial 62 finished with value: 0.6450980392156863 and parameters: {'C': 69.64848421642822, 'gamma': 'scale', 'kernel': 'rbf'}. Best is trial 6 with value: 0.6629233511586453.
[I 2026-06-14 18:17:43,144] Trial 59 finished with value: 0.47593582887700536 and parameters: {'C': 0.0021197797628594592, 'gamma': 'auto', 'kernel': 'rbf'}. Best is trial 38 with value: 0.6089126559714795.
[I 2026-06-14 18:17:43,144] Trial 70 finished with value: 0.7163992869875223 and parameters: {'C': 0.17603064003280425, 'gamma': 'scale', 'kernel': 'sigmoid'}. Best is trial 14 with value: 0.7650623885918003.
[I 2026-06-14 18:17:43,151] Trial 81 finished with value: 0.6385026737967914 and parameters: {'C': 0.8154215866306704, 'gamma': 'scale', 'kernel': 'rbf'}. Best is trial 73 with value: 0.65650623885918.
[I 2026-06-14 18:17:43,153] Trial 65 finished with value: 0.6204991087344028 and parameters: {'C': 2.2654599041379684, 'gamma': 'scale', 'kernel': 'rbf'}. Best is trial 57 with value: 0.6388591800356507.
[I 2026-06-14 18:17:43,173] Trial 13 finished with value: 0.5 and parameters: {'C': 10.930524438017667, 'gamma': 'scale', 'kernel': 'sigmoid'}. Best is trial 5 with value: 0.6081996434937611.
[I 2026-06-14 18:17:43,182] Trial 63 finished with value: 0.6450980392156863 and parameters: {'C': 39.627430939134435, 'gamma': 'scale', 'kernel': 'rbf'}. Best is trial 6 with value: 0.6629233511586453.
[I 2026-06-14 18:17:43,183] Trial 71 finished with value: 0.7590017825311943 and parameters: {'C': 0.6962683851695545, 'gamma': 'scale', 'kernel': 'sigmoid'}. Best is trial 14 with value: 0.7650623885918003.
[I 2026-06-14 18:17:43,185] Trial 82 finished with value: 0.6506238859180036 and parameters: {'C': 1.0202432606815433, 'gamma': 'scale', 'kernel': 'rbf'}. Best is trial 73 with value: 0.65650623885918.
[I 2026-06-14 18:17:43,199] Trial 66 finished with value: 0.6388591800356507 and parameters: {'C': 2.7116487688426316, 'gamma': 'scale', 'kernel': 'rbf'}. Best is trial 57 with value: 0.6388591800356507.
[I 2026-06-14 18:17:43,200] Trial 60 finished with value: 0.5969696969696969 and parameters: {'C': 41.83618791948143, 'gamma': 'auto', 'kernel': 'rbf'}. Best is trial 38 with value: 0.6089126559714795.
[I 2026-06-14 18:17:43,217] Trial 83 finished with value: 0.6322638146167557 and parameters: {'C': 0.6249779142018537, 'gamma': 'scale', 'kernel': 'rbf'}. Best is trial 73 with value: 0.65650623885918.
[I 2026-06-14 18:17:43,222] Trial 72 finished with value: 0.7590017825311943 and parameters: {'C': 0.6674635830291831, 'gamma': 'scale', 'kernel': 'sigmoid'}. Best is trial 14 with value: 0.7650623885918003.
[I 2026-06-14 18:17:43,226] Trial 64 finished with value: 0.6450980392156863 and parameters: {'C': 22.46955715950671, 'gamma': 'scale', 'kernel': 'rbf'}. Best is trial 6 with value: 0.6629233511586453.
[I 2026-06-14 18:17:43,245] Trial 67 finished with value: 0.6146167557932263 and parameters: {'C': 14.203780103539902, 'gamma': 'scale', 'kernel': 'rbf'}. Best is trial 57 with value: 0.6388591800356507.
[I 2026-06-14 18:17:43,248] Trial 61 finished with value: 0.6028520499108734 and parameters: {'C': 6.575769264204118, 'gamma': 'auto', 'kernel': 'rbf'}. Best is trial 38 with value: 0.6089126559714795.
[I 2026-06-14 18:17:43,257] Trial 84 finished with value: 0.6385026737967914 and parameters: {'C': 1.6355144357986606, 'gamma': 'scale', 'kernel': 'rbf'}. Best is trial 73 with value: 0.65650623885918.
[I 2026-06-14 18:17:43,263] Trial 73 finished with value: 0.7465240641711232 and parameters: {'C': 0.4122201158062179, 'gamma': 'scale', 'kernel': 'sigmoid'}. Best is trial 14 with value: 0.7650623885918003.
[I 2026-06-14 18:17:43,269] Trial 65 finished with value: 0.6450980392156863 and parameters: {'C': 99.96674929729583, 'gamma': 'scale', 'kernel': 'rbf'}. Best is trial 6 with value: 0.6629233511586453.
[I 2026-06-14 18:17:43,284] Trial 85 finished with value: 0.5301247771836006 and parameters: {'C': 0.15324659490394024, 'gamma': 'scale', 'kernel': 'poly'}. Best is trial 73 with value: 0.65650623885918.
[I 2026-06-14 18:17:43,287] Trial 68 finished with value: 0.6089126559714795 and parameters: {'C': 0.7679461184443062, 'gamma': 'scale', 'kernel': 'rbf'}. Best is trial 57 with value: 0.6388591800356507.
[I 2026-06-14 18:17:43,296] Trial 62 finished with value: 0.57825311942959 and parameters: {'C': 3.131921015159885, 'gamma': 'auto', 'kernel': 'rbf'}. Best is trial 38 with value: 0.6089126559714795.
[I 2026-06-14 18:17:43,301] Trial 74 finished with value: 0.7590017825311943 and parameters: {'C': 0.7603749896511917, 'gamma': 'scale', 'kernel': 'sigmoid'}. Best is trial 14 with value: 0.7650623885918003.
[I 2026-06-14 18:17:43,314] Trial 66 finished with value: 0.620855614973262 and parameters: {'C': 8.847433788520854, 'gamma': 'scale', 'kernel': 'rbf'}. Best is trial 6 with value: 0.6629233511586453.
[I 2026-06-14 18:17:43,319] Trial 86 finished with value: 0.6204991087344027 and parameters: {'C': 3.5376687930490767, 'gamma': 'scale', 'kernel': 'rbf'}. Best is trial 73 with value: 0.65650623885918.
[I 2026-06-14 18:17:43,336] Trial 69 finished with value: 0.6026737967914438 and parameters: {'C': 6.740953546832723, 'gamma': 'scale', 'kernel': 'rbf'}. Best is trial 57 with value: 0.6388591800356507.
[I 2026-06-14 18:17:43,337] Trial 75 finished with value: 0.7285204991087344 and parameters: {'C': 1.6261262323447845, 'gamma': 'scale', 'kernel': 'sigmoid'}. Best is trial 14 with value: 0.7650623885918003.
[I 2026-06-14 18:17:43,345] Trial 63 finished with value: 0.6028520499108734 and parameters: {'C': 6.33019262378605, 'gamma': 'auto', 'kernel': 'rbf'}. Best is trial 38 with value: 0.6089126559714795.
[I 2026-06-14 18:17:43,353] Trial 67 finished with value: 0.6210338680926916 and parameters: {'C': 31.91395351606146, 'gamma': 'scale', 'kernel': 'poly'}. Best is trial 6 with value: 0.6629233511586453.
[I 2026-06-14 18:17:43,353] Trial 87 finished with value: 0.5907308377896613 and parameters: {'C': 5.214167612931166, 'gamma': 'scale', 'kernel': 'rbf'}. Best is trial 73 with value: 0.65650623885918.
[I 2026-06-14 18:17:43,375] Trial 76 finished with value: 0.7529411764705882 and parameters: {'C': 0.7954148257831425, 'gamma': 'scale', 'kernel': 'sigmoid'}. Best is trial 14 with value: 0.7650623885918003.
[I 2026-06-14 18:17:43,384] Trial 70 finished with value: 0.6329768270944741 and parameters: {'C': 1.0860579933330181, 'gamma': 'scale', 'kernel': 'rbf'}. Best is trial 57 with value: 0.6388591800356507.
[I 2026-06-14 18:17:43,386] Trial 88 finished with value: 0.6445632798573975 and parameters: {'C': 2.3323308525459483, 'gamma': 'auto', 'kernel': 'rbf'}. Best is trial 73 with value: 0.65650623885918.
[I 2026-06-14 18:17:43,395] Trial 64 finished with value: 0.5969696969696969 and parameters: {'C': 21.489194958627138, 'gamma': 'auto', 'kernel': 'rbf'}. Best is trial 38 with value: 0.6089126559714795.
[I 2026-06-14 18:17:43,397] Trial 68 finished with value: 0.6450980392156863 and parameters: {'C': 69.87318688305581, 'gamma': 'auto', 'kernel': 'rbf'}. Best is trial 6 with value: 0.6629233511586453.
[I 2026-06-14 18:17:43,412] Trial 77 finished with value: 0.7468805704099821 and parameters: {'C': 0.9491084051848174, 'gamma': 'scale', 'kernel': 'sigmoid'}. Best is trial 14 with value: 0.7650623885918003.
[I 2026-06-14 18:17:43,416] Trial 89 finished with value: 0.6019607843137255 and parameters: {'C': 0.2571852026823545, 'gamma': 'scale', 'kernel': 'rbf'}. Best is trial 73 with value: 0.65650623885918.
[I 2026-06-14 18:17:43,423] Trial 14 finished with value: 0.5780748663101604 and parameters: {'C': 0.775066909940181, 'gamma': 'auto', 'kernel': 'rbf'}. Best is trial 5 with value: 0.6081996434937611.
[I 2026-06-14 18:17:43,423] Trial 71 finished with value: 0.6087344028520498 and parameters: {'C': 1.2593150638384678, 'gamma': 'scale', 'kernel': 'rbf'}. Best is trial 57 with value: 0.6388591800356507.
[I 2026-06-14 18:17:43,437] Trial 69 finished with value: 0.6322638146167558 and parameters: {'C': 16.097910223614935, 'gamma': 'scale', 'kernel': 'sigmoid'}. Best is trial 6 with value: 0.6629233511586453.
[I 2026-06-14 18:17:43,446] Trial 90 finished with value: 0.6083778966131907 and parameters: {'C': 0.46969082458379163, 'gamma': 'scale', 'kernel': 'rbf'}. Best is trial 73 with value: 0.65650623885918.
[I 2026-06-14 18:17:43,448] Trial 65 finished with value: 0.6028520499108734 and parameters: {'C': 10.113019434704851, 'gamma': 'auto', 'kernel': 'rbf'}. Best is trial 38 with value: 0.6089126559714795.
[I 2026-06-14 18:17:43,449] Trial 78 finished with value: 0.6686274509803921 and parameters: {'C': 2.494469862792258, 'gamma': 'scale', 'kernel': 'rbf'}. Best is trial 14 with value: 0.7650623885918003.
[I 2026-06-14 18:17:43,464] Trial 72 finished with value: 0.6265597147950089 and parameters: {'C': 1.8629109692128039, 'gamma': 'scale', 'kernel': 'rbf'}. Best is trial 57 with value: 0.6388591800356507.
[I 2026-06-14 18:17:43,473] Trial 4 finished with value: 0.5058823529411764 and parameters: {'C': 0.0024436696093680437, 'gamma': 'auto', 'kernel': 'rbf'}. Best is trial 1 with value: 0.6445632798573975.
[I 2026-06-14 18:17:43,477] Trial 91 finished with value: 0.6506238859180036 and parameters: {'C': 1.0062243258271966, 'gamma': 'scale', 'kernel': 'rbf'}. Best is trial 73 with value: 0.65650623885918.
[I 2026-06-14 18:17:43,485] Trial 70 finished with value: 0.6450980392156863 and parameters: {'C': 52.099094775429265, 'gamma': 'scale', 'kernel': 'rbf'}. Best is trial 6 with value: 0.6629233511586453.
[I 2026-06-14 18:17:43,489] Trial 79 finished with value: 0.7406417112299465 and parameters: {'C': 0.45931063069341377, 'gamma': 'scale', 'kernel': 'sigmoid'}. Best is trial 14 with value: 0.7650623885918003.
[I 2026-06-14 18:17:43,497] Trial 66 finished with value: 0.596078431372549 and parameters: {'C': 3.9728214379642375, 'gamma': 'auto', 'kernel': 'rbf'}. Best is trial 38 with value: 0.6089126559714795.
[I 2026-06-14 18:17:43,507] Trial 73 finished with value: 0.638680926916221 and parameters: {'C': 2.6151986297191665, 'gamma': 'scale', 'kernel': 'rbf'}. Best is trial 57 with value: 0.6388591800356507.
[I 2026-06-14 18:17:43,509] Trial 92 finished with value: 0.6443850267379678 and parameters: {'C': 1.3778744876323135, 'gamma': 'scale', 'kernel': 'rbf'}. Best is trial 73 with value: 0.65650623885918.
[I 2026-06-14 18:17:43,528] Trial 71 finished with value: 0.6450980392156863 and parameters: {'C': 98.54710694209813, 'gamma': 'scale', 'kernel': 'rbf'}. Best is trial 6 with value: 0.6629233511586453.
[I 2026-06-14 18:17:43,534] Trial 80 finished with value: 0.7285204991087344 and parameters: {'C': 0.23717086535303425, 'gamma': 'scale', 'kernel': 'sigmoid'}. Best is trial 14 with value: 0.7650623885918003.
[I 2026-06-14 18:17:43,542] Trial 93 finished with value: 0.6506238859180036 and parameters: {'C': 0.9647565628010099, 'gamma': 'scale', 'kernel': 'rbf'}. Best is trial 73 with value: 0.65650623885918.
[I 2026-06-14 18:17:43,543] Trial 67 finished with value: 0.5604278074866309 and parameters: {'C': 1.2438646669138613, 'gamma': 'auto', 'kernel': 'rbf'}. Best is trial 38 with value: 0.6089126559714795.
[I 2026-06-14 18:17:43,548] Trial 74 finished with value: 0.6329768270944741 and parameters: {'C': 0.8906876212023745, 'gamma': 'scale', 'kernel': 'rbf'}. Best is trial 57 with value: 0.6388591800356507.
[I 2026-06-14 18:17:43,572] Trial 72 finished with value: 0.6450980392156863 and parameters: {'C': 40.814752345081494, 'gamma': 'scale', 'kernel': 'rbf'}. Best is trial 6 with value: 0.6629233511586453.
[I 2026-06-14 18:17:43,573] Trial 94 finished with value: 0.6322638146167557 and parameters: {'C': 0.6211427143732182, 'gamma': 'scale', 'kernel': 'rbf'}. Best is trial 73 with value: 0.65650623885918.
[I 2026-06-14 18:17:43,578] Trial 81 finished with value: 0.7470588235294118 and parameters: {'C': 0.6119801554556235, 'gamma': 'scale', 'kernel': 'sigmoid'}. Best is trial 14 with value: 0.7650623885918003.
[I 2026-06-14 18:17:43,583] Trial 68 finished with value: 0.5418894830659536 and parameters: {'C': 54.2106995382112, 'gamma': 'scale', 'kernel': 'sigmoid'}. Best is trial 38 with value: 0.6089126559714795.
[I 2026-06-14 18:17:43,596] Trial 75 finished with value: 0.6030303030303029 and parameters: {'C': 0.9258067624234969, 'gamma': 'scale', 'kernel': 'sigmoid'}. Best is trial 57 with value: 0.6388591800356507.
[I 2026-06-14 18:17:43,607] Trial 95 finished with value: 0.6383244206773618 and parameters: {'C': 3.025825678599043, 'gamma': 'scale', 'kernel': 'rbf'}. Best is trial 73 with value: 0.65650623885918.
[I 2026-06-14 18:17:43,618] Trial 73 finished with value: 0.6450980392156863 and parameters: {'C': 71.91949169720526, 'gamma': 'scale', 'kernel': 'rbf'}. Best is trial 6 with value: 0.6629233511586453.
[I 2026-06-14 18:17:43,619] Trial 82 finished with value: 0.7229946524064171 and parameters: {'C': 1.233266934282983, 'gamma': 'scale', 'kernel': 'sigmoid'}. Best is trial 14 with value: 0.7650623885918003.
[I 2026-06-14 18:17:43,625] Trial 15 finished with value: 0.47593582887700536 and parameters: {'C': 0.032790870642213726, 'gamma': 'scale', 'kernel': 'sigmoid'}. Best is trial 5 with value: 0.6081996434937611.
[I 2026-06-14 18:17:43,631] Trial 69 finished with value: 0.5969696969696969 and parameters: {'C': 27.762411938091876, 'gamma': 'auto', 'kernel': 'rbf'}. Best is trial 38 with value: 0.6089126559714795.
[I 2026-06-14 18:17:43,638] Trial 96 finished with value: 0.6443850267379678 and parameters: {'C': 1.3553942323230517, 'gamma': 'scale', 'kernel': 'rbf'}. Best is trial 73 with value: 0.65650623885918.
[I 2026-06-14 18:17:43,640] Trial 76 finished with value: 0.6028520499108734 and parameters: {'C': 0.6295147483622169, 'gamma': 'scale', 'kernel': 'rbf'}. Best is trial 57 with value: 0.6388591800356507.
