[I 2026-06-14 18:18:06,350] Trial 129 finished with value: 0.5960784313725489 and parameters: {'C': 10.846357312199116, 'gamma': 'auto', 'kernel': 'poly'}. Best is trial 57 with value: 0.6385026737967914.
[I 2026-06-14 18:18:06,542] Trial 130 finished with value: 0.6265597147950089 and parameters: {'C': 36.53577222774549, 'gamma': 'scale', 'kernel': 'poly'}. Best is trial 57 with value: 0.6385026737967914.
[I 2026-06-14 18:18:06,579] Trial 44 finished with value: 0.6146167557932263 and parameters: {'C': 1.1362100438788338, 'gamma': 'scale', 'kernel': 'rbf'}. Best is trial 19 with value: 0.681283422459893.
[I 2026-06-14 18:18:06,735] Trial 131 finished with value: 0.6265597147950088 and parameters: {'C': 23.603793702113702, 'gamma': 'auto', 'kernel': 'poly'}. Best is trial 57 with value: 0.6385026737967914.
[I 2026-06-14 18:18:06,922] Trial 132 finished with value: 0.6265597147950088 and parameters: {'C': 19.406429035821613, 'gamma': 'auto', 'kernel': 'poly'}. Best is trial 57 with value: 0.6385026737967914.
[I 2026-06-14 18:18:07,116] Trial 133 finished with value: 0.6326203208556149 and parameters: {'C': 22.116842862692632, 'gamma': 'auto', 'kernel': 'poly'}. Best is trial 57 with value: 0.6385026737967914.
[I 2026-06-14 18:18:07,191] Trial 45 finished with value: 0.6750445632798574 and parameters: {'C': 5.263237340649046, 'gamma': 'scale', 'kernel': 'rbf'}. Best is trial 19 with value: 0.681283422459893.
[I 2026-06-14 18:18:07,302] Trial 134 finished with value: 0.6203208556149732 and parameters: {'C': 13.234856424232815, 'gamma': 'auto', 'kernel': 'poly'}. Best is trial 57 with value: 0.6385026737967914.
    [OK] Feature trill finalized!
[I 2026-06-14 18:18:07,641] Trial 46 finished with value: 0.6869875222816401 and parameters: {'C': 2.04821325600038, 'gamma': 'scale', 'kernel': 'sigmoid'}. Best is trial 46 with value: 0.6869875222816401.
[I 2026-06-14 18:18:08,085] Trial 47 finished with value: 0.680926916221034 and parameters: {'C': 1.8808060669798008, 'gamma': 'auto', 'kernel': 'sigmoid'}. Best is trial 46 with value: 0.6869875222816401.
[I 2026-06-14 18:18:08,544] Trial 48 finished with value: 0.6627450980392157 and parameters: {'C': 0.7561232818619918, 'gamma': 'auto', 'kernel': 'sigmoid'}. Best is trial 46 with value: 0.6869875222816401.
[I 2026-06-14 18:18:09,024] Trial 49 finished with value: 0.47593582887700536 and parameters: {'C': 0.0013689741983175787, 'gamma': 'auto', 'kernel': 'sigmoid'}. Best is trial 46 with value: 0.6869875222816401.
[I 2026-06-14 18:18:09,506] Trial 50 finished with value: 0.5541889483065954 and parameters: {'C': 0.15044249333657547, 'gamma': 'auto', 'kernel': 'sigmoid'}. Best is trial 46 with value: 0.6869875222816401.
[I 2026-06-14 18:18:09,950] Trial 51 finished with value: 0.674866310160428 and parameters: {'C': 1.8415982615199595, 'gamma': 'auto', 'kernel': 'sigmoid'}. Best is trial 46 with value: 0.6869875222816401.
[I 2026-06-14 18:18:10,384] Trial 52 finished with value: 0.6748663101604278 and parameters: {'C': 2.5738255749260954, 'gamma': 'auto', 'kernel': 'sigmoid'}. Best is trial 46 with value: 0.6869875222816401.
[I 2026-06-14 18:18:10,839] Trial 53 finished with value: 0.6508021390374331 and parameters: {'C': 1.4035578293045219, 'gamma': 'scale', 'kernel': 'sigmoid'}. Best is trial 46 with value: 0.6869875222816401.
[I 2026-06-14 18:18:11,298] Trial 54 finished with value: 0.6024955436720142 and parameters: {'C': 0.49133299366850625, 'gamma': 'scale', 'kernel': 'sigmoid'}. Best is trial 46 with value: 0.6869875222816401.
[I 2026-06-14 18:18:11,746] Trial 55 finished with value: 0.6445632798573975 and parameters: {'C': 0.941648355985226, 'gamma': 'scale', 'kernel': 'sigmoid'}. Best is trial 46 with value: 0.6869875222816401.
[I 2026-06-14 18:18:12,158] Trial 56 finished with value: 0.6509803921568628 and parameters: {'C': 8.4965068988864, 'gamma': 'auto', 'kernel': 'sigmoid'}. Best is trial 46 with value: 0.6869875222816401.
[I 2026-06-14 18:18:12,642] Trial 57 finished with value: 0.6023172905525846 and parameters: {'C': 4.296287508022036, 'gamma': 'scale', 'kernel': 'poly'}. Best is trial 46 with value: 0.6869875222816401.
[I 2026-06-14 18:18:13,112] Trial 58 finished with value: 0.6144385026737967 and parameters: {'C': 0.41000527643774254, 'gamma': 'scale', 'kernel': 'sigmoid'}. Best is trial 46 with value: 0.6869875222816401.
[I 2026-06-14 18:18:13,545] Trial 59 finished with value: 0.6869875222816401 and parameters: {'C': 2.0993426320537725, 'gamma': 'scale', 'kernel': 'sigmoid'}. Best is trial 46 with value: 0.6869875222816401.
[I 2026-06-14 18:18:13,991] Trial 60 finished with value: 0.674866310160428 and parameters: {'C': 1.8073977034723459, 'gamma': 'scale', 'kernel': 'sigmoid'}. Best is trial 46 with value: 0.6869875222816401.
[I 2026-06-14 18:18:14,426] Trial 61 finished with value: 0.6748663101604278 and parameters: {'C': 2.5278664340187373, 'gamma': 'scale', 'kernel': 'sigmoid'}. Best is trial 46 with value: 0.6869875222816401.
[I 2026-06-14 18:18:14,873] Trial 62 finished with value: 0.6568627450980392 and parameters: {'C': 1.4691260656836065, 'gamma': 'scale', 'kernel': 'sigmoid'}. Best is trial 46 with value: 0.6869875222816401.
[I 2026-06-14 18:18:15,334] Trial 63 finished with value: 0.6447415329768271 and parameters: {'C': 0.8779426321954336, 'gamma': 'scale', 'kernel': 'sigmoid'}. Best is trial 46 with value: 0.6869875222816401.
[I 2026-06-14 18:18:15,765] Trial 64 finished with value: 0.68698752228164 and parameters: {'C': 4.374786325017389, 'gamma': 'scale', 'kernel': 'sigmoid'}. Best is trial 46 with value: 0.6869875222816401.
[I 2026-06-14 18:18:16,190] Trial 65 finished with value: 0.693048128342246 and parameters: {'C': 4.602083195568791, 'gamma': 'scale', 'kernel': 'sigmoid'}. Best is trial 65 with value: 0.693048128342246.
[I 2026-06-14 18:18:16,621] Trial 66 finished with value: 0.7051693404634582 and parameters: {'C': 6.039223712207484, 'gamma': 'scale', 'kernel': 'sigmoid'}. Best is trial 66 with value: 0.7051693404634582.
[I 2026-06-14 18:18:17,060] Trial 67 finished with value: 0.7051693404634582 and parameters: {'C': 6.409849373085841, 'gamma': 'scale', 'kernel': 'sigmoid'}. Best is trial 66 with value: 0.7051693404634582.
[I 2026-06-14 18:18:17,498] Trial 68 finished with value: 0.7051693404634582 and parameters: {'C': 6.094930216710748, 'gamma': 'scale', 'kernel': 'sigmoid'}. Best is trial 66 with value: 0.7051693404634582.
[I 2026-06-14 18:18:17,926] Trial 69 finished with value: 0.669162210338681 and parameters: {'C': 7.023255588221971, 'gamma': 'scale', 'kernel': 'sigmoid'}. Best is trial 66 with value: 0.7051693404634582.
[I 2026-06-14 18:18:18,343] Trial 70 finished with value: 0.651336898395722 and parameters: {'C': 13.303054303084425, 'gamma': 'scale', 'kernel': 'sigmoid'}. Best is trial 66 with value: 0.7051693404634582.
[I 2026-06-14 18:18:18,763] Trial 71 finished with value: 0.6873440285204991 and parameters: {'C': 3.828758343418878, 'gamma': 'scale', 'kernel': 'sigmoid'}. Best is trial 66 with value: 0.7051693404634582.
[I 2026-06-14 18:18:19,195] Trial 72 finished with value: 0.68698752228164 and parameters: {'C': 4.414942918431307, 'gamma': 'scale', 'kernel': 'sigmoid'}. Best is trial 66 with value: 0.7051693404634582.
[I 2026-06-14 18:18:19,605] Trial 73 finished with value: 0.6449197860962567 and parameters: {'C': 9.845614320946527, 'gamma': 'scale', 'kernel': 'sigmoid'}. Best is trial 66 with value: 0.7051693404634582.
[I 2026-06-14 18:18:20,020] Trial 74 finished with value: 0.693048128342246 and parameters: {'C': 5.687660146198867, 'gamma': 'scale', 'kernel': 'sigmoid'}. Best is trial 66 with value: 0.7051693404634582.
[I 2026-06-14 18:18:20,458] Trial 75 finished with value: 0.6991087344028521 and parameters: {'C': 5.959405586469438, 'gamma': 'scale', 'kernel': 'sigmoid'}. Best is trial 66 with value: 0.7051693404634582.
[I 2026-06-14 18:18:20,841] Trial 76 finished with value: 0.6572192513368983 and parameters: {'C': 18.00726971732685, 'gamma': 'scale', 'kernel': 'sigmoid'}. Best is trial 66 with value: 0.7051693404634582.
[I 2026-06-14 18:18:21,263] Trial 77 finished with value: 0.6991087344028521 and parameters: {'C': 5.8832101814894235, 'gamma': 'scale', 'kernel': 'sigmoid'}. Best is trial 66 with value: 0.7051693404634582.
[I 2026-06-14 18:18:21,695] Trial 78 finished with value: 0.7051693404634582 and parameters: {'C': 6.376573831985485, 'gamma': 'scale', 'kernel': 'sigmoid'}. Best is trial 66 with value: 0.7051693404634582.
[I 2026-06-14 18:18:22,038] Trial 79 finished with value: 0.6026737967914438 and parameters: {'C': 32.82812286860312, 'gamma': 'scale', 'kernel': 'sigmoid'}. Best is trial 66 with value: 0.7051693404634582.
[I 2026-06-14 18:18:22,451] Trial 80 finished with value: 0.6754010695187166 and parameters: {'C': 5.584123557505005, 'gamma': 'scale', 'kernel': 'sigmoid'}. Best is trial 66 with value: 0.7051693404634582.
[I 2026-06-14 18:18:22,864] Trial 81 finished with value: 0.669162210338681 and parameters: {'C': 7.035046457167075, 'gamma': 'scale', 'kernel': 'sigmoid'}. Best is trial 66 with value: 0.7051693404634582.
[I 2026-06-14 18:18:23,273] Trial 82 finished with value: 0.6331550802139038 and parameters: {'C': 11.543778892294823, 'gamma': 'scale', 'kernel': 'sigmoid'}. Best is trial 66 with value: 0.7051693404634582.
[I 2026-06-14 18:18:23,693] Trial 83 finished with value: 0.6509803921568628 and parameters: {'C': 8.63800426341083, 'gamma': 'scale', 'kernel': 'sigmoid'}. Best is trial 66 with value: 0.7051693404634582.
[I 2026-06-14 18:18:24,112] Trial 84 finished with value: 0.6991087344028521 and parameters: {'C': 3.4147273492651347, 'gamma': 'scale', 'kernel': 'sigmoid'}. Best is trial 66 with value: 0.7051693404634582.
[I 2026-06-14 18:18:24,536] Trial 85 finished with value: 0.7051693404634582 and parameters: {'C': 6.098363058481382, 'gamma': 'scale', 'kernel': 'sigmoid'}. Best is trial 66 with value: 0.7051693404634582.
[I 2026-06-14 18:18:24,938] Trial 86 finished with value: 0.6572192513368984 and parameters: {'C': 15.691040017031616, 'gamma': 'scale', 'kernel': 'sigmoid'}. Best is trial 66 with value: 0.7051693404634582.
[I 2026-06-14 18:18:25,366] Trial 87 finished with value: 0.6991087344028521 and parameters: {'C': 3.1706130458156867, 'gamma': 'scale', 'kernel': 'sigmoid'}. Best is trial 66 with value: 0.7051693404634582.
[I 2026-06-14 18:18:25,840] Trial 88 finished with value: 0.6146167557932263 and parameters: {'C': 3.489867653075538, 'gamma': 'scale', 'kernel': 'poly'}. Best is trial 66 with value: 0.7051693404634582.
[I 2026-06-14 18:18:26,270] Trial 89 finished with value: 0.669162210338681 and parameters: {'C': 6.993472069391506, 'gamma': 'scale', 'kernel': 'sigmoid'}. Best is trial 66 with value: 0.7051693404634582.
[I 2026-06-14 18:18:26,641] Trial 90 finished with value: 0.6087344028520498 and parameters: {'C': 23.141566242866066, 'gamma': 'scale', 'kernel': 'sigmoid'}. Best is trial 66 with value: 0.7051693404634582.
[I 2026-06-14 18:18:27,078] Trial 91 finished with value: 0.6869875222816401 and parameters: {'C': 2.9417497712125784, 'gamma': 'scale', 'kernel': 'sigmoid'}. Best is trial 66 with value: 0.7051693404634582.
[I 2026-06-14 18:18:27,489] Trial 92 finished with value: 0.6390374331550802 and parameters: {'C': 11.41965418955493, 'gamma': 'scale', 'kernel': 'sigmoid'}. Best is trial 66 with value: 0.7051693404634582.
[I 2026-06-14 18:18:27,927] Trial 93 finished with value: 0.6755793226381461 and parameters: {'C': 5.735644225777134, 'gamma': 'scale', 'kernel': 'sigmoid'}. Best is trial 66 with value: 0.7051693404634582.
[I 2026-06-14 18:18:28,350] Trial 94 finished with value: 0.6388591800356507 and parameters: {'C': 9.05823321024173, 'gamma': 'scale', 'kernel': 'sigmoid'}. Best is trial 66 with value: 0.7051693404634582.
[I 2026-06-14 18:18:28,782] Trial 95 finished with value: 0.6991087344028521 and parameters: {'C': 3.2260177962637906, 'gamma': 'scale', 'kernel': 'sigmoid'}. Best is trial 66 with value: 0.7051693404634582.
[I 2026-06-14 18:18:29,221] Trial 96 finished with value: 0.6748663101604278 and parameters: {'C': 2.619033528289738, 'gamma': 'scale', 'kernel': 'sigmoid'}. Best is trial 66 with value: 0.7051693404634582.
[I 2026-06-14 18:18:29,646] Trial 97 finished with value: 0.6991087344028521 and parameters: {'C': 3.431928997190264, 'gamma': 'scale', 'kernel': 'sigmoid'}. Best is trial 66 with value: 0.7051693404634582.
[I 2026-06-14 18:18:30,086] Trial 98 finished with value: 0.693048128342246 and parameters: {'C': 5.700152844237783, 'gamma': 'scale', 'kernel': 'sigmoid'}. Best is trial 66 with value: 0.7051693404634582.
[I 2026-06-14 18:18:30,435] Trial 99 finished with value: 0.6026737967914438 and parameters: {'C': 30.54489441620747, 'gamma': 'scale', 'kernel': 'sigmoid'}. Best is trial 66 with value: 0.7051693404634582.
[I 2026-06-14 18:18:30,933] Trial 100 finished with value: 0.5789661319073084 and parameters: {'C': 1.3271567299211495, 'gamma': 'scale', 'kernel': 'poly'}. Best is trial 66 with value: 0.7051693404634582.
[I 2026-06-14 18:18:31,359] Trial 101 finished with value: 0.6991087344028521 and parameters: {'C': 3.4600603542272457, 'gamma': 'scale', 'kernel': 'sigmoid'}. Best is trial 66 with value: 0.7051693404634582.
[I 2026-06-14 18:18:31,782] Trial 102 finished with value: 0.693048128342246 and parameters: {'C': 3.078948729758019, 'gamma': 'scale', 'kernel': 'sigmoid'}. Best is trial 66 with value: 0.7051693404634582.
[I 2026-06-14 18:18:32,209] Trial 103 finished with value: 0.669162210338681 and parameters: {'C': 7.56302974116194, 'gamma': 'scale', 'kernel': 'sigmoid'}. Best is trial 66 with value: 0.7051693404634582.
[I 2026-06-14 18:18:32,625] Trial 104 finished with value: 0.693048128342246 and parameters: {'C': 3.928007345551851, 'gamma': 'scale', 'kernel': 'sigmoid'}. Best is trial 66 with value: 0.7051693404634582.
[I 2026-06-14 18:18:33,037] Trial 105 finished with value: 0.651336898395722 and parameters: {'C': 14.022471608463517, 'gamma': 'scale', 'kernel': 'sigmoid'}. Best is trial 66 with value: 0.7051693404634582.
[I 2026-06-14 18:18:33,455] Trial 106 finished with value: 0.681283422459893 and parameters: {'C': 4.743265675988109, 'gamma': 'scale', 'kernel': 'sigmoid'}. Best is trial 66 with value: 0.7051693404634582.
[I 2026-06-14 18:18:33,897] Trial 107 finished with value: 0.6627450980392157 and parameters: {'C': 1.5605466294374484, 'gamma': 'scale', 'kernel': 'sigmoid'}. Best is trial 66 with value: 0.7051693404634582.
[I 2026-06-14 18:18:34,313] Trial 108 finished with value: 0.6449197860962567 and parameters: {'C': 9.915067799607398, 'gamma': 'scale', 'kernel': 'sigmoid'}. Best is trial 66 with value: 0.7051693404634582.
[I 2026-06-14 18:18:34,740] Trial 109 finished with value: 0.693048128342246 and parameters: {'C': 6.599117403491827, 'gamma': 'scale', 'kernel': 'sigmoid'}. Best is trial 66 with value: 0.7051693404634582.
[I 2026-06-14 18:18:35,175] Trial 110 finished with value: 0.6748663101604278 and parameters: {'C': 2.6490674380591877, 'gamma': 'scale', 'kernel': 'sigmoid'}. Best is trial 66 with value: 0.7051693404634582.
[I 2026-06-14 18:18:35,611] Trial 111 finished with value: 0.693048128342246 and parameters: {'C': 3.5690411797295925, 'gamma': 'scale', 'kernel': 'sigmoid'}. Best is trial 66 with value: 0.7051693404634582.
[I 2026-06-14 18:18:36,042] Trial 112 finished with value: 0.7049910873440286 and parameters: {'C': 3.3789865705021795, 'gamma': 'scale', 'kernel': 'sigmoid'}. Best is trial 66 with value: 0.7051693404634582.
[I 2026-06-14 18:18:36,480] Trial 113 finished with value: 0.6809269162210339 and parameters: {'C': 2.292645383308559, 'gamma': 'scale', 'kernel': 'sigmoid'}. Best is trial 66 with value: 0.7051693404634582.
[I 2026-06-14 18:18:36,920] Trial 114 finished with value: 0.693048128342246 and parameters: {'C': 5.2288120984335285, 'gamma': 'scale', 'kernel': 'sigmoid'}. Best is trial 66 with value: 0.7051693404634582.
[I 2026-06-14 18:18:37,345] Trial 115 finished with value: 0.6570409982174688 and parameters: {'C': 8.16573306269044, 'gamma': 'scale', 'kernel': 'sigmoid'}. Best is trial 66 with value: 0.7051693404634582.
[I 2026-06-14 18:18:37,779] Trial 116 finished with value: 0.68698752228164 and parameters: {'C': 4.36548870180202, 'gamma': 'scale', 'kernel': 'sigmoid'}. Best is trial 66 with value: 0.7051693404634582.
[I 2026-06-14 18:18:38,199] Trial 117 finished with value: 0.6390374331550802 and parameters: {'C': 11.176453320740746, 'gamma': 'scale', 'kernel': 'sigmoid'}. Best is trial 66 with value: 0.7051693404634582.
[I 2026-06-14 18:18:38,658] Trial 118 finished with value: 0.6506238859180036 and parameters: {'C': 1.1494534344809098, 'gamma': 'scale', 'kernel': 'sigmoid'}. Best is trial 66 with value: 0.7051693404634582.
[I 2026-06-14 18:18:39,172] Trial 119 finished with value: 0.6146167557932263 and parameters: {'C': 2.906737084749107, 'gamma': 'scale', 'kernel': 'poly'}. Best is trial 66 with value: 0.7051693404634582.
[I 2026-06-14 18:18:39,602] Trial 120 finished with value: 0.7051693404634582 and parameters: {'C': 6.29531271684504, 'gamma': 'scale', 'kernel': 'sigmoid'}. Best is trial 66 with value: 0.7051693404634582.
[I 2026-06-14 18:18:40,044] Trial 121 finished with value: 0.7051693404634582 and parameters: {'C': 6.3088119543677275, 'gamma': 'scale', 'kernel': 'sigmoid'}. Best is trial 66 with value: 0.7051693404634582.
[I 2026-06-14 18:18:40,487] Trial 122 finished with value: 0.7051693404634582 and parameters: {'C': 6.134616374289211, 'gamma': 'scale', 'kernel': 'sigmoid'}. Best is trial 66 with value: 0.7051693404634582.
[I 2026-06-14 18:18:40,936] Trial 123 finished with value: 0.6991087344028521 and parameters: {'C': 6.170663134054187, 'gamma': 'scale', 'kernel': 'sigmoid'}. Best is trial 66 with value: 0.7051693404634582.
[I 2026-06-14 18:18:41,348] Trial 124 finished with value: 0.651336898395722 and parameters: {'C': 13.433153344082983, 'gamma': 'scale', 'kernel': 'sigmoid'}. Best is trial 66 with value: 0.7051693404634582.
[I 2026-06-14 18:18:41,735] Trial 125 finished with value: 0.6329768270944741 and parameters: {'C': 18.31255298495379, 'gamma': 'scale', 'kernel': 'sigmoid'}. Best is trial 66 with value: 0.7051693404634582.
[I 2026-06-14 18:18:42,189] Trial 126 finished with value: 0.669162210338681 and parameters: {'C': 7.872885607026292, 'gamma': 'scale', 'kernel': 'sigmoid'}. Best is trial 66 with value: 0.7051693404634582.
[I 2026-06-14 18:18:42,626] Trial 127 finished with value: 0.6693404634581105 and parameters: {'C': 5.029335615956161, 'gamma': 'scale', 'kernel': 'sigmoid'}. Best is trial 66 with value: 0.7051693404634582.
[I 2026-06-14 18:18:43,059] Trial 128 finished with value: 0.6449197860962567 and parameters: {'C': 9.689199209389228, 'gamma': 'scale', 'kernel': 'sigmoid'}. Best is trial 66 with value: 0.7051693404634582.
[I 2026-06-14 18:18:43,502] Trial 129 finished with value: 0.6991087344028521 and parameters: {'C': 6.560615003697653, 'gamma': 'scale', 'kernel': 'sigmoid'}. Best is trial 66 with value: 0.7051693404634582.
[I 2026-06-14 18:18:44,011] Trial 130 finished with value: 0.47593582887700536 and parameters: {'C': 0.009582684319451664, 'gamma': 'scale', 'kernel': 'sigmoid'}. Best is trial 66 with value: 0.7051693404634582.
[I 2026-06-14 18:18:44,456] Trial 131 finished with value: 0.6693404634581105 and parameters: {'C': 4.205988143528144, 'gamma': 'scale', 'kernel': 'sigmoid'}. Best is trial 66 with value: 0.7051693404634582.
[I 2026-06-14 18:18:44,910] Trial 132 finished with value: 0.6809269162210339 and parameters: {'C': 2.120393293212563, 'gamma': 'scale', 'kernel': 'sigmoid'}. Best is trial 66 with value: 0.7051693404634582.
[I 2026-06-14 18:18:45,345] Trial 133 finished with value: 0.693048128342246 and parameters: {'C': 5.5417226571868365, 'gamma': 'scale', 'kernel': 'sigmoid'}. Best is trial 66 with value: 0.7051693404634582.
[I 2026-06-14 18:18:45,789] Trial 134 finished with value: 0.669162210338681 and parameters: {'C': 7.041387381161128, 'gamma': 'scale', 'kernel': 'sigmoid'}. Best is trial 66 with value: 0.7051693404634582.
    [OK] Feature ComParE_2016_6k finalized!

======================================================================
RESULT OF ENSEMBLE (Soft Voting)
======================================================================
Global Accuracy: 0.7429
----------------------------------------------------------------------
Classification Report:
              precision    recall  f1-score   support

          HC       0.72      0.80      0.76        35
          AD       0.77      0.69      0.73        35

    accuracy                           0.74        70
   macro avg       0.75      0.74      0.74        70
weighted avg       0.75      0.74      0.74        70

======================================================================
