[I 2026-06-14 18:17:41,161] Trial 17 finished with value: 0.6146167557932263 and parameters: {'C': 87.36306620376227, 'gamma': 'scale', 'kernel': 'rbf'}. Best is trial 9 with value: 0.6388591800356506.
[I 2026-06-14 18:17:41,173] Trial 20 finished with value: 0.7163992869875223 and parameters: {'C': 0.16222224072404584, 'gamma': 'auto', 'kernel': 'sigmoid'}. Best is trial 14 with value: 0.7650623885918003.
[I 2026-06-14 18:17:41,178] Trial 23 finished with value: 0.5058823529411764 and parameters: {'C': 2.9446710634186215, 'gamma': 'scale', 'kernel': 'sigmoid'}. Best is trial 5 with value: 0.6265597147950089.
[I 2026-06-14 18:17:41,189] Trial 18 finished with value: 0.5844919786096257 and parameters: {'C': 97.47280500067627, 'gamma': 'auto', 'kernel': 'sigmoid'}. Best is trial 0 with value: 0.5969696969696969.
[I 2026-06-14 18:17:41,196] Trial 18 finished with value: 0.6147950089126559 and parameters: {'C': 0.27644651037027956, 'gamma': 'auto', 'kernel': 'poly'}. Best is trial 9 with value: 0.6388591800356506.
[I 2026-06-14 18:17:41,200] Trial 18 finished with value: 0.6450980392156863 and parameters: {'C': 33.04604633937753, 'gamma': 'scale', 'kernel': 'rbf'}. Best is trial 6 with value: 0.6629233511586453.
[I 2026-06-14 18:17:41,212] Trial 21 finished with value: 0.7470588235294118 and parameters: {'C': 0.6324227477870368, 'gamma': 'auto', 'kernel': 'sigmoid'}. Best is trial 14 with value: 0.7650623885918003.
[I 2026-06-14 18:17:41,217] Trial 24 finished with value: 0.5966131907308377 and parameters: {'C': 0.09571318488278503, 'gamma': 'scale', 'kernel': 'sigmoid'}. Best is trial 5 with value: 0.6265597147950089.
[I 2026-06-14 18:17:41,234] Trial 19 finished with value: 0.5122994652406417 and parameters: {'C': 0.07750757009001648, 'gamma': 'auto', 'kernel': 'poly'}. Best is trial 9 with value: 0.6388591800356506.
[I 2026-06-14 18:17:41,234] Trial 19 finished with value: 0.5964349376114082 and parameters: {'C': 4.676132115108104, 'gamma': 'auto', 'kernel': 'rbf'}. Best is trial 0 with value: 0.5969696969696969.
[I 2026-06-14 18:17:41,239] Trial 19 finished with value: 0.6033868092691622 and parameters: {'C': 8.916838195777146, 'gamma': 'auto', 'kernel': 'poly'}. Best is trial 6 with value: 0.6629233511586453.
[I 2026-06-14 18:17:41,249] Trial 22 finished with value: 0.7468805704099821 and parameters: {'C': 1.0680125836336805, 'gamma': 'auto', 'kernel': 'sigmoid'}. Best is trial 14 with value: 0.7650623885918003.
[I 2026-06-14 18:17:41,250] Trial 25 finished with value: 0.5417112299465241 and parameters: {'C': 8.930039866707324, 'gamma': 'scale', 'kernel': 'poly'}. Best is trial 5 with value: 0.6265597147950089.
[I 2026-06-14 18:17:41,270] Trial 20 finished with value: 0.6206773618538324 and parameters: {'C': 0.29757251961334186, 'gamma': 'auto', 'kernel': 'poly'}. Best is trial 9 with value: 0.6388591800356506.
[I 2026-06-14 18:17:41,278] Trial 20 finished with value: 0.5481283422459893 and parameters: {'C': 0.6783264815610761, 'gamma': 'auto', 'kernel': 'rbf'}. Best is trial 0 with value: 0.5969696969696969.
[I 2026-06-14 18:17:41,279] Trial 20 finished with value: 0.6083778966131906 and parameters: {'C': 1.8458043778646849, 'gamma': 'auto', 'kernel': 'sigmoid'}. Best is trial 6 with value: 0.6629233511586453.
[I 2026-06-14 18:17:41,286] Trial 26 finished with value: 0.5905525846702318 and parameters: {'C': 0.0332815277094001, 'gamma': 'scale', 'kernel': 'sigmoid'}. Best is trial 5 with value: 0.6265597147950089.
[I 2026-06-14 18:17:41,287] Trial 23 finished with value: 0.7465240641711232 and parameters: {'C': 0.38141677440651733, 'gamma': 'auto', 'kernel': 'sigmoid'}. Best is trial 14 with value: 0.7650623885918003.
[I 2026-06-14 18:17:41,304] Trial 21 finished with value: 0.6206773618538324 and parameters: {'C': 0.2970300304473911, 'gamma': 'auto', 'kernel': 'poly'}. Best is trial 9 with value: 0.6388591800356506.
[I 2026-06-14 18:17:41,322] Trial 27 finished with value: 0.6204991087344028 and parameters: {'C': 0.32236205705868615, 'gamma': 'scale', 'kernel': 'sigmoid'}. Best is trial 5 with value: 0.6265597147950089.
[I 2026-06-14 18:17:41,323] Trial 21 finished with value: 0.5969696969696969 and parameters: {'C': 32.76897644622497, 'gamma': 'auto', 'kernel': 'rbf'}. Best is trial 0 with value: 0.5969696969696969.
[I 2026-06-14 18:17:41,324] Trial 24 finished with value: 0.7288770053475936 and parameters: {'C': 2.612943728779553, 'gamma': 'auto', 'kernel': 'sigmoid'}. Best is trial 14 with value: 0.7650623885918003.
[I 2026-06-14 18:17:41,326] Trial 21 finished with value: 0.6450980392156863 and parameters: {'C': 47.87731537492446, 'gamma': 'scale', 'kernel': 'rbf'}. Best is trial 6 with value: 0.6629233511586453.
[I 2026-06-14 18:17:41,330] Trial 4 finished with value: 0.5778966131907308 and parameters: {'C': 0.8561498611271106, 'gamma': 'scale', 'kernel': 'poly'}. Best is trial 0 with value: 0.5903743315508021.
[I 2026-06-14 18:17:41,344] Trial 22 finished with value: 0.5912655971479501 and parameters: {'C': 2.3485879473327906, 'gamma': 'auto', 'kernel': 'poly'}. Best is trial 9 with value: 0.6388591800356506.
[I 2026-06-14 18:17:41,355] Trial 28 finished with value: 0.5420677361853833 and parameters: {'C': 1.6542174920975696, 'gamma': 'auto', 'kernel': 'sigmoid'}. Best is trial 5 with value: 0.6265597147950089.
[I 2026-06-14 18:17:41,356] Trial 25 finished with value: 0.6866310160427809 and parameters: {'C': 20.122631740113054, 'gamma': 'auto', 'kernel': 'sigmoid'}. Best is trial 14 with value: 0.7650623885918003.
[I 2026-06-14 18:17:41,369] Trial 22 finished with value: 0.5969696969696969 and parameters: {'C': 84.56646894493494, 'gamma': 'auto', 'kernel': 'rbf'}. Best is trial 0 with value: 0.5969696969696969.
[I 2026-06-14 18:17:41,370] Trial 22 finished with value: 0.6390374331550802 and parameters: {'C': 16.058679838802014, 'gamma': 'scale', 'kernel': 'rbf'}. Best is trial 6 with value: 0.6629233511586453.
[I 2026-06-14 18:17:41,380] Trial 23 finished with value: 0.47593582887700536 and parameters: {'C': 0.021347959955315646, 'gamma': 'auto', 'kernel': 'poly'}. Best is trial 9 with value: 0.6388591800356506.
[I 2026-06-14 18:17:41,382] Trial 29 finished with value: 0.5181818181818182 and parameters: {'C': 0.00593309369729887, 'gamma': 'auto', 'kernel': 'poly'}. Best is trial 5 with value: 0.6265597147950089.
[I 2026-06-14 18:17:41,397] Trial 26 finished with value: 0.6868092691622103 and parameters: {'C': 0.09823791950831035, 'gamma': 'auto', 'kernel': 'sigmoid'}. Best is trial 14 with value: 0.7650623885918003.
[I 2026-06-14 18:17:41,414] Trial 24 finished with value: 0.6147950089126559 and parameters: {'C': 0.23384261351289132, 'gamma': 'auto', 'kernel': 'poly'}. Best is trial 9 with value: 0.6388591800356506.
[I 2026-06-14 18:17:41,414] Trial 23 finished with value: 0.6450980392156863 and parameters: {'C': 60.5552357241276, 'gamma': 'scale', 'kernel': 'rbf'}. Best is trial 6 with value: 0.6629233511586453.
[I 2026-06-14 18:17:41,415] Trial 23 finished with value: 0.5969696969696969 and parameters: {'C': 22.430344769604417, 'gamma': 'auto', 'kernel': 'rbf'}. Best is trial 0 with value: 0.5969696969696969.
[I 2026-06-14 18:17:41,419] Trial 30 finished with value: 0.47593582887700536 and parameters: {'C': 0.0014565218609174457, 'gamma': 'scale', 'kernel': 'sigmoid'}. Best is trial 5 with value: 0.6265597147950089.
[I 2026-06-14 18:17:41,435] Trial 27 finished with value: 0.7345811051693405 and parameters: {'C': 1.7810196222083021, 'gamma': 'auto', 'kernel': 'sigmoid'}. Best is trial 14 with value: 0.7650623885918003.
[I 2026-06-14 18:17:41,455] Trial 25 finished with value: 0.6094474153297683 and parameters: {'C': 1.4773750781004251, 'gamma': 'auto', 'kernel': 'poly'}. Best is trial 9 with value: 0.6388591800356506.
[I 2026-06-14 18:17:41,456] Trial 31 finished with value: 0.6326203208556149 and parameters: {'C': 0.19711539720518612, 'gamma': 'scale', 'kernel': 'sigmoid'}. Best is trial 31 with value: 0.6326203208556149.
[I 2026-06-14 18:17:41,463] Trial 24 finished with value: 0.6450980392156863 and parameters: {'C': 98.89234678220147, 'gamma': 'scale', 'kernel': 'rbf'}. Best is trial 6 with value: 0.6629233511586453.
[I 2026-06-14 18:17:41,464] Trial 24 finished with value: 0.5969696969696969 and parameters: {'C': 53.577722096135375, 'gamma': 'auto', 'kernel': 'rbf'}. Best is trial 0 with value: 0.5969696969696969.
[I 2026-06-14 18:17:41,471] Trial 28 finished with value: 0.6807486631016042 and parameters: {'C': 0.4060007780728097, 'gamma': 'auto', 'kernel': 'rbf'}. Best is trial 14 with value: 0.7650623885918003.
[I 2026-06-14 18:17:41,491] Trial 32 finished with value: 0.5966131907308377 and parameters: {'C': 0.819469761656769, 'gamma': 'scale', 'kernel': 'sigmoid'}. Best is trial 31 with value: 0.6326203208556149.
[I 2026-06-14 18:17:41,493] Trial 26 finished with value: 0.6206773618538324 and parameters: {'C': 0.3369182230700874, 'gamma': 'auto', 'kernel': 'poly'}. Best is trial 9 with value: 0.6388591800356506.
[I 2026-06-14 18:17:41,506] Trial 25 finished with value: 0.5606060606060606 and parameters: {'C': 4.767844612336296, 'gamma': 'auto', 'kernel': 'sigmoid'}. Best is trial 0 with value: 0.5969696969696969.
[I 2026-06-14 18:17:41,506] Trial 25 finished with value: 0.6085561497326204 and parameters: {'C': 3.6727970318298553, 'gamma': 'scale', 'kernel': 'rbf'}. Best is trial 6 with value: 0.6629233511586453.
[I 2026-06-14 18:17:41,507] Trial 29 finished with value: 0.6442067736185383 and parameters: {'C': 16.029958825828636, 'gamma': 'scale', 'kernel': 'poly'}. Best is trial 14 with value: 0.7650623885918003.
[I 2026-06-14 18:17:41,528] Trial 33 finished with value: 0.5966131907308377 and parameters: {'C': 0.09822500588494039, 'gamma': 'scale', 'kernel': 'sigmoid'}. Best is trial 31 with value: 0.6326203208556149.
[I 2026-06-14 18:17:41,536] Trial 27 finished with value: 0.48770053475935826 and parameters: {'C': 0.016290926886984212, 'gamma': 'auto', 'kernel': 'sigmoid'}. Best is trial 9 with value: 0.6388591800356506.
[I 2026-06-14 18:17:41,542] Trial 30 finished with value: 0.7049910873440286 and parameters: {'C': 5.324604950304534, 'gamma': 'auto', 'kernel': 'sigmoid'}. Best is trial 14 with value: 0.7650623885918003.
[I 2026-06-14 18:17:41,551] Trial 26 finished with value: 0.6450980392156863 and parameters: {'C': 20.660516356483487, 'gamma': 'scale', 'kernel': 'rbf'}. Best is trial 6 with value: 0.6629233511586453.
[I 2026-06-14 18:17:41,556] Trial 26 finished with value: 0.5969696969696969 and parameters: {'C': 13.723919069425042, 'gamma': 'scale', 'kernel': 'rbf'}. Best is trial 0 with value: 0.5969696969696969.
[I 2026-06-14 18:17:41,564] Trial 5 finished with value: 0.6081996434937611 and parameters: {'C': 1.7184531851774518, 'gamma': 'auto', 'kernel': 'rbf'}. Best is trial 5 with value: 0.6081996434937611.
[I 2026-06-14 18:17:41,564] Trial 34 finished with value: 0.6206773618538325 and parameters: {'C': 0.27367473251589014, 'gamma': 'scale', 'kernel': 'sigmoid'}. Best is trial 31 with value: 0.6326203208556149.
[I 2026-06-14 18:17:41,572] Trial 28 finished with value: 0.48199643493761146 and parameters: {'C': 0.04452027664146111, 'gamma': 'auto', 'kernel': 'poly'}. Best is trial 9 with value: 0.6388591800356506.
[I 2026-06-14 18:17:41,578] Trial 31 finished with value: 0.7408199643493761 and parameters: {'C': 0.8115411740079147, 'gamma': 'auto', 'kernel': 'sigmoid'}. Best is trial 14 with value: 0.7650623885918003.
[I 2026-06-14 18:17:41,593] Trial 27 finished with value: 0.6147950089126559 and parameters: {'C': 0.2033740311199956, 'gamma': 'scale', 'kernel': 'rbf'}. Best is trial 6 with value: 0.6629233511586453.
[I 2026-06-14 18:17:41,599] Trial 35 finished with value: 0.49411764705882355 and parameters: {'C': 0.02127660965277677, 'gamma': 'scale', 'kernel': 'sigmoid'}. Best is trial 31 with value: 0.6326203208556149.
[I 2026-06-14 18:17:41,604] Trial 27 finished with value: 0.5969696969696969 and parameters: {'C': 39.9061132702883, 'gamma': 'auto', 'kernel': 'rbf'}. Best is trial 0 with value: 0.5969696969696969.
[I 2026-06-14 18:17:41,609] Trial 29 finished with value: 0.5910873440285205 and parameters: {'C': 5.2877707817018145, 'gamma': 'auto', 'kernel': 'poly'}. Best is trial 9 with value: 0.6388591800356506.
[I 2026-06-14 18:17:41,619] Trial 32 finished with value: 0.7468805704099821 and parameters: {'C': 0.6133058286445051, 'gamma': 'auto', 'kernel': 'sigmoid'}. Best is trial 14 with value: 0.7650623885918003.
[I 2026-06-14 18:17:41,626] Trial 1 finished with value: 0.6445632798573975 and parameters: {'C': 0.6122735940188763, 'gamma': 'scale', 'kernel': 'sigmoid'}. Best is trial 1 with value: 0.6445632798573975.
[I 2026-06-14 18:17:41,629] Trial 28 finished with value: 0.5973262032085562 and parameters: {'C': 11.097469771505523, 'gamma': 'auto', 'kernel': 'poly'}. Best is trial 6 with value: 0.6629233511586453.
[I 2026-06-14 18:17:41,630] Trial 36 finished with value: 0.47593582887700536 and parameters: {'C': 0.053463685066644964, 'gamma': 'scale', 'kernel': 'rbf'}. Best is trial 31 with value: 0.6326203208556149.
[I 2026-06-14 18:17:41,645] Trial 30 finished with value: 0.5727272727272726 and parameters: {'C': 0.19448634497246825, 'gamma': 'auto', 'kernel': 'poly'}. Best is trial 9 with value: 0.6388591800356506.
[I 2026-06-14 18:17:41,651] Trial 28 finished with value: 0.6028520499108734 and parameters: {'C': 8.217419072832154, 'gamma': 'auto', 'kernel': 'rbf'}. Best is trial 28 with value: 0.6028520499108734.
[I 2026-06-14 18:17:41,666] Trial 33 finished with value: 0.722638146167558 and parameters: {'C': 0.14215296571324634, 'gamma': 'auto', 'kernel': 'sigmoid'}. Best is trial 14 with value: 0.7650623885918003.
[I 2026-06-14 18:17:41,667] Trial 37 finished with value: 0.5966131907308377 and parameters: {'C': 0.14214787903877685, 'gamma': 'scale', 'kernel': 'sigmoid'}. Best is trial 31 with value: 0.6326203208556149.
[I 2026-06-14 18:17:41,670] Trial 29 finished with value: 0.6324420677361855 and parameters: {'C': 2.1452916916207236, 'gamma': 'auto', 'kernel': 'sigmoid'}. Best is trial 6 with value: 0.6629233511586453.
[I 2026-06-14 18:17:41,680] Trial 31 finished with value: 0.620855614973262 and parameters: {'C': 0.48615561299081195, 'gamma': 'auto', 'kernel': 'poly'}. Best is trial 9 with value: 0.6388591800356506.
[I 2026-06-14 18:17:41,696] Trial 38 finished with value: 0.6506238859180036 and parameters: {'C': 0.8670636137819506, 'gamma': 'scale', 'kernel': 'rbf'}. Best is trial 38 with value: 0.6506238859180036.
[I 2026-06-14 18:17:41,697] Trial 29 finished with value: 0.5545454545454545 and parameters: {'C': 0.6855729082207332, 'gamma': 'auto', 'kernel': 'sigmoid'}. Best is trial 28 with value: 0.6028520499108734.
[I 2026-06-14 18:17:41,700] Trial 34 finished with value: 0.6866310160427809 and parameters: {'C': 29.800714775110514, 'gamma': 'scale', 'kernel': 'sigmoid'}. Best is trial 14 with value: 0.7650623885918003.
[I 2026-06-14 18:17:41,713] Trial 30 finished with value: 0.6087344028520499 and parameters: {'C': 0.1799158361842407, 'gamma': 'scale', 'kernel': 'sigmoid'}. Best is trial 6 with value: 0.6629233511586453.
[I 2026-06-14 18:17:41,714] Trial 32 finished with value: 0.6089126559714795 and parameters: {'C': 0.8061096583620009, 'gamma': 'auto', 'kernel': 'poly'}. Best is trial 9 with value: 0.6388591800356506.
[I 2026-06-14 18:17:41,716] Trial 6 finished with value: 0.5180035650623885 and parameters: {'C': 3.968880964419145, 'gamma': 'scale', 'kernel': 'sigmoid'}. Best is trial 5 with value: 0.6081996434937611.
[I 2026-06-14 18:17:41,730] Trial 39 finished with value: 0.5966131907308377 and parameters: {'C': 4.528386110298568, 'gamma': 'scale', 'kernel': 'rbf'}. Best is trial 38 with value: 0.6506238859180036.
[I 2026-06-14 18:17:41,735] Trial 35 finished with value: 0.7288770053475936 and parameters: {'C': 2.0568563280051584, 'gamma': 'auto', 'kernel': 'sigmoid'}. Best is trial 14 with value: 0.7650623885918003.
[I 2026-06-14 18:17:41,746] Trial 30 finished with value: 0.6023172905525846 and parameters: {'C': 4.496300162108111, 'gamma': 'auto', 'kernel': 'rbf'}. Best is trial 28 with value: 0.6028520499108734.
[I 2026-06-14 18:17:41,750] Trial 33 finished with value: 0.5975044563279858 and parameters: {'C': 1.8280336906317698, 'gamma': 'auto', 'kernel': 'poly'}. Best is trial 9 with value: 0.6388591800356506.
[I 2026-06-14 18:17:41,760] Trial 40 finished with value: 0.6445632798573975 and parameters: {'C': 0.8420116913385863, 'gamma': 'scale', 'kernel': 'rbf'}. Best is trial 38 with value: 0.6506238859180036.
[I 2026-06-14 18:17:41,764] Trial 31 finished with value: 0.6450980392156863 and parameters: {'C': 85.77478013711813, 'gamma': 'scale', 'kernel': 'rbf'}. Best is trial 6 with value: 0.6629233511586453.
[I 2026-06-14 18:17:41,776] Trial 36 finished with value: 0.7406417112299465 and parameters: {'C': 0.44989712159308953, 'gamma': 'auto', 'kernel': 'sigmoid'}. Best is trial 14 with value: 0.7650623885918003.
[I 2026-06-14 18:17:41,787] Trial 34 finished with value: 0.5304812834224599 and parameters: {'C': 0.14311650120489794, 'gamma': 'auto', 'kernel': 'poly'}. Best is trial 9 with value: 0.6388591800356506.
[I 2026-06-14 18:17:41,791] Trial 31 finished with value: 0.590017825311943 and parameters: {'C': 3.8461585926083584, 'gamma': 'auto', 'kernel': 'rbf'}. Best is trial 28 with value: 0.6028520499108734.
[I 2026-06-14 18:17:41,793] Trial 41 finished with value: 0.6506238859180036 and parameters: {'C': 0.9229792539318663, 'gamma': 'scale', 'kernel': 'rbf'}. Best is trial 38 with value: 0.6506238859180036.
[I 2026-06-14 18:17:41,810] Trial 32 finished with value: 0.6450980392156863 and parameters: {'C': 38.28312879483535, 'gamma': 'scale', 'kernel': 'rbf'}. Best is trial 6 with value: 0.6629233511586453.
[I 2026-06-14 18:17:41,818] Trial 37 finished with value: 0.590017825311943 and parameters: {'C': 0.03210287875528923, 'gamma': 'scale', 'kernel': 'sigmoid'}. Best is trial 14 with value: 0.7650623885918003.
[I 2026-06-14 18:17:41,827] Trial 42 finished with value: 0.6506238859180036 and parameters: {'C': 0.897162869134102, 'gamma': 'scale', 'kernel': 'rbf'}. Best is trial 38 with value: 0.6506238859180036.
[I 2026-06-14 18:17:41,829] Trial 35 finished with value: 0.626916221033868 and parameters: {'C': 0.47749962867702056, 'gamma': 'auto', 'kernel': 'poly'}. Best is trial 9 with value: 0.6388591800356506.
[I 2026-06-14 18:17:41,839] Trial 32 finished with value: 0.6028520499108734 and parameters: {'C': 9.590700701578335, 'gamma': 'auto', 'kernel': 'rbf'}. Best is trial 28 with value: 0.6028520499108734.
[I 2026-06-14 18:17:41,856] Trial 38 finished with value: 0.6192513368983957 and parameters: {'C': 0.23986888988822808, 'gamma': 'auto', 'kernel': 'poly'}. Best is trial 14 with value: 0.7650623885918003.
[I 2026-06-14 18:17:41,859] Trial 33 finished with value: 0.6450980392156863 and parameters: {'C': 22.762322357102345, 'gamma': 'scale', 'kernel': 'rbf'}. Best is trial 6 with value: 0.6629233511586453.
[I 2026-06-14 18:17:41,862] Trial 43 finished with value: 0.6445632798573975 and parameters: {'C': 1.0516946211588456, 'gamma': 'scale', 'kernel': 'rbf'}. Best is trial 38 with value: 0.6506238859180036.
[I 2026-06-14 18:17:41,869] Trial 36 finished with value: 0.6087344028520498 and parameters: {'C': 0.5039490928927608, 'gamma': 'auto', 'kernel': 'poly'}. Best is trial 9 with value: 0.6388591800356506.
[I 2026-06-14 18:17:41,889] Trial 33 finished with value: 0.5723707664884136 and parameters: {'C': 1.0880085785418754, 'gamma': 'auto', 'kernel': 'rbf'}. Best is trial 28 with value: 0.6028520499108734.
[I 2026-06-14 18:17:41,895] Trial 44 finished with value: 0.6506238859180036 and parameters: {'C': 0.9363104800976879, 'gamma': 'scale', 'kernel': 'rbf'}. Best is trial 38 with value: 0.6506238859180036.
[I 2026-06-14 18:17:41,896] Trial 39 finished with value: 0.48770053475935826 and parameters: {'C': 0.0075943632834479, 'gamma': 'scale', 'kernel': 'rbf'}. Best is trial 14 with value: 0.7650623885918003.
[I 2026-06-14 18:17:41,905] Trial 34 finished with value: 0.620855614973262 and parameters: {'C': 6.40359228332281, 'gamma': 'scale', 'kernel': 'rbf'}. Best is trial 6 with value: 0.6629233511586453.
[I 2026-06-14 18:17:41,914] Trial 7 finished with value: 0.5602495543672015 and parameters: {'C': 0.22350145234483934, 'gamma': 'auto', 'kernel': 'sigmoid'}. Best is trial 5 with value: 0.6081996434937611.
[I 2026-06-14 18:17:41,921] Trial 37 finished with value: 0.49376114081996436 and parameters: {'C': 0.055967679329052805, 'gamma': 'auto', 'kernel': 'sigmoid'}. Best is trial 9 with value: 0.6388591800356506.
[I 2026-06-14 18:17:41,930] Trial 45 finished with value: 0.6385026737967914 and parameters: {'C': 1.9152744175452936, 'gamma': 'scale', 'kernel': 'rbf'}. Best is trial 38 with value: 0.6506238859180036.
[I 2026-06-14 18:17:41,937] Trial 40 finished with value: 0.7409982174688057 and parameters: {'C': 1.2284997372683573, 'gamma': 'auto', 'kernel': 'sigmoid'}. Best is trial 14 with value: 0.7650623885918003.
[I 2026-06-14 18:17:41,942] Trial 34 finished with value: 0.6026737967914438 and parameters: {'C': 7.44952039877704, 'gamma': 'auto', 'kernel': 'rbf'}. Best is trial 28 with value: 0.6028520499108734.
[I 2026-06-14 18:17:41,945] Trial 35 finished with value: 0.57825311942959 and parameters: {'C': 56.16691395551422, 'gamma': 'scale', 'kernel': 'sigmoid'}. Best is trial 6 with value: 0.6629233511586453.
[I 2026-06-14 18:17:41,963] Trial 46 finished with value: 0.5907308377896613 and parameters: {'C': 6.1367733595061384, 'gamma': 'scale', 'kernel': 'rbf'}. Best is trial 38 with value: 0.6506238859180036.
[I 2026-06-14 18:17:41,971] Trial 38 finished with value: 0.5910873440285205 and parameters: {'C': 5.105072984302835, 'gamma': 'auto', 'kernel': 'poly'}. Best is trial 9 with value: 0.6388591800356506.
